S-F-C&K-07,/charles-and-keith-blue-ballerina-flats-3.jpg,/charles-and-keith-blue-ballerina-flats-3.jpg,Charles and Keith Blue Ballerina Flats 3,/charles-and-keith-blue-ballerina-flats-3.jpg,Charles and Keith Blue Ballerina Flats 3,Charles and Keith Blue Ballerina Flats 3
S-F-C&K-08,/charles-and-keith-black-flat-strappy-sandals-3.jpg,/charles-and-keith-black-flat-strappy-sandals-3.jpg,Charles and Keith Black Flat Strappy Sandals 3,/charles-and-keith-black-flat-strappy-sandals-3.jpg,Charles and Keith Black Flat Strappy Sandals 3,Charles and Keith Black Flat Strappy Sandals 3
C-B-GS-09,/guess-dark-blue-skinny-jeans-3.jpg,/guess-dark-blue-skinny-jeans-3.jpg,Guess Dark Blue Skinny Jeans 3,/guess-dark-blue-skinny-jeans-3.jpg,Guess Dark Blue Skinny Jeans 3,Guess Dark Blue Skinny Jeans 3
C-B-P&B-02,/pull-&-bear-blue-floral-pants-3.jpg,/pull-&-bear-blue-floral-pants-3.jpg,Pull & Bear Blue Floral Pants 3,/pull-&-bear-blue-floral-pants-3.jpg,Pull & Bear Blue Floral Pants 3,Pull & Bear Blue Floral Pants 3
C-T-ESP-34,/esprit-blue-&-grey-printed-top-3.jpg,/esprit-blue-&-grey-printed-top-3.jpg,Esprit Blue & Grey Printed Top 3,/esprit-blue-&-grey-printed-top-3.jpg,Esprit Blue & Grey Printed Top 3,Esprit Blue & Grey Printed Top 3
C-D-TH-03,/tommy-hilfiger-blue-bird-print-dress-3.jpg,/tommy-hilfiger-blue-bird-print-dress-3.jpg,Tommy Hilfiger Blue Bird Print Dress 3,/tommy-hilfiger-blue-bird-print-dress-3.jpg,Tommy Hilfiger Blue Bird Print Dress 3,Tommy Hilfiger Blue Bird Print Dress 3
C-D-GP-06,/gap-green-dress-with-elasticated-waist-3.jpg,/gap-green-dress-with-elasticated-waist-3.jpg,Gap Green Dress With Elasticated Waist 3,/gap-green-dress-with-elasticated-waist-3.jpg,Gap Green Dress With Elasticated Waist 3,Gap Green Dress With Elasticated Waist 3
C-T-AERO-09,/aeropostale-turquoise-applique-top-3.jpg,/aeropostale-turquoise-applique-top-3.jpg,Aeropostale Turquoise Applique Top 3,/aeropostale-turquoise-applique-top-3.jpg,Aeropostale Turquoise Applique Top 3,Aeropostale Turquoise Applique Top 3
C-B-TH-06,/tommy-hilfiger-grey-skinny-jeans-3.jpg,/tommy-hilfiger-grey-skinny-jeans-3.jpg,Tommy Hilfiger Grey Skinny Jeans 3,/tommy-hilfiger-grey-skinny-jeans-3.jpg,Tommy Hilfiger Grey Skinny Jeans 3,Tommy Hilfiger Grey Skinny Jeans 3
C-B-LS-26,/levis-dark-blue-five-pocket-skinny-jeans-3.jpg,/levis-dark-blue-five-pocket-skinny-jeans-3.jpg,Levis Dark Blue Five Pocket Skinny Jeans 3,/levis-dark-blue-five-pocket-skinny-jeans-3.jpg,Levis Dark Blue Five Pocket Skinny Jeans 3,Levis Dark Blue Five Pocket Skinny Jeans 3
C-B-GP-21,/gap-dark-blue-legging-jeans-3.jpg,/gap-dark-blue-legging-jeans-3.jpg,Gap Dark Blue Legging Jeans 3,/gap-dark-blue-legging-jeans-3.jpg,Gap Dark Blue Legging Jeans 3,Gap Dark Blue Legging Jeans 3
C-B-UCB-42,/united-colors-of-benetton-blue-washed-skinny-jeans-3.jpg,/united-colors-of-benetton-blue-washed-skinny-jeans-3.jpg,United Colors of Benetton Blue Washed Skinny Jeans 3,/united-colors-of-benetton-blue-washed-skinny-jeans-3.jpg,United Colors of Benetton Blue Washed Skinny Jeans 3,United Colors of Benetton Blue Washed Skinny Jeans 3
C-B-AERO-05,/aeropostale-pink-denim-jeans-3.jpg,/aeropostale-pink-denim-jeans-3.jpg,Aeropostale Pink Denim Jeans 3,/aeropostale-pink-denim-jeans-3.jpg,Aeropostale Pink Denim Jeans 3,Aeropostale Pink Denim Jeans 3
C-B-P&B-03,/pull-&-bear-dark-blue-jeans-3.jpg,/pull-&-bear-dark-blue-jeans-3.jpg,Pull & Bear Dark Blue Jeans 3,/pull-&-bear-dark-blue-jeans-3.jpg,Pull & Bear Dark Blue Jeans 3,Pull & Bear Dark Blue Jeans 3
B-H-CPR-02,/caprese-black-satchel-bag-3.jpg,/caprese-black-satchel-bag-3.jpg,Caprese Black Satchel Bag 3,/caprese-black-satchel-bag-3.jpg,Caprese Black Satchel Bag 3,Caprese Black Satchel Bag 3
S-F-ENR-01,/enroute-brown-sandals-3.jpg,/enroute-brown-sandals-3.jpg,ENROUTE Brown Sandals 3,/enroute-brown-sandals-3.jpg,ENROUTE Brown Sandals 3,ENROUTE Brown Sandals 3
S-H-ENR-02,/enroute-black-kitten-heels-3.jpg,/enroute-black-kitten-heels-3.jpg,ENROUTE Black Kitten Heels 3,/enroute-black-kitten-heels-3.jpg,ENROUTE Black Kitten Heels 3,ENROUTE Black Kitten Heels 3
C-B-MNS-53,/marks-and-spencer-blue-printed-jeggings-3.jpg,/marks-and-spencer-blue-printed-jeggings-3.jpg,Marks and Spencer Blue Printed Jeggings 3,/marks-and-spencer-blue-printed-jeggings-3.jpg,Marks and Spencer Blue Printed Jeggings 3,Marks and Spencer Blue Printed Jeggings 3
C-T-OY-47,/only-pink-floral-spaghetti-strap-top-3.jpg,/only-pink-floral-spaghetti-strap-top-3.jpg,ONLY Pink Floral Spaghetti Strap Top 3,/only-pink-floral-spaghetti-strap-top-3.jpg,ONLY Pink Floral Spaghetti Strap Top 3,ONLY Pink Floral Spaghetti Strap Top 3
C-T-JGA-02,/jayati-goenka-blue-&-white-printed-shrug-3.jpg,/jayati-goenka-blue-&-white-printed-shrug-3.jpg,Jayati Goenka Blue & White Printed Shrug 3,/jayati-goenka-blue-&-white-printed-shrug-3.jpg,Jayati Goenka Blue & White Printed Shrug 3,Jayati Goenka Blue & White Printed Shrug 3
C-B-LS-27,/levis-blue-low-rise-skinny-jeans-3.jpg,/levis-blue-low-rise-skinny-jeans-3.jpg,Levis Blue Low Rise Skinny Jeans 3,/levis-blue-low-rise-skinny-jeans-3.jpg,Levis Blue Low Rise Skinny Jeans 3,Levis Blue Low Rise Skinny Jeans 3
C-T-ASY-26,/allen-solly-purple-striped-shirt-3.jpg,/allen-solly-purple-striped-shirt-3.jpg,Allen Solly Purple Striped Shirt 3,/allen-solly-purple-striped-shirt-3.jpg,Allen Solly Purple Striped Shirt 3,Allen Solly Purple Striped Shirt 3
C-B-RI-03,/river-island-purple-pleated-skirt-3.jpg,/river-island-purple-pleated-skirt-3.jpg,River Island Purple Pleated Skirt 3,/river-island-purple-pleated-skirt-3.jpg,River Island Purple Pleated Skirt 3,River Island Purple Pleated Skirt 3
C-B-MNG-41,/mango-black-trousers-3.jpg,/mango-black-trousers-3.jpg,Mango Black Trousers 3,/mango-black-trousers-3.jpg,Mango Black Trousers 3,Mango Black Trousers 3
C-B-TH-07,/tommy-hilfiger-blue-oval-pockets-skinny-jeans-3.jpg,/tommy-hilfiger-blue-oval-pockets-skinny-jeans-3.jpg,Tommy Hilfiger Blue Oval Pockets Skinny Jeans 3,/tommy-hilfiger-blue-oval-pockets-skinny-jeans-3.jpg,Tommy Hilfiger Blue Oval Pockets Skinny Jeans 3,Tommy Hilfiger Blue Oval Pockets Skinny Jeans 3
C-B-SO-06,/s.oliver-light-blue-straight-jeans-3.jpg,/s.oliver-light-blue-straight-jeans-3.jpg,S.Oliver Light Blue Straight Jeans 3,/s.oliver-light-blue-straight-jeans-3.jpg,S.Oliver Light Blue Straight Jeans 3,S.Oliver Light Blue Straight Jeans 3
C-B-2XTZ-01,/2-xtremz-white-&-black-striped-skirt-3.jpg,/2-xtremz-white-&-black-striped-skirt-3.jpg,2 XTREMZ White & Black Striped Skirt 3,/2-xtremz-white-&-black-striped-skirt-3.jpg,2 XTREMZ White & Black Striped Skirt 3,2 XTREMZ White & Black Striped Skirt 3
A-OT-ACC-01,/accesorize-blue-crochet-cap-with-sequins-3.jpg,/accesorize-blue-crochet-cap-with-sequins-3.jpg,Accesorize Blue Crochet Cap With Sequins 3,/accesorize-blue-crochet-cap-with-sequins-3.jpg,Accesorize Blue Crochet Cap With Sequins 3,Accesorize Blue Crochet Cap With Sequins 3
A-OT-ACC-02,/accesorize-black-cap-with-bow-3.jpg,/accesorize-black-cap-with-bow-3.jpg,Accesorize Black Cap with Bow 3,/accesorize-black-cap-with-bow-3.jpg,Accesorize Black Cap with Bow 3,Accesorize Black Cap with Bow 3
A-OT-ACC-03,/accesorize-green-&-beige-cap-3.jpg,/accesorize-green-&-beige-cap-3.jpg,Accesorize Green & Beige Cap 3,/accesorize-green-&-beige-cap-3.jpg,Accesorize Green & Beige Cap 3,Accesorize Green & Beige Cap 3
C-O-MNG-18,/mango-black-one-buttoned-jacket-3.jpg,/mango-black-one-buttoned-jacket-3.jpg,Mango Black one Buttoned Jacket 3,/mango-black-one-buttoned-jacket-3.jpg,Mango Black one Buttoned Jacket 3,Mango Black one Buttoned Jacket 3
C-T-ZA-178,/zara-green-solid-tube-top-3.jpg,/zara-green-solid-tube-top-3.jpg,Zara Green Solid Tube Top 3,/zara-green-solid-tube-top-3.jpg,Zara Green Solid Tube Top 3,Zara Green Solid Tube Top 3
C-T-FRI-01,/ferrari-black-top-with-yellow-detailing-3.jpg,/ferrari-black-top-with-yellow-detailing-3.jpg,Ferrari Black Top With Yellow Detailing 3,/ferrari-black-top-with-yellow-detailing-3.jpg,Ferrari Black Top With Yellow Detailing 3,Ferrari Black Top With Yellow Detailing 3
C-T-FRI-02,/ferrari-red-spaghetti-strap-top-3.jpg,/ferrari-red-spaghetti-strap-top-3.jpg,Ferrari Red Spaghetti Strap Top 3,/ferrari-red-spaghetti-strap-top-3.jpg,Ferrari Red Spaghetti Strap Top 3,Ferrari Red Spaghetti Strap Top 3
C-B-ZA-91,/zara-blue-&-black-panel-skirt-3.jpg,/zara-blue-&-black-panel-skirt-3.jpg,Zara Blue & Black Panel Skirt 3,/zara-blue-&-black-panel-skirt-3.jpg,Zara Blue & Black Panel Skirt 3,Zara Blue & Black Panel Skirt 3
C-D-H&M-25,/h&m-brown-printed-pleated-dress-3.jpg,/h&m-brown-printed-pleated-dress-3.jpg,H&M Brown Printed Pleated Dress 3,/h&m-brown-printed-pleated-dress-3.jpg,H&M Brown Printed Pleated Dress 3,H&M Brown Printed Pleated Dress 3
C-D-ZA-67,/zara-black-&-white-striped-dress-3.jpg,/zara-black-&-white-striped-dress-3.jpg,Zara Black & White Striped Dress 3,/zara-black-&-white-striped-dress-3.jpg,Zara Black & White Striped Dress 3,Zara Black & White Striped Dress 3
C-T-MNS-90,/marks-and-spencer-black-top-with-pleated-sleeves-3.jpg,/marks-and-spencer-black-top-with-pleated-sleeves-3.jpg,Marks and Spencer Black Top With Pleated Sleeves 3,/marks-and-spencer-black-top-with-pleated-sleeves-3.jpg,Marks and Spencer Black Top With Pleated Sleeves 3,Marks and Spencer Black Top With Pleated Sleeves 3
C-T-DP-13,/dorothy-perkins-blue-lace-peplum-top-3.jpg,/dorothy-perkins-blue-lace-peplum-top-3.jpg,Dorothy Perkins Blue Lace Peplum Top 3,/dorothy-perkins-blue-lace-peplum-top-3.jpg,Dorothy Perkins Blue Lace Peplum Top 3,Dorothy Perkins Blue Lace Peplum Top 3
C-D-NYC-02,/new-york-and-company-black-belted-dress-3.jpg,/new-york-and-company-black-belted-dress-3.jpg,New York and Company Black Belted Dress 3,/new-york-and-company-black-belted-dress-3.jpg,New York and Company Black Belted Dress 3,New York and Company Black Belted Dress 3
C-O-FN-01,/forever-new-pink-all-over-rosettes-jacket-3.jpg,/forever-new-pink-all-over-rosettes-jacket-3.jpg,Forever New Pink All Over Rosettes Jacket 3,/forever-new-pink-all-over-rosettes-jacket-3.jpg,Forever New Pink All Over Rosettes Jacket 3,Forever New Pink All Over Rosettes Jacket 3
C-T-KC-03,/kenneth-cole-orange-cowl-neck-top-3.jpg,/kenneth-cole-orange-cowl-neck-top-3.jpg,Kenneth Cole Orange Cowl Neck Top 3,/kenneth-cole-orange-cowl-neck-top-3.jpg,Kenneth Cole Orange Cowl Neck Top 3,Kenneth Cole Orange Cowl Neck Top 3
C-D-MDE-04,/madame-red-&-black-checked-dress-3.jpg,/madame-red-&-black-checked-dress-3.jpg,Madame Red & Black Checked Dress 3,/madame-red-&-black-checked-dress-3.jpg,Madame Red & Black Checked Dress 3,Madame Red & Black Checked Dress 3
C-T-TH-37,/tommy-hilfiger-yellow-round-neck-top-3.jpg,/tommy-hilfiger-yellow-round-neck-top-3.jpg,Tommy Hilfiger Yellow Round Neck Top 3,/tommy-hilfiger-yellow-round-neck-top-3.jpg,Tommy Hilfiger Yellow Round Neck Top 3,Tommy Hilfiger Yellow Round Neck Top 3
C-T-GP-18,/gap-pink-&-white-striped-sleeveless-top-3.jpg,/gap-pink-&-white-striped-sleeveless-top-3.jpg,Gap Pink & White Striped Sleeveless Top 3,/gap-pink-&-white-striped-sleeveless-top-3.jpg,Gap Pink & White Striped Sleeveless Top 3,Gap Pink & White Striped Sleeveless Top 3
C-D-RE-03,/remanika-brown-buttoned-dress-3.jpg,/remanika-brown-buttoned-dress-3.jpg,Remanika Brown Buttoned Dress 3,/remanika-brown-buttoned-dress-3.jpg,Remanika Brown Buttoned Dress 3,Remanika Brown Buttoned Dress 3
C-B-BHS-01,/british-home-store-grey-formal-skirt-3.jpg,/british-home-store-grey-formal-skirt-3.jpg,British Home Store Grey Formal Skirt 3,/british-home-store-grey-formal-skirt-3.jpg,British Home Store Grey Formal Skirt 3,British Home Store Grey Formal Skirt 3
C-T-MNG-103,/mango-black-top-with-detailing-on-sleeves-3.jpg,/mango-black-top-with-detailing-on-sleeves-3.jpg,Mango Black Top With Detailing On Sleeves 3,/mango-black-top-with-detailing-on-sleeves-3.jpg,Mango Black Top With Detailing On Sleeves 3,Mango Black Top With Detailing On Sleeves 3
C-T-VM-83,/vero-moda-fuchsia-shirt-with-golden-buttons-3.jpg,/vero-moda-fuchsia-shirt-with-golden-buttons-3.jpg,Vero Moda Fuchsia Shirt With Golden Buttons 3,/vero-moda-fuchsia-shirt-with-golden-buttons-3.jpg,Vero Moda Fuchsia Shirt With Golden Buttons 3,Vero Moda Fuchsia Shirt With Golden Buttons 3
C-T-VM-84,/vero-moda-blue-halter-neck-top-3.jpg,/vero-moda-blue-halter-neck-top-3.jpg,Vero Moda Blue Halter Neck Top 3,/vero-moda-blue-halter-neck-top-3.jpg,Vero Moda Blue Halter Neck Top 3,Vero Moda Blue Halter Neck Top 3
C-D-VM-32,/vero-moda-magenta-halter-dress-3.jpg,/vero-moda-magenta-halter-dress-3.jpg,Vero Moda Magenta Halter Dress 3,/vero-moda-magenta-halter-dress-3.jpg,Vero Moda Magenta Halter Dress 3,Vero Moda Magenta Halter Dress 3
C-D-GD-03,/global-desi-green-printed-maxi-dress-3.jpg,/global-desi-green-printed-maxi-dress-3.jpg,Global Desi Green Printed Maxi Dress 3,/global-desi-green-printed-maxi-dress-3.jpg,Global Desi Green Printed Maxi Dress 3,Global Desi Green Printed Maxi Dress 3
C-B-7F-02,/7-for-all-mankind-blue-bootcut-jeans-3.jpg,/7-for-all-mankind-blue-bootcut-jeans-3.jpg,7 for all Mankind Blue Bootcut Jeans 3,/7-for-all-mankind-blue-bootcut-jeans-3.jpg,7 for all Mankind Blue Bootcut Jeans 3,7 for all Mankind Blue Bootcut Jeans 3
C-B-7F-03,/7-for-all-mankind-blue-bootcut-jeans-with-studs-3.jpg,/7-for-all-mankind-blue-bootcut-jeans-with-studs-3.jpg,7 for all Mankind Blue Bootcut Jeans with Studs 3,/7-for-all-mankind-blue-bootcut-jeans-with-studs-3.jpg,7 for all Mankind Blue Bootcut Jeans with Studs 3,7 for all Mankind Blue Bootcut Jeans with Studs 3
C-B-7F-04,/7-for-all-mankind-blue-flared-denim-jeans-with-embellishment-3.jpg,/7-for-all-mankind-blue-flared-denim-jeans-with-embellishment-3.jpg,7 for all Mankind Blue Flared Denim Jeans With Embellishment 3,/7-for-all-mankind-blue-flared-denim-jeans-with-embellishment-3.jpg,7 for all Mankind Blue Flared Denim Jeans With Embellishment 3,7 for all Mankind Blue Flared Denim Jeans With Embellishment 3
C-B-7F-05,/7-for-all-mankind-blue-denim-jeans-with-stud-3.jpg,/7-for-all-mankind-blue-denim-jeans-with-stud-3.jpg,7 for all Mankind Blue Denim Jeans with Stud 3,/7-for-all-mankind-blue-denim-jeans-with-stud-3.jpg,7 for all Mankind Blue Denim Jeans with Stud 3,7 for all Mankind Blue Denim Jeans with Stud 3
C-T-AX-21,/armani-exchange-blue-v-neck-top-with-silver-detailing-3.jpg,/armani-exchange-blue-v-neck-top-with-silver-detailing-3.jpg,Armani Exchange Blue V-Neck Top with Silver Detailing 3,/armani-exchange-blue-v-neck-top-with-silver-detailing-3.jpg,Armani Exchange Blue V-Neck Top with Silver Detailing 3,Armani Exchange Blue V-Neck Top with Silver Detailing 3
C-T-ZA-179,/zara-orange-&-white-printed-knit-top-3.jpg,/zara-orange-&-white-printed-knit-top-3.jpg,Zara Orange & White Printed Knit Top 3,/zara-orange-&-white-printed-knit-top-3.jpg,Zara Orange & White Printed Knit Top 3,Zara Orange & White Printed Knit Top 3
C-SU-RK-64,/ritu-kumar-black-printed-&-embroidered-kurta-3.jpg,/ritu-kumar-black-printed-&-embroidered-kurta-3.jpg,Ritu Kumar Black Printed & Embroidered Kurta 3,/ritu-kumar-black-printed-&-embroidered-kurta-3.jpg,Ritu Kumar Black Printed & Embroidered Kurta 3,Ritu Kumar Black Printed & Embroidered Kurta 3
C-T-A&F-07,/abercrombie-&-fitch-pink-&-blue-striped-top-3.jpg,/abercrombie-&-fitch-pink-&-blue-striped-top-3.jpg,Abercrombie & Fitch Pink & Blue Striped Top 3,/abercrombie-&-fitch-pink-&-blue-striped-top-3.jpg,Abercrombie & Fitch Pink & Blue Striped Top 3,Abercrombie & Fitch Pink & Blue Striped Top 3
C-T-ZA-180,/zara-white-floral-blouse-3.jpg,/zara-white-floral-blouse-3.jpg,Zara White Floral Blouse 3,/zara-white-floral-blouse-3.jpg,Zara White Floral Blouse 3,Zara White Floral Blouse 3
C-T-AX-22,/armani-exchange-beige-&-black-printed-full-sleeves-top-3.jpg,/armani-exchange-beige-&-black-printed-full-sleeves-top-3.jpg,Armani Exchange Beige & Black Printed Full Sleeves Top 3,/armani-exchange-beige-&-black-printed-full-sleeves-top-3.jpg,Armani Exchange Beige & Black Printed Full Sleeves Top 3,Armani Exchange Beige & Black Printed Full Sleeves Top 3
C-T-AX-23,/armani-exchange-black-&-grey-printed-full-sleeves-top-3.jpg,/armani-exchange-black-&-grey-printed-full-sleeves-top-3.jpg,Armani Exchange Black & Grey Printed Full Sleeves Top 3,/armani-exchange-black-&-grey-printed-full-sleeves-top-3.jpg,Armani Exchange Black & Grey Printed Full Sleeves Top 3,Armani Exchange Black & Grey Printed Full Sleeves Top 3
C-T-AX-24,/armani-exchange-white-&-blue-striped-top-with-sequins-3.jpg,/armani-exchange-white-&-blue-striped-top-with-sequins-3.jpg,Armani Exchange White & Blue Striped Top With Sequins 3,/armani-exchange-white-&-blue-striped-top-with-sequins-3.jpg,Armani Exchange White & Blue Striped Top With Sequins 3,Armani Exchange White & Blue Striped Top With Sequins 3
C-T-AX-25,/armani-exchange-coral-sequined-top-3.jpg,/armani-exchange-coral-sequined-top-3.jpg,Armani Exchange Coral Sequined Top 3,/armani-exchange-coral-sequined-top-3.jpg,Armani Exchange Coral Sequined Top 3,Armani Exchange Coral Sequined Top 3
C-T-AX-26,/armani-exchange-white-round-neck-top-with-silver-detailing-3.jpg,/armani-exchange-white-round-neck-top-with-silver-detailing-3.jpg,Armani Exchange White Round Neck Top With Silver Detailing 3,/armani-exchange-white-round-neck-top-with-silver-detailing-3.jpg,Armani Exchange White Round Neck Top With Silver Detailing 3,Armani Exchange White Round Neck Top With Silver Detailing 3
C-T-A&F-08,/abercrombie-&-fitch-pink-&-white-striped-top-3.jpg,/abercrombie-&-fitch-pink-&-white-striped-top-3.jpg,Abercrombie & Fitch Pink & White Striped Top 3,/abercrombie-&-fitch-pink-&-white-striped-top-3.jpg,Abercrombie & Fitch Pink & White Striped Top 3,Abercrombie & Fitch Pink & White Striped Top 3
C-T-MK-05,/michael-kors-blue-&-white-striped-zip-shoulder-top-3.jpg,/michael-kors-blue-&-white-striped-zip-shoulder-top-3.jpg,Michael Kors Blue & White Striped Zip Shoulder Top 3,/michael-kors-blue-&-white-striped-zip-shoulder-top-3.jpg,Michael Kors Blue & White Striped Zip Shoulder Top 3,Michael Kors Blue & White Striped Zip Shoulder Top 3
C-T-AX-27,/armani-exchange-pink-cutout-shoulder-top-3.jpg,/armani-exchange-pink-cutout-shoulder-top-3.jpg,Armani Exchange Pink Cutout Shoulder Top 3,/armani-exchange-pink-cutout-shoulder-top-3.jpg,Armani Exchange Pink Cutout Shoulder Top 3,Armani Exchange Pink Cutout Shoulder Top 3
C-T-MK-06,/michael-kors-pink-chain-neckline-top-3.jpg,/michael-kors-pink-chain-neckline-top-3.jpg,Michael Kors Pink Chain Neckline Top 3,/michael-kors-pink-chain-neckline-top-3.jpg,Michael Kors Pink Chain Neckline Top 3,Michael Kors Pink Chain Neckline Top 3
C-B-ESP-10,/esprit-purple-denim-jeans-3.jpg,/esprit-purple-denim-jeans-3.jpg,Esprit Purple Denim Jeans 3,/esprit-purple-denim-jeans-3.jpg,Esprit Purple Denim Jeans 3,Esprit Purple Denim Jeans 3
C-SU-RK-65,"/ritu-kumar-black,yellow-&-pink-embroidered-kurta-3.jpg","/ritu-kumar-black,yellow-&-pink-embroidered-kurta-3.jpg","Ritu Kumar Black,Yellow & Pink Embroidered Kurta 3","/ritu-kumar-black,yellow-&-pink-embroidered-kurta-3.jpg","Ritu Kumar Black,Yellow & Pink Embroidered Kurta 3","Ritu Kumar Black,Yellow & Pink Embroidered Kurta 3"
C-T-TH-39,/tommy-hilfiger-blue-&-peach-striped-shirt-3.jpg,/tommy-hilfiger-blue-&-peach-striped-shirt-3.jpg,Tommy Hilfiger Blue & Peach Striped Shirt 3,/tommy-hilfiger-blue-&-peach-striped-shirt-3.jpg,Tommy Hilfiger Blue & Peach Striped Shirt 3,Tommy Hilfiger Blue & Peach Striped Shirt 3
B-H-DAMO-03,/da-milano-black-handbag-with-silver-handles-3.jpg,/da-milano-black-handbag-with-silver-handles-3.jpg,DA MILANO Black Handbag With Silver Handles 3,/da-milano-black-handbag-with-silver-handles-3.jpg,DA MILANO Black Handbag With Silver Handles 3,DA MILANO Black Handbag With Silver Handles 3
B-H-GS-13,/guess-brown-leather-mini-handbag-3.jpg,/guess-brown-leather-mini-handbag-3.jpg,Guess Brown Leather Mini Handbag 3,/guess-brown-leather-mini-handbag-3.jpg,Guess Brown Leather Mini Handbag 3,Guess Brown Leather Mini Handbag 3
B-H-GS-14,/guess-beige-&-grey-monogram-bag-3.jpg,/guess-beige-&-grey-monogram-bag-3.jpg,Guess Beige & Grey Monogram Bag 3,/guess-beige-&-grey-monogram-bag-3.jpg,Guess Beige & Grey Monogram Bag 3,Guess Beige & Grey Monogram Bag 3
C-T-RY-05,/roxy-multi-color-tube-top-3.jpg,/roxy-multi-color-tube-top-3.jpg,Roxy Multi Color Tube Top 3,/roxy-multi-color-tube-top-3.jpg,Roxy Multi Color Tube Top 3,Roxy Multi Color Tube Top 3
C-T-RY-06,/roxy-black-&-white-printed-tube-top-3.jpg,/roxy-black-&-white-printed-tube-top-3.jpg,Roxy Black & White Printed Tube Top 3,/roxy-black-&-white-printed-tube-top-3.jpg,Roxy Black & White Printed Tube Top 3,Roxy Black & White Printed Tube Top 3
C-B-LBD-01,/lucky-brand-blue-&-white-striped-shorts-3.jpg,/lucky-brand-blue-&-white-striped-shorts-3.jpg,Lucky Brand Blue & White Striped Shorts 3,/lucky-brand-blue-&-white-striped-shorts-3.jpg,Lucky Brand Blue & White Striped Shorts 3,Lucky Brand Blue & White Striped Shorts 3
C-O-VM-10,/vero-moda-black-mini-waistcoat-3.jpg,/vero-moda-black-mini-waistcoat-3.jpg,Vero Moda Black Mini Waistcoat 3,/vero-moda-black-mini-waistcoat-3.jpg,Vero Moda Black Mini Waistcoat 3,Vero Moda Black Mini Waistcoat 3
C-D-TH-04,/tommy-hilfiger-blue-printed-sleeveless-dress-3.jpg,/tommy-hilfiger-blue-printed-sleeveless-dress-3.jpg,Tommy Hilfiger Blue Printed Sleeveless Dress 3,/tommy-hilfiger-blue-printed-sleeveless-dress-3.jpg,Tommy Hilfiger Blue Printed Sleeveless Dress 3,Tommy Hilfiger Blue Printed Sleeveless Dress 3
C-O-MNG-19,/mango-mustard-shrug-3.jpg,/mango-mustard-shrug-3.jpg,Mango Mustard Shrug 3,/mango-mustard-shrug-3.jpg,Mango Mustard Shrug 3,Mango Mustard Shrug 3
C-T-H&M-77,/h&m-grey-crossover-top-3.jpg,/h&m-grey-crossover-top-3.jpg,H&M Grey Crossover Top 3,/h&m-grey-crossover-top-3.jpg,H&M Grey Crossover Top 3,H&M Grey Crossover Top 3
C-D-VM-33,/vero-moda-blue-dress-with-lace-detailing-at-back-3.jpg,/vero-moda-blue-dress-with-lace-detailing-at-back-3.jpg,Vero Moda Blue Dress With Lace Detailing At Back 3,/vero-moda-blue-dress-with-lace-detailing-at-back-3.jpg,Vero Moda Blue Dress With Lace Detailing At Back 3,Vero Moda Blue Dress With Lace Detailing At Back 3
C-B-EX-01,/express-dark-blue-legging-jeans-3.jpg,/express-dark-blue-legging-jeans-3.jpg,Express Dark Blue Legging Jeans 3,/express-dark-blue-legging-jeans-3.jpg,Express Dark Blue Legging Jeans 3,Express Dark Blue Legging Jeans 3
C-D-BS-07,/b-slim-black-crossover-dress-3.jpg,/b-slim-black-crossover-dress-3.jpg,B-SLIM Black Crossover Dress 3,/b-slim-black-crossover-dress-3.jpg,B-SLIM Black Crossover Dress 3,B-SLIM Black Crossover Dress 3
S-F-H&M-01,/h&m-blue-&-white-striped-loafers-3.jpg,/h&m-blue-&-white-striped-loafers-3.jpg,H&M Blue & White Striped Loafers 3,/h&m-blue-&-white-striped-loafers-3.jpg,H&M Blue & White Striped Loafers 3,H&M Blue & White Striped Loafers 3
C-T-EX-03,/express-purple-knit-top-3.jpg,/express-purple-knit-top-3.jpg,Express Purple Knit Top 3,/express-purple-knit-top-3.jpg,Express Purple Knit Top 3,Express Purple Knit Top 3
C-D-ZA-68,/zara-black-&-grey-printed-dress-3.jpg,/zara-black-&-grey-printed-dress-3.jpg,Zara Black & Grey Printed Dress 3,/zara-black-&-grey-printed-dress-3.jpg,Zara Black & Grey Printed Dress 3,Zara Black & Grey Printed Dress 3
C-D-EX-02,/express-black-&-white-striped-dress-with-red-piping-3.jpg,/express-black-&-white-striped-dress-with-red-piping-3.jpg,Express Black & White Striped Dress With Red Piping 3,/express-black-&-white-striped-dress-with-red-piping-3.jpg,Express Black & White Striped Dress With Red Piping 3,Express Black & White Striped Dress With Red Piping 3
C-D-GP-07,/gap-black-gathered-dress-3.jpg,/gap-black-gathered-dress-3.jpg,Gap Black Gathered Dress 3,/gap-black-gathered-dress-3.jpg,Gap Black Gathered Dress 3,Gap Black Gathered Dress 3
C-D-ASY-03,/allen-solly-blue-floral-sleeveless-dress-3.jpg,/allen-solly-blue-floral-sleeveless-dress-3.jpg,Allen Solly Blue Floral Sleeveless Dress 3,/allen-solly-blue-floral-sleeveless-dress-3.jpg,Allen Solly Blue Floral Sleeveless Dress 3,Allen Solly Blue Floral Sleeveless Dress 3
C-T-GS-26,/guess-black-top-with-net-detailing-3.jpg,/guess-black-top-with-net-detailing-3.jpg,Guess Black Top With Net Detailing 3,/guess-black-top-with-net-detailing-3.jpg,Guess Black Top With Net Detailing 3,Guess Black Top With Net Detailing 3
C-D-PD-16,/promod-multi-color-beaded-dress-3.jpg,/promod-multi-color-beaded-dress-3.jpg,Promod Multi Color Beaded Dress 3,/promod-multi-color-beaded-dress-3.jpg,Promod Multi Color Beaded Dress 3,Promod Multi Color Beaded Dress 3
C-T-H&M-78,/h&m-dark-blue-round-neck-top-3.jpg,/h&m-dark-blue-round-neck-top-3.jpg,H&M Dark Blue Round Neck Top 3,/h&m-dark-blue-round-neck-top-3.jpg,H&M Dark Blue Round Neck Top 3,H&M Dark Blue Round Neck Top 3
C-D-H&M-26,/h&m-black-&-grey-twisted-knot-dress-3.jpg,/h&m-black-&-grey-twisted-knot-dress-3.jpg,H&M Black & Grey Twisted Knot Dress 3,/h&m-black-&-grey-twisted-knot-dress-3.jpg,H&M Black & Grey Twisted Knot Dress 3,H&M Black & Grey Twisted Knot Dress 3
C-T-ATY-01,/armand-thiery-white-embroidered-top-3.jpg,/armand-thiery-white-embroidered-top-3.jpg,ARMAND THIERY White Embroidered Top 3,/armand-thiery-white-embroidered-top-3.jpg,ARMAND THIERY White Embroidered Top 3,ARMAND THIERY White Embroidered Top 3
C-T-MNS-91,/marks-and-spencer-orange-sleeveless-top-3.jpg,/marks-and-spencer-orange-sleeveless-top-3.jpg,Marks and Spencer Orange Sleeveless Top 3,/marks-and-spencer-orange-sleeveless-top-3.jpg,Marks and Spencer Orange Sleeveless Top 3,Marks and Spencer Orange Sleeveless Top 3
C-T-FF-10,/109°f-mint-green-&-white-top-3.jpg,/109°f-mint-green-&-white-top-3.jpg,109°F Mint Green & White Top 3,/109°f-mint-green-&-white-top-3.jpg,109°F Mint Green & White Top 3,109°F Mint Green & White Top 3
C-D-BDA-01,/bb-dakota-orange-halter-dress-3.jpg,/bb-dakota-orange-halter-dress-3.jpg,BB DAKOTA Orange Halter Dress 3,/bb-dakota-orange-halter-dress-3.jpg,BB DAKOTA Orange Halter Dress 3,BB DAKOTA Orange Halter Dress 3
