S-F-CS-04,/clarks-brown-beaded-sandals-3.jpg,/clarks-brown-beaded-sandals-3.jpg,Clarks Brown Beaded Sandals 3,/clarks-brown-beaded-sandals-3.jpg,Clarks Brown Beaded Sandals 3,Clarks Brown Beaded Sandals 3
C-D-PD-17,/promod-black-checked-sleeveless-dress-3.jpg,/promod-black-checked-sleeveless-dress-3.jpg,Promod Black Checked Sleeveless Dress 3,/promod-black-checked-sleeveless-dress-3.jpg,Promod Black Checked Sleeveless Dress 3,Promod Black Checked Sleeveless Dress 3
S-H-TE-07,/tresmode-black-peep-toe-pumps-3.jpg,/tresmode-black-peep-toe-pumps-3.jpg,TresMode Black Peep Toe Pumps 3,/tresmode-black-peep-toe-pumps-3.jpg,TresMode Black Peep Toe Pumps 3,TresMode Black Peep Toe Pumps 3
B-H-KC-02,/kenneth-cole-white-hobo-handbag-3.jpg,/kenneth-cole-white-hobo-handbag-3.jpg,Kenneth Cole White Hobo Handbag 3,/kenneth-cole-white-hobo-handbag-3.jpg,Kenneth Cole White Hobo Handbag 3,Kenneth Cole White Hobo Handbag 3
,,,,,,
S-F-C&K-07,/charles-and-keith-blue-ballerina-flats-2.jpg,/charles-and-keith-blue-ballerina-flats-2.jpg,Charles and Keith Blue Ballerina Flats 2,/charles-and-keith-blue-ballerina-flats-2.jpg,Charles and Keith Blue Ballerina Flats 2,Charles and Keith Blue Ballerina Flats 2
S-F-C&K-08,/charles-and-keith-black-flat-strappy-sandals-2.jpg,/charles-and-keith-black-flat-strappy-sandals-2.jpg,Charles and Keith Black Flat Strappy Sandals 2,/charles-and-keith-black-flat-strappy-sandals-2.jpg,Charles and Keith Black Flat Strappy Sandals 2,Charles and Keith Black Flat Strappy Sandals 2
C-B-GS-09,/guess-dark-blue-skinny-jeans-2.jpg,/guess-dark-blue-skinny-jeans-2.jpg,Guess Dark Blue Skinny Jeans 2,/guess-dark-blue-skinny-jeans-2.jpg,Guess Dark Blue Skinny Jeans 2,Guess Dark Blue Skinny Jeans 2
C-B-P&B-02,/pull-&-bear-blue-floral-pants-2.jpg,/pull-&-bear-blue-floral-pants-2.jpg,Pull & Bear Blue Floral Pants 2,/pull-&-bear-blue-floral-pants-2.jpg,Pull & Bear Blue Floral Pants 2,Pull & Bear Blue Floral Pants 2
C-T-ESP-34,/esprit-blue-&-grey-printed-top-2.jpg,/esprit-blue-&-grey-printed-top-2.jpg,Esprit Blue & Grey Printed Top 2,/esprit-blue-&-grey-printed-top-2.jpg,Esprit Blue & Grey Printed Top 2,Esprit Blue & Grey Printed Top 2
C-D-TH-03,/tommy-hilfiger-blue-bird-print-dress-2.jpg,/tommy-hilfiger-blue-bird-print-dress-2.jpg,Tommy Hilfiger Blue Bird Print Dress 2,/tommy-hilfiger-blue-bird-print-dress-2.jpg,Tommy Hilfiger Blue Bird Print Dress 2,Tommy Hilfiger Blue Bird Print Dress 2
C-D-GP-06,/gap-green-dress-with-elasticated-waist-2.jpg,/gap-green-dress-with-elasticated-waist-2.jpg,Gap Green Dress With Elasticated Waist 2,/gap-green-dress-with-elasticated-waist-2.jpg,Gap Green Dress With Elasticated Waist 2,Gap Green Dress With Elasticated Waist 2
C-T-AERO-09,/aeropostale-turquoise-applique-top-2.jpg,/aeropostale-turquoise-applique-top-2.jpg,Aeropostale Turquoise Applique Top 2,/aeropostale-turquoise-applique-top-2.jpg,Aeropostale Turquoise Applique Top 2,Aeropostale Turquoise Applique Top 2
C-B-TH-06,/tommy-hilfiger-grey-skinny-jeans-2.jpg,/tommy-hilfiger-grey-skinny-jeans-2.jpg,Tommy Hilfiger Grey Skinny Jeans 2,/tommy-hilfiger-grey-skinny-jeans-2.jpg,Tommy Hilfiger Grey Skinny Jeans 2,Tommy Hilfiger Grey Skinny Jeans 2
C-B-LS-26,/levis-dark-blue-five-pocket-skinny-jeans-2.jpg,/levis-dark-blue-five-pocket-skinny-jeans-2.jpg,Levis Dark Blue Five Pocket Skinny Jeans 2,/levis-dark-blue-five-pocket-skinny-jeans-2.jpg,Levis Dark Blue Five Pocket Skinny Jeans 2,Levis Dark Blue Five Pocket Skinny Jeans 2
C-B-GP-21,/gap-dark-blue-legging-jeans-2.jpg,/gap-dark-blue-legging-jeans-2.jpg,Gap Dark Blue Legging Jeans 2,/gap-dark-blue-legging-jeans-2.jpg,Gap Dark Blue Legging Jeans 2,Gap Dark Blue Legging Jeans 2
C-B-UCB-42,/united-colors-of-benetton-blue-washed-skinny-jeans-2.jpg,/united-colors-of-benetton-blue-washed-skinny-jeans-2.jpg,United Colors of Benetton Blue Washed Skinny Jeans 2,/united-colors-of-benetton-blue-washed-skinny-jeans-2.jpg,United Colors of Benetton Blue Washed Skinny Jeans 2,United Colors of Benetton Blue Washed Skinny Jeans 2
C-B-AERO-05,/aeropostale-pink-denim-jeans-2.jpg,/aeropostale-pink-denim-jeans-2.jpg,Aeropostale Pink Denim Jeans 2,/aeropostale-pink-denim-jeans-2.jpg,Aeropostale Pink Denim Jeans 2,Aeropostale Pink Denim Jeans 2
C-B-P&B-03,/pull-&-bear-dark-blue-jeans-2.jpg,/pull-&-bear-dark-blue-jeans-2.jpg,Pull & Bear Dark Blue Jeans 2,/pull-&-bear-dark-blue-jeans-2.jpg,Pull & Bear Dark Blue Jeans 2,Pull & Bear Dark Blue Jeans 2
B-H-CPR-02,/caprese-black-satchel-bag-2.jpg,/caprese-black-satchel-bag-2.jpg,Caprese Black Satchel Bag 2,/caprese-black-satchel-bag-2.jpg,Caprese Black Satchel Bag 2,Caprese Black Satchel Bag 2
S-F-ENR-01,/enroute-brown-sandals-2.jpg,/enroute-brown-sandals-2.jpg,ENROUTE Brown Sandals 2,/enroute-brown-sandals-2.jpg,ENROUTE Brown Sandals 2,ENROUTE Brown Sandals 2
S-H-ENR-02,/enroute-black-kitten-heels-2.jpg,/enroute-black-kitten-heels-2.jpg,ENROUTE Black Kitten Heels 2,/enroute-black-kitten-heels-2.jpg,ENROUTE Black Kitten Heels 2,ENROUTE Black Kitten Heels 2
C-B-MNS-53,/marks-and-spencer-blue-printed-jeggings-2.jpg,/marks-and-spencer-blue-printed-jeggings-2.jpg,Marks and Spencer Blue Printed Jeggings 2,/marks-and-spencer-blue-printed-jeggings-2.jpg,Marks and Spencer Blue Printed Jeggings 2,Marks and Spencer Blue Printed Jeggings 2
C-T-OY-47,/only-pink-floral-spaghetti-strap-top-2.jpg,/only-pink-floral-spaghetti-strap-top-2.jpg,ONLY Pink Floral Spaghetti Strap Top 2,/only-pink-floral-spaghetti-strap-top-2.jpg,ONLY Pink Floral Spaghetti Strap Top 2,ONLY Pink Floral Spaghetti Strap Top 2
C-T-JGA-02,/jayati-goenka-blue-&-white-printed-shrug-2.jpg,/jayati-goenka-blue-&-white-printed-shrug-2.jpg,Jayati Goenka Blue & White Printed Shrug 2,/jayati-goenka-blue-&-white-printed-shrug-2.jpg,Jayati Goenka Blue & White Printed Shrug 2,Jayati Goenka Blue & White Printed Shrug 2
C-B-LS-27,/levis-blue-low-rise-skinny-jeans-2.jpg,/levis-blue-low-rise-skinny-jeans-2.jpg,Levis Blue Low Rise Skinny Jeans 2,/levis-blue-low-rise-skinny-jeans-2.jpg,Levis Blue Low Rise Skinny Jeans 2,Levis Blue Low Rise Skinny Jeans 2
C-T-ASY-26,/allen-solly-purple-striped-shirt-2.jpg,/allen-solly-purple-striped-shirt-2.jpg,Allen Solly Purple Striped Shirt 2,/allen-solly-purple-striped-shirt-2.jpg,Allen Solly Purple Striped Shirt 2,Allen Solly Purple Striped Shirt 2
C-B-RI-03,/river-island-purple-pleated-skirt-2.jpg,/river-island-purple-pleated-skirt-2.jpg,River Island Purple Pleated Skirt 2,/river-island-purple-pleated-skirt-2.jpg,River Island Purple Pleated Skirt 2,River Island Purple Pleated Skirt 2
C-B-MNG-41,/mango-black-trousers-2.jpg,/mango-black-trousers-2.jpg,Mango Black Trousers 2,/mango-black-trousers-2.jpg,Mango Black Trousers 2,Mango Black Trousers 2
C-B-TH-07,/tommy-hilfiger-blue-oval-pockets-skinny-jeans-2.jpg,/tommy-hilfiger-blue-oval-pockets-skinny-jeans-2.jpg,Tommy Hilfiger Blue Oval Pockets Skinny Jeans 2,/tommy-hilfiger-blue-oval-pockets-skinny-jeans-2.jpg,Tommy Hilfiger Blue Oval Pockets Skinny Jeans 2,Tommy Hilfiger Blue Oval Pockets Skinny Jeans 2
C-B-SO-06,/s.oliver-light-blue-straight-jeans-2.jpg,/s.oliver-light-blue-straight-jeans-2.jpg,S.Oliver Light Blue Straight Jeans 2,/s.oliver-light-blue-straight-jeans-2.jpg,S.Oliver Light Blue Straight Jeans 2,S.Oliver Light Blue Straight Jeans 2
C-B-2XTZ-01,/2-xtremz-white-&-black-striped-skirt-2.jpg,/2-xtremz-white-&-black-striped-skirt-2.jpg,2 XTREMZ White & Black Striped Skirt 2,/2-xtremz-white-&-black-striped-skirt-2.jpg,2 XTREMZ White & Black Striped Skirt 2,2 XTREMZ White & Black Striped Skirt 2
A-OT-ACC-01,/accesorize-blue-crochet-cap-with-sequins-2.jpg,/accesorize-blue-crochet-cap-with-sequins-2.jpg,Accesorize Blue Crochet Cap With Sequins 2,/accesorize-blue-crochet-cap-with-sequins-2.jpg,Accesorize Blue Crochet Cap With Sequins 2,Accesorize Blue Crochet Cap With Sequins 2
A-OT-ACC-02,/accesorize-black-cap-with-bow-2.jpg,/accesorize-black-cap-with-bow-2.jpg,Accesorize Black Cap with Bow 2,/accesorize-black-cap-with-bow-2.jpg,Accesorize Black Cap with Bow 2,Accesorize Black Cap with Bow 2
A-OT-ACC-03,/accesorize-green-&-beige-cap-2.jpg,/accesorize-green-&-beige-cap-2.jpg,Accesorize Green & Beige Cap 2,/accesorize-green-&-beige-cap-2.jpg,Accesorize Green & Beige Cap 2,Accesorize Green & Beige Cap 2
C-O-MNG-18,/mango-black-one-buttoned-jacket-2.jpg,/mango-black-one-buttoned-jacket-2.jpg,Mango Black one Buttoned Jacket 2,/mango-black-one-buttoned-jacket-2.jpg,Mango Black one Buttoned Jacket 2,Mango Black one Buttoned Jacket 2
C-T-ZA-178,/zara-green-solid-tube-top-2.jpg,/zara-green-solid-tube-top-2.jpg,Zara Green Solid Tube Top 2,/zara-green-solid-tube-top-2.jpg,Zara Green Solid Tube Top 2,Zara Green Solid Tube Top 2
C-T-FRI-01,/ferrari-black-top-with-yellow-detailing-2.jpg,/ferrari-black-top-with-yellow-detailing-2.jpg,Ferrari Black Top With Yellow Detailing 2,/ferrari-black-top-with-yellow-detailing-2.jpg,Ferrari Black Top With Yellow Detailing 2,Ferrari Black Top With Yellow Detailing 2
C-T-FRI-02,/ferrari-red-spaghetti-strap-top-2.jpg,/ferrari-red-spaghetti-strap-top-2.jpg,Ferrari Red Spaghetti Strap Top 2,/ferrari-red-spaghetti-strap-top-2.jpg,Ferrari Red Spaghetti Strap Top 2,Ferrari Red Spaghetti Strap Top 2
C-B-ZA-91,/zara-blue-&-black-panel-skirt-2.jpg,/zara-blue-&-black-panel-skirt-2.jpg,Zara Blue & Black Panel Skirt 2,/zara-blue-&-black-panel-skirt-2.jpg,Zara Blue & Black Panel Skirt 2,Zara Blue & Black Panel Skirt 2
C-D-H&M-25,/h&m-brown-printed-pleated-dress-2.jpg,/h&m-brown-printed-pleated-dress-2.jpg,H&M Brown Printed Pleated Dress 2,/h&m-brown-printed-pleated-dress-2.jpg,H&M Brown Printed Pleated Dress 2,H&M Brown Printed Pleated Dress 2
C-D-ZA-67,/zara-black-&-white-striped-dress-2.jpg,/zara-black-&-white-striped-dress-2.jpg,Zara Black & White Striped Dress 2,/zara-black-&-white-striped-dress-2.jpg,Zara Black & White Striped Dress 2,Zara Black & White Striped Dress 2
C-T-MNS-90,/marks-and-spencer-black-top-with-pleated-sleeves-2.jpg,/marks-and-spencer-black-top-with-pleated-sleeves-2.jpg,Marks and Spencer Black Top With Pleated Sleeves 2,/marks-and-spencer-black-top-with-pleated-sleeves-2.jpg,Marks and Spencer Black Top With Pleated Sleeves 2,Marks and Spencer Black Top With Pleated Sleeves 2
C-T-DP-13,/dorothy-perkins-blue-lace-peplum-top-2.jpg,/dorothy-perkins-blue-lace-peplum-top-2.jpg,Dorothy Perkins Blue Lace Peplum Top 2,/dorothy-perkins-blue-lace-peplum-top-2.jpg,Dorothy Perkins Blue Lace Peplum Top 2,Dorothy Perkins Blue Lace Peplum Top 2
C-D-NYC-02,/new-york-and-company-black-belted-dress-2.jpg,/new-york-and-company-black-belted-dress-2.jpg,New York and Company Black Belted Dress 2,/new-york-and-company-black-belted-dress-2.jpg,New York and Company Black Belted Dress 2,New York and Company Black Belted Dress 2
C-O-FN-01,/forever-new-pink-all-over-rosettes-jacket-2.jpg,/forever-new-pink-all-over-rosettes-jacket-2.jpg,Forever New Pink All Over Rosettes Jacket 2,/forever-new-pink-all-over-rosettes-jacket-2.jpg,Forever New Pink All Over Rosettes Jacket 2,Forever New Pink All Over Rosettes Jacket 2
C-T-KC-03,/kenneth-cole-orange-cowl-neck-top-2.jpg,/kenneth-cole-orange-cowl-neck-top-2.jpg,Kenneth Cole Orange Cowl Neck Top 2,/kenneth-cole-orange-cowl-neck-top-2.jpg,Kenneth Cole Orange Cowl Neck Top 2,Kenneth Cole Orange Cowl Neck Top 2
C-D-MDE-04,/madame-red-&-black-checked-dress-2.jpg,/madame-red-&-black-checked-dress-2.jpg,Madame Red & Black Checked Dress 2,/madame-red-&-black-checked-dress-2.jpg,Madame Red & Black Checked Dress 2,Madame Red & Black Checked Dress 2
C-T-TH-37,/tommy-hilfiger-yellow-round-neck-top-2.jpg,/tommy-hilfiger-yellow-round-neck-top-2.jpg,Tommy Hilfiger Yellow Round Neck Top 2,/tommy-hilfiger-yellow-round-neck-top-2.jpg,Tommy Hilfiger Yellow Round Neck Top 2,Tommy Hilfiger Yellow Round Neck Top 2
C-T-GP-18,/gap-pink-&-white-striped-sleeveless-top-2.jpg,/gap-pink-&-white-striped-sleeveless-top-2.jpg,Gap Pink & White Striped Sleeveless Top 2,/gap-pink-&-white-striped-sleeveless-top-2.jpg,Gap Pink & White Striped Sleeveless Top 2,Gap Pink & White Striped Sleeveless Top 2
C-D-RE-03,/remanika-brown-buttoned-dress-2.jpg,/remanika-brown-buttoned-dress-2.jpg,Remanika Brown Buttoned Dress 2,/remanika-brown-buttoned-dress-2.jpg,Remanika Brown Buttoned Dress 2,Remanika Brown Buttoned Dress 2
C-B-BHS-01,/british-home-store-grey-formal-skirt-2.jpg,/british-home-store-grey-formal-skirt-2.jpg,British Home Store Grey Formal Skirt 2,/british-home-store-grey-formal-skirt-2.jpg,British Home Store Grey Formal Skirt 2,British Home Store Grey Formal Skirt 2
C-T-MNG-103,/mango-black-top-with-detailing-on-sleeves-2.jpg,/mango-black-top-with-detailing-on-sleeves-2.jpg,Mango Black Top With Detailing On Sleeves 2,/mango-black-top-with-detailing-on-sleeves-2.jpg,Mango Black Top With Detailing On Sleeves 2,Mango Black Top With Detailing On Sleeves 2
C-T-VM-83,/vero-moda-fuchsia-shirt-with-golden-buttons-2.jpg,/vero-moda-fuchsia-shirt-with-golden-buttons-2.jpg,Vero Moda Fuchsia Shirt With Golden Buttons 2,/vero-moda-fuchsia-shirt-with-golden-buttons-2.jpg,Vero Moda Fuchsia Shirt With Golden Buttons 2,Vero Moda Fuchsia Shirt With Golden Buttons 2
C-T-VM-84,/vero-moda-blue-halter-neck-top-2.jpg,/vero-moda-blue-halter-neck-top-2.jpg,Vero Moda Blue Halter Neck Top 2,/vero-moda-blue-halter-neck-top-2.jpg,Vero Moda Blue Halter Neck Top 2,Vero Moda Blue Halter Neck Top 2
C-D-VM-32,/vero-moda-magenta-halter-dress-2.jpg,/vero-moda-magenta-halter-dress-2.jpg,Vero Moda Magenta Halter Dress 2,/vero-moda-magenta-halter-dress-2.jpg,Vero Moda Magenta Halter Dress 2,Vero Moda Magenta Halter Dress 2
C-D-GD-03,/global-desi-green-printed-maxi-dress-2.jpg,/global-desi-green-printed-maxi-dress-2.jpg,Global Desi Green Printed Maxi Dress 2,/global-desi-green-printed-maxi-dress-2.jpg,Global Desi Green Printed Maxi Dress 2,Global Desi Green Printed Maxi Dress 2
C-B-7F-02,/7-for-all-mankind-blue-bootcut-jeans-2.jpg,/7-for-all-mankind-blue-bootcut-jeans-2.jpg,7 for all Mankind Blue Bootcut Jeans 2,/7-for-all-mankind-blue-bootcut-jeans-2.jpg,7 for all Mankind Blue Bootcut Jeans 2,7 for all Mankind Blue Bootcut Jeans 2
C-B-7F-03,/7-for-all-mankind-blue-bootcut-jeans-with-studs-2.jpg,/7-for-all-mankind-blue-bootcut-jeans-with-studs-2.jpg,7 for all Mankind Blue Bootcut Jeans with Studs 2,/7-for-all-mankind-blue-bootcut-jeans-with-studs-2.jpg,7 for all Mankind Blue Bootcut Jeans with Studs 2,7 for all Mankind Blue Bootcut Jeans with Studs 2
C-B-7F-04,/7-for-all-mankind-blue-flared-denim-jeans-with-embellishment-2.jpg,/7-for-all-mankind-blue-flared-denim-jeans-with-embellishment-2.jpg,7 for all Mankind Blue Flared Denim Jeans With Embellishment 2,/7-for-all-mankind-blue-flared-denim-jeans-with-embellishment-2.jpg,7 for all Mankind Blue Flared Denim Jeans With Embellishment 2,7 for all Mankind Blue Flared Denim Jeans With Embellishment 2
C-B-7F-05,/7-for-all-mankind-blue-denim-jeans-with-stud-2.jpg,/7-for-all-mankind-blue-denim-jeans-with-stud-2.jpg,7 for all Mankind Blue Denim Jeans with Stud 2,/7-for-all-mankind-blue-denim-jeans-with-stud-2.jpg,7 for all Mankind Blue Denim Jeans with Stud 2,7 for all Mankind Blue Denim Jeans with Stud 2
C-T-AX-21,/armani-exchange-blue-v-neck-top-with-silver-detailing-2.jpg,/armani-exchange-blue-v-neck-top-with-silver-detailing-2.jpg,Armani Exchange Blue V-Neck Top with Silver Detailing 2,/armani-exchange-blue-v-neck-top-with-silver-detailing-2.jpg,Armani Exchange Blue V-Neck Top with Silver Detailing 2,Armani Exchange Blue V-Neck Top with Silver Detailing 2
C-T-ZA-179,/zara-orange-&-white-printed-knit-top-2.jpg,/zara-orange-&-white-printed-knit-top-2.jpg,Zara Orange & White Printed Knit Top 2,/zara-orange-&-white-printed-knit-top-2.jpg,Zara Orange & White Printed Knit Top 2,Zara Orange & White Printed Knit Top 2
C-SU-RK-64,/ritu-kumar-black-printed-&-embroidered-kurta-2.jpg,/ritu-kumar-black-printed-&-embroidered-kurta-2.jpg,Ritu Kumar Black Printed & Embroidered Kurta 2,/ritu-kumar-black-printed-&-embroidered-kurta-2.jpg,Ritu Kumar Black Printed & Embroidered Kurta 2,Ritu Kumar Black Printed & Embroidered Kurta 2
C-T-A&F-07,/abercrombie-&-fitch-pink-&-blue-striped-top-2.jpg,/abercrombie-&-fitch-pink-&-blue-striped-top-2.jpg,Abercrombie & Fitch Pink & Blue Striped Top 2,/abercrombie-&-fitch-pink-&-blue-striped-top-2.jpg,Abercrombie & Fitch Pink & Blue Striped Top 2,Abercrombie & Fitch Pink & Blue Striped Top 2
C-T-ZA-180,/zara-white-floral-blouse-2.jpg,/zara-white-floral-blouse-2.jpg,Zara White Floral Blouse 2,/zara-white-floral-blouse-2.jpg,Zara White Floral Blouse 2,Zara White Floral Blouse 2
C-T-AX-22,/armani-exchange-beige-&-black-printed-full-sleeves-top-2.jpg,/armani-exchange-beige-&-black-printed-full-sleeves-top-2.jpg,Armani Exchange Beige & Black Printed Full Sleeves Top 2,/armani-exchange-beige-&-black-printed-full-sleeves-top-2.jpg,Armani Exchange Beige & Black Printed Full Sleeves Top 2,Armani Exchange Beige & Black Printed Full Sleeves Top 2
C-T-AX-23,/armani-exchange-black-&-grey-printed-full-sleeves-top-2.jpg,/armani-exchange-black-&-grey-printed-full-sleeves-top-2.jpg,Armani Exchange Black & Grey Printed Full Sleeves Top 2,/armani-exchange-black-&-grey-printed-full-sleeves-top-2.jpg,Armani Exchange Black & Grey Printed Full Sleeves Top 2,Armani Exchange Black & Grey Printed Full Sleeves Top 2
C-T-AX-24,/armani-exchange-white-&-blue-striped-top-with-sequins-2.jpg,/armani-exchange-white-&-blue-striped-top-with-sequins-2.jpg,Armani Exchange White & Blue Striped Top With Sequins 2,/armani-exchange-white-&-blue-striped-top-with-sequins-2.jpg,Armani Exchange White & Blue Striped Top With Sequins 2,Armani Exchange White & Blue Striped Top With Sequins 2
C-T-AX-25,/armani-exchange-coral-sequined-top-2.jpg,/armani-exchange-coral-sequined-top-2.jpg,Armani Exchange Coral Sequined Top 2,/armani-exchange-coral-sequined-top-2.jpg,Armani Exchange Coral Sequined Top 2,Armani Exchange Coral Sequined Top 2
C-T-AX-26,/armani-exchange-white-round-neck-top-with-silver-detailing-2.jpg,/armani-exchange-white-round-neck-top-with-silver-detailing-2.jpg,Armani Exchange White Round Neck Top With Silver Detailing 2,/armani-exchange-white-round-neck-top-with-silver-detailing-2.jpg,Armani Exchange White Round Neck Top With Silver Detailing 2,Armani Exchange White Round Neck Top With Silver Detailing 2
C-T-A&F-08,/abercrombie-&-fitch-pink-&-white-striped-top-2.jpg,/abercrombie-&-fitch-pink-&-white-striped-top-2.jpg,Abercrombie & Fitch Pink & White Striped Top 2,/abercrombie-&-fitch-pink-&-white-striped-top-2.jpg,Abercrombie & Fitch Pink & White Striped Top 2,Abercrombie & Fitch Pink & White Striped Top 2
C-T-MK-05,/michael-kors-blue-&-white-striped-zip-shoulder-top-2.jpg,/michael-kors-blue-&-white-striped-zip-shoulder-top-2.jpg,Michael Kors Blue & White Striped Zip Shoulder Top 2,/michael-kors-blue-&-white-striped-zip-shoulder-top-2.jpg,Michael Kors Blue & White Striped Zip Shoulder Top 2,Michael Kors Blue & White Striped Zip Shoulder Top 2
C-T-AX-27,/armani-exchange-pink-cutout-shoulder-top-2.jpg,/armani-exchange-pink-cutout-shoulder-top-2.jpg,Armani Exchange Pink Cutout Shoulder Top 2,/armani-exchange-pink-cutout-shoulder-top-2.jpg,Armani Exchange Pink Cutout Shoulder Top 2,Armani Exchange Pink Cutout Shoulder Top 2
C-T-MK-06,/michael-kors-pink-chain-neckline-top-2.jpg,/michael-kors-pink-chain-neckline-top-2.jpg,Michael Kors Pink Chain Neckline Top 2,/michael-kors-pink-chain-neckline-top-2.jpg,Michael Kors Pink Chain Neckline Top 2,Michael Kors Pink Chain Neckline Top 2
C-B-ESP-10,/esprit-purple-denim-jeans-2.jpg,/esprit-purple-denim-jeans-2.jpg,Esprit Purple Denim Jeans 2,/esprit-purple-denim-jeans-2.jpg,Esprit Purple Denim Jeans 2,Esprit Purple Denim Jeans 2
C-SU-RK-65,"/ritu-kumar-black,yellow-&-pink-embroidered-kurta-2.jpg","/ritu-kumar-black,yellow-&-pink-embroidered-kurta-2.jpg","Ritu Kumar Black,Yellow & Pink Embroidered Kurta 2","/ritu-kumar-black,yellow-&-pink-embroidered-kurta-2.jpg","Ritu Kumar Black,Yellow & Pink Embroidered Kurta 2","Ritu Kumar Black,Yellow & Pink Embroidered Kurta 2"
C-T-TH-39,/tommy-hilfiger-blue-&-peach-striped-shirt-2.jpg,/tommy-hilfiger-blue-&-peach-striped-shirt-2.jpg,Tommy Hilfiger Blue & Peach Striped Shirt 2,/tommy-hilfiger-blue-&-peach-striped-shirt-2.jpg,Tommy Hilfiger Blue & Peach Striped Shirt 2,Tommy Hilfiger Blue & Peach Striped Shirt 2
B-H-DAMO-03,/da-milano-black-handbag-with-silver-handles-2.jpg,/da-milano-black-handbag-with-silver-handles-2.jpg,DA MILANO Black Handbag With Silver Handles 2,/da-milano-black-handbag-with-silver-handles-2.jpg,DA MILANO Black Handbag With Silver Handles 2,DA MILANO Black Handbag With Silver Handles 2
B-H-GS-13,/guess-brown-leather-mini-handbag-2.jpg,/guess-brown-leather-mini-handbag-2.jpg,Guess Brown Leather Mini Handbag 2,/guess-brown-leather-mini-handbag-2.jpg,Guess Brown Leather Mini Handbag 2,Guess Brown Leather Mini Handbag 2
B-H-GS-14,/guess-beige-&-grey-monogram-bag-2.jpg,/guess-beige-&-grey-monogram-bag-2.jpg,Guess Beige & Grey Monogram Bag 2,/guess-beige-&-grey-monogram-bag-2.jpg,Guess Beige & Grey Monogram Bag 2,Guess Beige & Grey Monogram Bag 2
C-T-RY-05,/roxy-multi-color-tube-top-2.jpg,/roxy-multi-color-tube-top-2.jpg,Roxy Multi Color Tube Top 2,/roxy-multi-color-tube-top-2.jpg,Roxy Multi Color Tube Top 2,Roxy Multi Color Tube Top 2
C-T-RY-06,/roxy-black-&-white-printed-tube-top-2.jpg,/roxy-black-&-white-printed-tube-top-2.jpg,Roxy Black & White Printed Tube Top 2,/roxy-black-&-white-printed-tube-top-2.jpg,Roxy Black & White Printed Tube Top 2,Roxy Black & White Printed Tube Top 2
C-B-LBD-01,/lucky-brand-blue-&-white-striped-shorts-2.jpg,/lucky-brand-blue-&-white-striped-shorts-2.jpg,Lucky Brand Blue & White Striped Shorts 2,/lucky-brand-blue-&-white-striped-shorts-2.jpg,Lucky Brand Blue & White Striped Shorts 2,Lucky Brand Blue & White Striped Shorts 2
C-O-VM-10,/vero-moda-black-mini-waistcoat-2.jpg,/vero-moda-black-mini-waistcoat-2.jpg,Vero Moda Black Mini Waistcoat 2,/vero-moda-black-mini-waistcoat-2.jpg,Vero Moda Black Mini Waistcoat 2,Vero Moda Black Mini Waistcoat 2
C-D-TH-04,/tommy-hilfiger-blue-printed-sleeveless-dress-2.jpg,/tommy-hilfiger-blue-printed-sleeveless-dress-2.jpg,Tommy Hilfiger Blue Printed Sleeveless Dress 2,/tommy-hilfiger-blue-printed-sleeveless-dress-2.jpg,Tommy Hilfiger Blue Printed Sleeveless Dress 2,Tommy Hilfiger Blue Printed Sleeveless Dress 2
C-O-MNG-19,/mango-mustard-shrug-2.jpg,/mango-mustard-shrug-2.jpg,Mango Mustard Shrug 2,/mango-mustard-shrug-2.jpg,Mango Mustard Shrug 2,Mango Mustard Shrug 2
C-T-H&M-77,/h&m-grey-crossover-top-2.jpg,/h&m-grey-crossover-top-2.jpg,H&M Grey Crossover Top 2,/h&m-grey-crossover-top-2.jpg,H&M Grey Crossover Top 2,H&M Grey Crossover Top 2
C-D-VM-33,/vero-moda-blue-dress-with-lace-detailing-at-back-2.jpg,/vero-moda-blue-dress-with-lace-detailing-at-back-2.jpg,Vero Moda Blue Dress With Lace Detailing At Back 2,/vero-moda-blue-dress-with-lace-detailing-at-back-2.jpg,Vero Moda Blue Dress With Lace Detailing At Back 2,Vero Moda Blue Dress With Lace Detailing At Back 2
C-B-EX-01,/express-dark-blue-legging-jeans-2.jpg,/express-dark-blue-legging-jeans-2.jpg,Express Dark Blue Legging Jeans 2,/express-dark-blue-legging-jeans-2.jpg,Express Dark Blue Legging Jeans 2,Express Dark Blue Legging Jeans 2
C-D-BS-07,/b-slim-black-crossover-dress-2.jpg,/b-slim-black-crossover-dress-2.jpg,B-SLIM Black Crossover Dress 2,/b-slim-black-crossover-dress-2.jpg,B-SLIM Black Crossover Dress 2,B-SLIM Black Crossover Dress 2
S-F-H&M-01,/h&m-blue-&-white-striped-loafers-2.jpg,/h&m-blue-&-white-striped-loafers-2.jpg,H&M Blue & White Striped Loafers 2,/h&m-blue-&-white-striped-loafers-2.jpg,H&M Blue & White Striped Loafers 2,H&M Blue & White Striped Loafers 2
C-T-EX-03,/express-purple-knit-top-2.jpg,/express-purple-knit-top-2.jpg,Express Purple Knit Top 2,/express-purple-knit-top-2.jpg,Express Purple Knit Top 2,Express Purple Knit Top 2
C-D-ZA-68,/zara-black-&-grey-printed-dress-2.jpg,/zara-black-&-grey-printed-dress-2.jpg,Zara Black & Grey Printed Dress 2,/zara-black-&-grey-printed-dress-2.jpg,Zara Black & Grey Printed Dress 2,Zara Black & Grey Printed Dress 2
C-D-EX-02,/express-black-&-white-striped-dress-with-red-piping-2.jpg,/express-black-&-white-striped-dress-with-red-piping-2.jpg,Express Black & White Striped Dress With Red Piping 2,/express-black-&-white-striped-dress-with-red-piping-2.jpg,Express Black & White Striped Dress With Red Piping 2,Express Black & White Striped Dress With Red Piping 2
C-D-GP-07,/gap-black-gathered-dress-2.jpg,/gap-black-gathered-dress-2.jpg,Gap Black Gathered Dress 2,/gap-black-gathered-dress-2.jpg,Gap Black Gathered Dress 2,Gap Black Gathered Dress 2
C-D-ASY-03,/allen-solly-blue-floral-sleeveless-dress-2.jpg,/allen-solly-blue-floral-sleeveless-dress-2.jpg,Allen Solly Blue Floral Sleeveless Dress 2,/allen-solly-blue-floral-sleeveless-dress-2.jpg,Allen Solly Blue Floral Sleeveless Dress 2,Allen Solly Blue Floral Sleeveless Dress 2
C-T-GS-26,/guess-black-top-with-net-detailing-2.jpg,/guess-black-top-with-net-detailing-2.jpg,Guess Black Top With Net Detailing 2,/guess-black-top-with-net-detailing-2.jpg,Guess Black Top With Net Detailing 2,Guess Black Top With Net Detailing 2
C-D-PD-16,/promod-multi-color-beaded-dress-2.jpg,/promod-multi-color-beaded-dress-2.jpg,Promod Multi Color Beaded Dress 2,/promod-multi-color-beaded-dress-2.jpg,Promod Multi Color Beaded Dress 2,Promod Multi Color Beaded Dress 2
C-T-H&M-78,/h&m-dark-blue-round-neck-top-2.jpg,/h&m-dark-blue-round-neck-top-2.jpg,H&M Dark Blue Round Neck Top 2,/h&m-dark-blue-round-neck-top-2.jpg,H&M Dark Blue Round Neck Top 2,H&M Dark Blue Round Neck Top 2
C-D-H&M-26,/h&m-black-&-grey-twisted-knot-dress-2.jpg,/h&m-black-&-grey-twisted-knot-dress-2.jpg,H&M Black & Grey Twisted Knot Dress 2,/h&m-black-&-grey-twisted-knot-dress-2.jpg,H&M Black & Grey Twisted Knot Dress 2,H&M Black & Grey Twisted Knot Dress 2
