C-T-GS-26,/guess-black-top-with-net-detailing-1.jpg,/guess-black-top-with-net-detailing-1.jpg,Guess Black Top With Net Detailing 1,/guess-black-top-with-net-detailing-1.jpg,Guess Black Top With Net Detailing 1,Guess Black Top With Net Detailing 1
C-D-PD-16,/promod-multi-color-beaded-dress-1.jpg,/promod-multi-color-beaded-dress-1.jpg,Promod Multi Color Beaded Dress 1,/promod-multi-color-beaded-dress-1.jpg,Promod Multi Color Beaded Dress 1,Promod Multi Color Beaded Dress 1
C-T-H&M-78,/h&m-dark-blue-round-neck-top-1.jpg,/h&m-dark-blue-round-neck-top-1.jpg,H&M Dark Blue Round Neck Top 1,/h&m-dark-blue-round-neck-top-1.jpg,H&M Dark Blue Round Neck Top 1,H&M Dark Blue Round Neck Top 1
C-D-H&M-26,/h&m-black-&-grey-twisted-knot-dress-1.jpg,/h&m-black-&-grey-twisted-knot-dress-1.jpg,H&M Black & Grey Twisted Knot Dress 1,/h&m-black-&-grey-twisted-knot-dress-1.jpg,H&M Black & Grey Twisted Knot Dress 1,H&M Black & Grey Twisted Knot Dress 1
C-T-ATY-01,/armand-thiery-white-embroidered-top-1.jpg,/armand-thiery-white-embroidered-top-1.jpg,ARMAND THIERY White Embroidered Top 1,/armand-thiery-white-embroidered-top-1.jpg,ARMAND THIERY White Embroidered Top 1,ARMAND THIERY White Embroidered Top 1
C-T-MNS-91,/marks-and-spencer-orange-sleeveless-top-1.jpg,/marks-and-spencer-orange-sleeveless-top-1.jpg,Marks and Spencer Orange Sleeveless Top 1,/marks-and-spencer-orange-sleeveless-top-1.jpg,Marks and Spencer Orange Sleeveless Top 1,Marks and Spencer Orange Sleeveless Top 1
C-T-FF-10,/109°f-mint-green-&-white-top-1.jpg,/109°f-mint-green-&-white-top-1.jpg,109°F Mint Green & White Top 1,/109°f-mint-green-&-white-top-1.jpg,109°F Mint Green & White Top 1,109°F Mint Green & White Top 1
C-D-BDA-01,/bb-dakota-orange-halter-dress-1.jpg,/bb-dakota-orange-halter-dress-1.jpg,BB DAKOTA Orange Halter Dress 1,/bb-dakota-orange-halter-dress-1.jpg,BB DAKOTA Orange Halter Dress 1,BB DAKOTA Orange Halter Dress 1
S-F-CS-04,/clarks-brown-beaded-sandals-1.jpg,/clarks-brown-beaded-sandals-1.jpg,Clarks Brown Beaded Sandals 1,/clarks-brown-beaded-sandals-1.jpg,Clarks Brown Beaded Sandals 1,Clarks Brown Beaded Sandals 1
C-D-PD-17,/promod-black-checked-sleeveless-dress-1.jpg,/promod-black-checked-sleeveless-dress-1.jpg,Promod Black Checked Sleeveless Dress 1,/promod-black-checked-sleeveless-dress-1.jpg,Promod Black Checked Sleeveless Dress 1,Promod Black Checked Sleeveless Dress 1
S-H-TE-07,/tresmode-black-peep-toe-pumps-1.jpg,/tresmode-black-peep-toe-pumps-1.jpg,TresMode Black Peep Toe Pumps 1,/tresmode-black-peep-toe-pumps-1.jpg,TresMode Black Peep Toe Pumps 1,TresMode Black Peep Toe Pumps 1
B-H-KC-02,/kenneth-cole-white-hobo-handbag-1.jpg,/kenneth-cole-white-hobo-handbag-1.jpg,Kenneth Cole White Hobo Handbag 1,/kenneth-cole-white-hobo-handbag-1.jpg,Kenneth Cole White Hobo Handbag 1,Kenneth Cole White Hobo Handbag 1
,,,,,,
,,,,,,
,,,,,,