B-H-LN-01,/lanvin-brown-basket-purse-3.jpg,/lanvin-brown-basket-purse-3.jpg,Lanvin Brown Basket Purse 3,/lanvin-brown-basket-purse-3.jpg,Lanvin Brown Basket Purse 3,Lanvin Brown Basket Purse 3
A-SC-GP-01,/gap-blue-bandhej-scraf-3.jpg,/gap-blue-bandhej-scraf-3.jpg,Gap Blue Bandhej Scraf 3,/gap-blue-bandhej-scraf-3.jpg,Gap Blue Bandhej Scraf 3,Gap Blue Bandhej Scraf 3
C-O-UCB-04,/united-colors-of-benetton-blue-&-white-star-print-sweater-3.jpg,/united-colors-of-benetton-blue-&-white-star-print-sweater-3.jpg,United Colors of Benetton Blue & White Star Print Sweater 3,/united-colors-of-benetton-blue-&-white-star-print-sweater-3.jpg,United Colors of Benetton Blue & White Star Print Sweater 3,United Colors of Benetton Blue & White Star Print Sweater 3
C-B-BIZ-01,/bizarre-dark-blue-whisker-washed-jeans-3.jpg,/bizarre-dark-blue-whisker-washed-jeans-3.jpg,Bizarre Dark Blue Whisker Washed Jeans 3,/bizarre-dark-blue-whisker-washed-jeans-3.jpg,Bizarre Dark Blue Whisker Washed Jeans 3,Bizarre Dark Blue Whisker Washed Jeans 3
C-T-BIZ-07,/bizarre-black-beaded-full-sleeves-top-3.jpg,/bizarre-black-beaded-full-sleeves-top-3.jpg,Bizarre Black Beaded Full Sleeves Top 3,/bizarre-black-beaded-full-sleeves-top-3.jpg,Bizarre Black Beaded Full Sleeves Top 3,Bizarre Black Beaded Full Sleeves Top 3
C-O-UCB-05,/united-colors-of-benetton-purple-round-neck-sweater-3.jpg,/united-colors-of-benetton-purple-round-neck-sweater-3.jpg,United Colors of Benetton Purple Round Neck Sweater 3,/united-colors-of-benetton-purple-round-neck-sweater-3.jpg,United Colors of Benetton Purple Round Neck Sweater 3,United Colors of Benetton Purple Round Neck Sweater 3
C-O-MNS-05,/marks-and-spencer-red-high-neck-sweater-3.jpg,/marks-and-spencer-red-high-neck-sweater-3.jpg,Marks and Spencer Red High Neck Sweater 3,/marks-and-spencer-red-high-neck-sweater-3.jpg,Marks and Spencer Red High Neck Sweater 3,Marks and Spencer Red High Neck Sweater 3
C-B-GP-20,/gap-grey-check-boot-cut-pants-3.jpg,/gap-grey-check-boot-cut-pants-3.jpg,Gap Grey Check Boot Cut Pants 3,/gap-grey-check-boot-cut-pants-3.jpg,Gap Grey Check Boot Cut Pants 3,Gap Grey Check Boot Cut Pants 3
C-B-IN-01,/inc-international-concept-black-pants-with-zip-detailing-3.jpg,/inc-international-concept-black-pants-with-zip-detailing-3.jpg,INC International Concept Black Pants With Zip Detailing 3,/inc-international-concept-black-pants-with-zip-detailing-3.jpg,INC International Concept Black Pants With Zip Detailing 3,INC International Concept Black Pants With Zip Detailing 3
C-B-MNS-45,/marks-and-spencer-dark-blue-5-pocket-denim-jeans-3.jpg,/marks-and-spencer-dark-blue-5-pocket-denim-jeans-3.jpg,Marks and Spencer Dark Blue 5 Pocket Denim Jeans 3,/marks-and-spencer-dark-blue-5-pocket-denim-jeans-3.jpg,Marks and Spencer Dark Blue 5 Pocket Denim Jeans 3,Marks and Spencer Dark Blue 5 Pocket Denim Jeans 3
C-T-GS-23,/guess-blue-knit-collar-shirt-3.jpg,/guess-blue-knit-collar-shirt-3.jpg,Guess Blue Knit Collar Shirt 3,/guess-blue-knit-collar-shirt-3.jpg,Guess Blue Knit Collar Shirt 3,Guess Blue Knit Collar Shirt 3
C-B-VM-14,/vero-moda-black-zip-leggings-3.jpg,/vero-moda-black-zip-leggings-3.jpg,Vero Moda Black Zip Leggings 3,/vero-moda-black-zip-leggings-3.jpg,Vero Moda Black Zip Leggings 3,Vero Moda Black Zip Leggings 3
C-B-VM-15,/vero-moda-navy-blue-pleated-pants-3.jpg,/vero-moda-navy-blue-pleated-pants-3.jpg,Vero Moda Navy Blue Pleated Pants 3,/vero-moda-navy-blue-pleated-pants-3.jpg,Vero Moda Navy Blue Pleated Pants 3,Vero Moda Navy Blue Pleated Pants 3
C-T-MNG-85,/mango-maroon-full-sleeves-top-3.jpg,/mango-maroon-full-sleeves-top-3.jpg,Mango Maroon Full Sleeves Top 3,/mango-maroon-full-sleeves-top-3.jpg,Mango Maroon Full Sleeves Top 3,Mango Maroon Full Sleeves Top 3
C-D-DP-08,/dorothy-perkins-black-&-white-dress-3.jpg,/dorothy-perkins-black-&-white-dress-3.jpg,Dorothy Perkins Black & White Dress 3,/dorothy-perkins-black-&-white-dress-3.jpg,Dorothy Perkins Black & White Dress 3,Dorothy Perkins Black & White Dress 3
C-B-VM-16,/vero-moda-black-chino-shorts-3.jpg,/vero-moda-black-chino-shorts-3.jpg,Vero Moda Black Chino Shorts 3,/vero-moda-black-chino-shorts-3.jpg,Vero Moda Black Chino Shorts 3,Vero Moda Black Chino Shorts 3
C-T-DP-12,/dorothy-perkins-navy-blue-top-with-lace-detailing-3.jpg,/dorothy-perkins-navy-blue-top-with-lace-detailing-3.jpg,Dorothy Perkins Navy Blue Top With Lace Detailing 3,/dorothy-perkins-navy-blue-top-with-lace-detailing-3.jpg,Dorothy Perkins Navy Blue Top With Lace Detailing 3,Dorothy Perkins Navy Blue Top With Lace Detailing 3
C-D-DP-09,/dorothy-perkins-plum-&-black-dress-3.jpg,/dorothy-perkins-plum-&-black-dress-3.jpg,Dorothy Perkins Plum & Black Dress 3,/dorothy-perkins-plum-&-black-dress-3.jpg,Dorothy Perkins Plum & Black Dress 3,Dorothy Perkins Plum & Black Dress 3
C-B-ZA-71,/zara-white-&-blue-heart-print-skirt-3.jpg,/zara-white-&-blue-heart-print-skirt-3.jpg,Zara White & Blue Heart Print Skirt 3,/zara-white-&-blue-heart-print-skirt-3.jpg,Zara White & Blue Heart Print Skirt 3,Zara White & Blue Heart Print Skirt 3
C-O-OY-03,/only-beige-puffer-jacket-3.jpg,/only-beige-puffer-jacket-3.jpg,ONLY Beige Puffer Jacket 3,/only-beige-puffer-jacket-3.jpg,ONLY Beige Puffer Jacket 3,ONLY Beige Puffer Jacket 3
C-B-FN-05,/forever-new-pink-&-blue-pleated-skirt-3.jpg,/forever-new-pink-&-blue-pleated-skirt-3.jpg,Forever New Pink & Blue Pleated Skirt 3,/forever-new-pink-&-blue-pleated-skirt-3.jpg,Forever New Pink & Blue Pleated Skirt 3,Forever New Pink & Blue Pleated Skirt 3
C-J-ZA-06,/zara-black-crossover-jumpsuit-3.jpg,/zara-black-crossover-jumpsuit-3.jpg,Zara Black Crossover Jumpsuit 3,/zara-black-crossover-jumpsuit-3.jpg,Zara Black Crossover Jumpsuit 3,Zara Black Crossover Jumpsuit 3
C-D-FN-13,/forever-new-blue-tube-dress-3.jpg,/forever-new-blue-tube-dress-3.jpg,Forever New Blue Tube Dress 3,/forever-new-blue-tube-dress-3.jpg,Forever New Blue Tube Dress 3,Forever New Blue Tube Dress 3
C-B-ZA-72,/zara-purple-&-white-printed-skirt-3.jpg,/zara-purple-&-white-printed-skirt-3.jpg,Zara Purple & White Printed Skirt 3,/zara-purple-&-white-printed-skirt-3.jpg,Zara Purple & White Printed Skirt 3,Zara Purple & White Printed Skirt 3
C-D-OXYG-02,/oxygene-black-&-white-printed-one-shoulder-dress-3.jpg,/oxygene-black-&-white-printed-one-shoulder-dress-3.jpg,Oxygene Black & White Printed One Shoulder Dress 3,/oxygene-black-&-white-printed-one-shoulder-dress-3.jpg,Oxygene Black & White Printed One Shoulder Dress 3,Oxygene Black & White Printed One Shoulder Dress 3
C-B-FN-06,/forever-new-white-straight-skirt-3.jpg,/forever-new-white-straight-skirt-3.jpg,Forever New White Straight Skirt 3,/forever-new-white-straight-skirt-3.jpg,Forever New White Straight Skirt 3,Forever New White Straight Skirt 3
C-D-ZA-60,/zara-black-spaghetti-strap-dress-3.jpg,/zara-black-spaghetti-strap-dress-3.jpg,Zara Black Spaghetti Strap Dress 3,/zara-black-spaghetti-strap-dress-3.jpg,Zara Black Spaghetti Strap Dress 3,Zara Black Spaghetti Strap Dress 3
C-D-H&M-18,/h&m-black-&-white-spaghetti-strap-maxi-dress-3.jpg,/h&m-black-&-white-spaghetti-strap-maxi-dress-3.jpg,H&M Black & White Spaghetti Strap Maxi Dress 3,/h&m-black-&-white-spaghetti-strap-maxi-dress-3.jpg,H&M Black & White Spaghetti Strap Maxi Dress 3,H&M Black & White Spaghetti Strap Maxi Dress 3
C-T-MNG-86,/mango-grey-sequins-tank-top-3.jpg,/mango-grey-sequins-tank-top-3.jpg,Mango Grey Sequins Tank Top 3,/mango-grey-sequins-tank-top-3.jpg,Mango Grey Sequins Tank Top 3,Mango Grey Sequins Tank Top 3
C-T-GP-16,/gap-blue-striped-spaghetti-strap-top-3.jpg,/gap-blue-striped-spaghetti-strap-top-3.jpg,Gap Blue Striped Spaghetti Strap Top 3,/gap-blue-striped-spaghetti-strap-top-3.jpg,Gap Blue Striped Spaghetti Strap Top 3,Gap Blue Striped Spaghetti Strap Top 3
C-T-FN-09,/forever-new-golden-&-brown-spaghetti-strap-top-3.jpg,/forever-new-golden-&-brown-spaghetti-strap-top-3.jpg,Forever New Golden & Brown Spaghetti Strap Top 3,/forever-new-golden-&-brown-spaghetti-strap-top-3.jpg,Forever New Golden & Brown Spaghetti Strap Top 3,Forever New Golden & Brown Spaghetti Strap Top 3
C-T-CK-16,/calvin-klein-black-sleeveless-drape-top-3.jpg,/calvin-klein-black-sleeveless-drape-top-3.jpg,Calvin Klein Black Sleeveless Drape Top 3,/calvin-klein-black-sleeveless-drape-top-3.jpg,Calvin Klein Black Sleeveless Drape Top 3,Calvin Klein Black Sleeveless Drape Top 3
C-D-FN-14,/forever-new-black-one-shoulder-dress-with-bow-3.jpg,/forever-new-black-one-shoulder-dress-with-bow-3.jpg,Forever New Black One Shoulder Dress With Bow 3,/forever-new-black-one-shoulder-dress-with-bow-3.jpg,Forever New Black One Shoulder Dress With Bow 3,Forever New Black One Shoulder Dress With Bow 3
C-T-VM-67,/vero-moda-white-blouson-top-3.jpg,/vero-moda-white-blouson-top-3.jpg,Vero Moda White Blouson Top 3,/vero-moda-white-blouson-top-3.jpg,Vero Moda White Blouson Top 3,Vero Moda White Blouson Top 3
C-T-BSK-13,/bershka-white-black-print-tank-top-3.jpg,/bershka-white-black-print-tank-top-3.jpg,Bershka White Black Print Tank Top 3,/bershka-white-black-print-tank-top-3.jpg,Bershka White Black Print Tank Top 3,Bershka White Black Print Tank Top 3
C-T-EHY-12,/ed-hardy-purple-printed-spaghetti-strap-top-3.jpg,/ed-hardy-purple-printed-spaghetti-strap-top-3.jpg,Ed Hardy Purple Printed Spaghetti Strap Top 3,/ed-hardy-purple-printed-spaghetti-strap-top-3.jpg,Ed Hardy Purple Printed Spaghetti Strap Top 3,Ed Hardy Purple Printed Spaghetti Strap Top 3
C-T-ADS-17,/adidas-black-polo-t-shirt-with-white-detailing-3.jpg,/adidas-black-polo-t-shirt-with-white-detailing-3.jpg,Adidas Black Polo T-Shirt With White Detailing 3,/adidas-black-polo-t-shirt-with-white-detailing-3.jpg,Adidas Black Polo T-Shirt With White Detailing 3,Adidas Black Polo T-Shirt With White Detailing 3
C-SU-WISH-01,/wishful-by-w-turquoise-kurti-with-black-embroidery-3.jpg,/wishful-by-w-turquoise-kurti-with-black-embroidery-3.jpg,Wishful by W Turquoise Kurti With Black Embroidery 3,/wishful-by-w-turquoise-kurti-with-black-embroidery-3.jpg,Wishful by W Turquoise Kurti With Black Embroidery 3,Wishful by W Turquoise Kurti With Black Embroidery 3
C-D-DP-10,/dorothy-perkins-peach-&-black-spaghetti-strap-dress-3.jpg,/dorothy-perkins-peach-&-black-spaghetti-strap-dress-3.jpg,Dorothy Perkins Peach & Black Spaghetti Strap Dress 3,/dorothy-perkins-peach-&-black-spaghetti-strap-dress-3.jpg,Dorothy Perkins Peach & Black Spaghetti Strap Dress 3,Dorothy Perkins Peach & Black Spaghetti Strap Dress 3
C-T-PD-45,/promod-black-waistcoat-3.jpg,/promod-black-waistcoat-3.jpg,Promod Black Waistcoat 3,/promod-black-waistcoat-3.jpg,Promod Black Waistcoat 3,Promod Black Waistcoat 3
C-T-S-11,/sisley-green-cutwork-shirt-3.jpg,/sisley-green-cutwork-shirt-3.jpg,Sisley Green Cutwork Shirt 3,/sisley-green-cutwork-shirt-3.jpg,Sisley Green Cutwork Shirt 3,Sisley Green Cutwork Shirt 3
C-T-VM-68,/vero-moda-maroon-full-sleeves-top-3.jpg,/vero-moda-maroon-full-sleeves-top-3.jpg,Vero Moda Maroon Full Sleeves Top 3,/vero-moda-maroon-full-sleeves-top-3.jpg,Vero Moda Maroon Full Sleeves Top 3,Vero Moda Maroon Full Sleeves Top 3
C-T-ZA-158,/zara-grey-&-pink-floral-top-3.jpg,/zara-grey-&-pink-floral-top-3.jpg,Zara Grey & Pink Floral Top 3,/zara-grey-&-pink-floral-top-3.jpg,Zara Grey & Pink Floral Top 3,Zara Grey & Pink Floral Top 3
C-T-ZA-159,/zara-black-&-white-striped-top-3.jpg,/zara-black-&-white-striped-top-3.jpg,Zara Black & White Striped Top 3,/zara-black-&-white-striped-top-3.jpg,Zara Black & White Striped Top 3,Zara Black & White Striped Top 3
C-T-OY-42,/only-pink-&-green-floral-top-3.jpg,/only-pink-&-green-floral-top-3.jpg,ONLY Pink & Green Floral Top 3,/only-pink-&-green-floral-top-3.jpg,ONLY Pink & Green Floral Top 3,ONLY Pink & Green Floral Top 3
C-D-CYJ-06,/chemistry-jeans-blue-dress-with-studs-3.jpg,/chemistry-jeans-blue-dress-with-studs-3.jpg,Chemistry Jeans Blue Dress With Studs 3,/chemistry-jeans-blue-dress-with-studs-3.jpg,Chemistry Jeans Blue Dress With Studs 3,Chemistry Jeans Blue Dress With Studs 3
C-T-AND1-14,/and-blue-&-white-printed-full-sleeves-top-3.jpg,/and-blue-&-white-printed-full-sleeves-top-3.jpg,AND Blue & White Printed Full Sleeves Top 3,/and-blue-&-white-printed-full-sleeves-top-3.jpg,AND Blue & White Printed Full Sleeves Top 3,AND Blue & White Printed Full Sleeves Top 3
C-T-MNG-87,/mango-grey-crossover-top-3.jpg,/mango-grey-crossover-top-3.jpg,Mango Grey Crossover Top 3,/mango-grey-crossover-top-3.jpg,Mango Grey Crossover Top 3,Mango Grey Crossover Top 3
C-T-KZ-14,/kazo-black-houndstooth-top-3.jpg,/kazo-black-houndstooth-top-3.jpg,Kazo Black Houndstooth Top 3,/kazo-black-houndstooth-top-3.jpg,Kazo Black Houndstooth Top 3,Kazo Black Houndstooth Top 3
C-D-UCB-11,/united-colors-of-benetton-black-pleated-dress-3.jpg,/united-colors-of-benetton-black-pleated-dress-3.jpg,United Colors of Benetton Black Pleated Dress 3,/united-colors-of-benetton-black-pleated-dress-3.jpg,United Colors of Benetton Black Pleated Dress 3,United Colors of Benetton Black Pleated Dress 3
C-B-H&M-15,/h&m-light-blue-jeggings-3.jpg,/h&m-light-blue-jeggings-3.jpg,H&M Light Blue Jeggings 3,/h&m-light-blue-jeggings-3.jpg,H&M Light Blue Jeggings 3,H&M Light Blue Jeggings 3
C-T-CYJ-15,/chemistry-jeans-maroon-top-with-silver-buttons-3.jpg,/chemistry-jeans-maroon-top-with-silver-buttons-3.jpg,Chemistry Jeans Maroon Top With Silver Buttons 3,/chemistry-jeans-maroon-top-with-silver-buttons-3.jpg,Chemistry Jeans Maroon Top With Silver Buttons 3,Chemistry Jeans Maroon Top With Silver Buttons 3
S-H-INC-04,/inc.5-black-boots-3.jpg,/inc.5-black-boots-3.jpg,Inc.5 Black Boots 3,/inc.5-black-boots-3.jpg,Inc.5 Black Boots 3,Inc.5 Black Boots 3
B-H-GS-10,/guess-pink-monogram-bag-3.jpg,/guess-pink-monogram-bag-3.jpg,Guess Pink Monogram Bag 3,/guess-pink-monogram-bag-3.jpg,Guess Pink Monogram Bag 3,Guess Pink Monogram Bag 3
C-T-MDE-09,/madame-purple-top-with-pink-detailing-3.jpg,/madame-purple-top-with-pink-detailing-3.jpg,Madame Purple Top With Pink Detailing 3,/madame-purple-top-with-pink-detailing-3.jpg,Madame Purple Top With Pink Detailing 3,Madame Purple Top With Pink Detailing 3
C-B-MDE-01,/madame-purple-&-black-checked-skirt-3.jpg,/madame-purple-&-black-checked-skirt-3.jpg,Madame Purple & Black Checked Skirt 3,/madame-purple-&-black-checked-skirt-3.jpg,Madame Purple & Black Checked Skirt 3,Madame Purple & Black Checked Skirt 3
C-T-ESP-31,/esprit-grey-sleeveless-top-with-pink-embroidery-3.jpg,/esprit-grey-sleeveless-top-with-pink-embroidery-3.jpg,Esprit Grey Sleeveless Top With Pink Embroidery 3,/esprit-grey-sleeveless-top-with-pink-embroidery-3.jpg,Esprit Grey Sleeveless Top With Pink Embroidery 3,Esprit Grey Sleeveless Top With Pink Embroidery 3
C-T-NE-19,/next-beige-wrap-top-3.jpg,/next-beige-wrap-top-3.jpg,Next Beige Wrap Top 3,/next-beige-wrap-top-3.jpg,Next Beige Wrap Top 3,Next Beige Wrap Top 3
C-B-NE-09,/next-blue-trousers-3.jpg,/next-blue-trousers-3.jpg,Next Blue Trousers 3,/next-blue-trousers-3.jpg,Next Blue Trousers 3,Next Blue Trousers 3
C-D-TS-01,/top-shop-brown-animal-print-dress-3.jpg,/top-shop-brown-animal-print-dress-3.jpg,Top Shop Brown Animal Print Dress 3,/top-shop-brown-animal-print-dress-3.jpg,Top Shop Brown Animal Print Dress 3,Top Shop Brown Animal Print Dress 3
C-O-OY-04,/only-light-blue-denim-jacket-3.jpg,/only-light-blue-denim-jacket-3.jpg,ONLY Light Blue Denim Jacket 3,/only-light-blue-denim-jacket-3.jpg,ONLY Light Blue Denim Jacket 3,ONLY Light Blue Denim Jacket 3
C-T-JN-10,/jane-norman-white-floral-top-3.jpg,/jane-norman-white-floral-top-3.jpg,Jane Norman White Floral Top 3,/jane-norman-white-floral-top-3.jpg,Jane Norman White Floral Top 3,Jane Norman White Floral Top 3
C-D-DSL-01,/desigual-blue-&-green-printed-dress-3.jpg,/desigual-blue-&-green-printed-dress-3.jpg,Desigual Blue & Green Printed Dress 3,/desigual-blue-&-green-printed-dress-3.jpg,Desigual Blue & Green Printed Dress 3,Desigual Blue & Green Printed Dress 3
C-T-AX-19,/armani-exchange-white-top-with-ruffle-sleeves-3.jpg,/armani-exchange-white-top-with-ruffle-sleeves-3.jpg,Armani Exchange White Top With Ruffle Sleeves 3,/armani-exchange-white-top-with-ruffle-sleeves-3.jpg,Armani Exchange White Top With Ruffle Sleeves 3,Armani Exchange White Top With Ruffle Sleeves 3
C-T-JCC-07,/juicy-couture-purple-&-black-printed-top-3.jpg,/juicy-couture-purple-&-black-printed-top-3.jpg,Juicy Couture Purple & Black Printed Top 3,/juicy-couture-purple-&-black-printed-top-3.jpg,Juicy Couture Purple & Black Printed Top 3,Juicy Couture Purple & Black Printed Top 3
C-D-NW-01,/nine-west-red-gathered-dress-3.jpg,/nine-west-red-gathered-dress-3.jpg,Nine West Red Gathered Dress 3,/nine-west-red-gathered-dress-3.jpg,Nine West Red Gathered Dress 3,Nine West Red Gathered Dress 3
C-T-FF-07,/109°f-black-&-pink-printed-top-3.jpg,/109°f-black-&-pink-printed-top-3.jpg,109°F Black & Pink Printed Top 3,/109°f-black-&-pink-printed-top-3.jpg,109°F Black & Pink Printed Top 3,109°F Black & Pink Printed Top 3
C-T-SEM-01,/self-esteem-blue-&-brown-printed-top-3.jpg,/self-esteem-blue-&-brown-printed-top-3.jpg,Self Esteem Blue & Brown Printed Top 3,/self-esteem-blue-&-brown-printed-top-3.jpg,Self Esteem Blue & Brown Printed Top 3,Self Esteem Blue & Brown Printed Top 3
C-T-SEM-02,/self-esteem-blue-floral-print-top-3.jpg,/self-esteem-blue-floral-print-top-3.jpg,Self Esteem Blue Floral Print Top 3,/self-esteem-blue-floral-print-top-3.jpg,Self Esteem Blue Floral Print Top 3,Self Esteem Blue Floral Print Top 3
C-T-XO-01,/xoxo-brown-&-black-printed-top-3.jpg,/xoxo-brown-&-black-printed-top-3.jpg,XOXO Brown & Black Printed Top 3,/xoxo-brown-&-black-printed-top-3.jpg,XOXO Brown & Black Printed Top 3,XOXO Brown & Black Printed Top 3
C-D-MJ-02,/monisha-jaising-blue-net-sequins-dress-3.jpg,/monisha-jaising-blue-net-sequins-dress-3.jpg,Monisha Jaising Blue Net Sequins Dress 3,/monisha-jaising-blue-net-sequins-dress-3.jpg,Monisha Jaising Blue Net Sequins Dress 3,Monisha Jaising Blue Net Sequins Dress 3
S-H-CARL-01,/carlton-golden-peep-toes-heels-3.jpg,/carlton-golden-peep-toes-heels-3.jpg,CARLTON Golden Peep Toes Heels 3,/carlton-golden-peep-toes-heels-3.jpg,CARLTON Golden Peep Toes Heels 3,CARLTON Golden Peep Toes Heels 3
C-B-MNG-32,/mango-black-denim-jeans-3.jpg,/mango-black-denim-jeans-3.jpg,Mango Black Denim Jeans 3,/mango-black-denim-jeans-3.jpg,Mango Black Denim Jeans 3,Mango Black Denim Jeans 3
C-B-MNS-48,/marks-and-spencer-dark-blue-jeggings-3.jpg,/marks-and-spencer-dark-blue-jeggings-3.jpg,Marks and Spencer Dark Blue Jeggings 3,/marks-and-spencer-dark-blue-jeggings-3.jpg,Marks and Spencer Dark Blue Jeggings 3,Marks and Spencer Dark Blue Jeggings 3
C-B-LS-22,/levis-green-shorts-3.jpg,/levis-green-shorts-3.jpg,Levis Green Shorts 3,/levis-green-shorts-3.jpg,Levis Green Shorts 3,Levis Green Shorts 3
C-T-MNG-89,/mango-pink-top-with-pleated-sleeves-3.jpg,/mango-pink-top-with-pleated-sleeves-3.jpg,Mango Pink Top With Pleated Sleeves 3,/mango-pink-top-with-pleated-sleeves-3.jpg,Mango Pink Top With Pleated Sleeves 3,Mango Pink Top With Pleated Sleeves 3
S-H-SM-13,/steve-madden-brown-boots-3.jpg,/steve-madden-brown-boots-3.jpg,Steve Madden Brown Boots 3,/steve-madden-brown-boots-3.jpg,Steve Madden Brown Boots 3,Steve Madden Brown Boots 3
C-D-JN-12,/jane-norman-grey-dress-with-buckles-3.jpg,/jane-norman-grey-dress-with-buckles-3.jpg,Jane Norman Grey Dress With Buckles 3,/jane-norman-grey-dress-with-buckles-3.jpg,Jane Norman Grey Dress With Buckles 3,Jane Norman Grey Dress With Buckles 3
C-T-NLK-06,/new-look-black-bolero-jacket-3.jpg,/new-look-black-bolero-jacket-3.jpg,New Look Black Bolero Jacket 3,/new-look-black-bolero-jacket-3.jpg,New Look Black Bolero Jacket 3,New Look Black Bolero Jacket 3
C-T-ESP-32,/esprit-red-&-white-striped-shirt-3.jpg,/esprit-red-&-white-striped-shirt-3.jpg,Esprit Red & White Striped Shirt 3,/esprit-red-&-white-striped-shirt-3.jpg,Esprit Red & White Striped Shirt 3,Esprit Red & White Striped Shirt 3
C-T-MNG-90,/mango-orange-full-sleeves-top-3.jpg,/mango-orange-full-sleeves-top-3.jpg,Mango Orange Full Sleeves Top 3,/mango-orange-full-sleeves-top-3.jpg,Mango Orange Full Sleeves Top 3,Mango Orange Full Sleeves Top 3
C-T-MNG-91,/mango-blue-top-with-ruffle-sleeves-3.jpg,/mango-blue-top-with-ruffle-sleeves-3.jpg,Mango Blue Top With Ruffle Sleeves 3,/mango-blue-top-with-ruffle-sleeves-3.jpg,Mango Blue Top With Ruffle Sleeves 3,Mango Blue Top With Ruffle Sleeves 3
C-B-M60-03,/miss-sixty-black-5-pocket-denim-jeans-3.jpg,/miss-sixty-black-5-pocket-denim-jeans-3.jpg,Miss Sixty Black 5 Pocket Denim Jeans 3,/miss-sixty-black-5-pocket-denim-jeans-3.jpg,Miss Sixty Black 5 Pocket Denim Jeans 3,Miss Sixty Black 5 Pocket Denim Jeans 3
C-O-MNG-16,/mango-black-peplum-jacket-3.jpg,/mango-black-peplum-jacket-3.jpg,Mango Black Peplum Jacket 3,/mango-black-peplum-jacket-3.jpg,Mango Black Peplum Jacket 3,Mango Black Peplum Jacket 3
C-T-TS-09,/top-shop-black-&-white-high-neck-top-3.jpg,/top-shop-black-&-white-high-neck-top-3.jpg,Top Shop Black & White High Neck Top 3,/top-shop-black-&-white-high-neck-top-3.jpg,Top Shop Black & White High Neck Top 3,Top Shop Black & White High Neck Top 3
C-B-LS-23,/levis-blue-denim-jeans-with-silver-detailing-3.jpg,/levis-blue-denim-jeans-with-silver-detailing-3.jpg,Levis Blue Denim Jeans With Silver Detailing 3,/levis-blue-denim-jeans-with-silver-detailing-3.jpg,Levis Blue Denim Jeans With Silver Detailing 3,Levis Blue Denim Jeans With Silver Detailing 3
C-B-NE-10,/next-light-blue-boot-cut-denim-jeans-3.jpg,/next-light-blue-boot-cut-denim-jeans-3.jpg,Next Light Blue Boot Cut Denim Jeans 3,/next-light-blue-boot-cut-denim-jeans-3.jpg,Next Light Blue Boot Cut Denim Jeans 3,Next Light Blue Boot Cut Denim Jeans 3
C-D-MNG-50,/mango-red-bodycon-dress-3.jpg,/mango-red-bodycon-dress-3.jpg,Mango Red Bodycon Dress 3,/mango-red-bodycon-dress-3.jpg,Mango Red Bodycon Dress 3,Mango Red Bodycon Dress 3
A-SC-MNS-01,/marks-and-spencer-pink-scarf-3.jpg,/marks-and-spencer-pink-scarf-3.jpg,Marks and Spencer Pink Scarf 3,/marks-and-spencer-pink-scarf-3.jpg,Marks and Spencer Pink Scarf 3,Marks and Spencer Pink Scarf 3
A-SC-NE-01,/next-purple-&-pink-scarf-with-sequins-3.jpg,/next-purple-&-pink-scarf-with-sequins-3.jpg,Next Purple & Pink Scarf With Sequins 3,/next-purple-&-pink-scarf-with-sequins-3.jpg,Next Purple & Pink Scarf With Sequins 3,Next Purple & Pink Scarf With Sequins 3
C-D-LAQU-06,"/latin-quarters-white,-black-&-blue-printed-dress-3.jpg","/latin-quarters-white,-black-&-blue-printed-dress-3.jpg","Latin Quarters White, Black & Blue Printed Dress 3","/latin-quarters-white,-black-&-blue-printed-dress-3.jpg","Latin Quarters White, Black & Blue Printed Dress 3","Latin Quarters White, Black & Blue Printed Dress 3"
C-B-UO-02,/uniqlo-mustard-jeggings-3.jpg,/uniqlo-mustard-jeggings-3.jpg,Uniqlo Mustard Jeggings 3,/uniqlo-mustard-jeggings-3.jpg,Uniqlo Mustard Jeggings 3,Uniqlo Mustard Jeggings 3
C-B-UO-03,/uniqlo-green-cropped-pants-3.jpg,/uniqlo-green-cropped-pants-3.jpg,Uniqlo Green Cropped Pants 3,/uniqlo-green-cropped-pants-3.jpg,Uniqlo Green Cropped Pants 3,Uniqlo Green Cropped Pants 3
C-B-UO-04,/uniqlo-pink-jeggings-3.jpg,/uniqlo-pink-jeggings-3.jpg,Uniqlo Pink Jeggings 3,/uniqlo-pink-jeggings-3.jpg,Uniqlo Pink Jeggings 3,Uniqlo Pink Jeggings 3
C-B-UO-05,/uniqlo-black-&-white-animal-print-jeans-3.jpg,/uniqlo-black-&-white-animal-print-jeans-3.jpg,Uniqlo Black & White Animal Print Jeans 3,/uniqlo-black-&-white-animal-print-jeans-3.jpg,Uniqlo Black & White Animal Print Jeans 3,Uniqlo Black & White Animal Print Jeans 3
C-T-NLK-07,"/new-look-red,white-&-grey-striped-hoodie-3.jpg","/new-look-red,white-&-grey-striped-hoodie-3.jpg","New Look Red,White & Grey Striped Hoodie 3","/new-look-red,white-&-grey-striped-hoodie-3.jpg","New Look Red,White & Grey Striped Hoodie 3","New Look Red,White & Grey Striped Hoodie 3"
C-O-MS-02,/miss-selfridge-black-ribbed-jacket-3.jpg,/miss-selfridge-black-ribbed-jacket-3.jpg,Miss Selfridge Black Ribbed Jacket 3,/miss-selfridge-black-ribbed-jacket-3.jpg,Miss Selfridge Black Ribbed Jacket 3,Miss Selfridge Black Ribbed Jacket 3
C-T-MNG-92,/mango-grey-basic-sweater-3.jpg,/mango-grey-basic-sweater-3.jpg,Mango Grey Basic Sweater 3,/mango-grey-basic-sweater-3.jpg,Mango Grey Basic Sweater 3,Mango Grey Basic Sweater 3
C-O-JN-02,/jane-norman-brown-cardigan-3.jpg,/jane-norman-brown-cardigan-3.jpg,Jane Norman Brown Cardigan 3,/jane-norman-brown-cardigan-3.jpg,Jane Norman Brown Cardigan 3,Jane Norman Brown Cardigan 3
C-T-RY-04,/roxy-blue-&-beige-checked-shirt-3.jpg,/roxy-blue-&-beige-checked-shirt-3.jpg,Roxy Blue & Beige Checked Shirt 3,/roxy-blue-&-beige-checked-shirt-3.jpg,Roxy Blue & Beige Checked Shirt 3,Roxy Blue & Beige Checked Shirt 3
C-T-HO-05,/hollister-blue-&-white-checked-shirt-3.jpg,/hollister-blue-&-white-checked-shirt-3.jpg,Hollister Blue & White Checked Shirt 3,/hollister-blue-&-white-checked-shirt-3.jpg,Hollister Blue & White Checked Shirt 3,Hollister Blue & White Checked Shirt 3
C-T-CSN-01,/caslon-blue-buttoned-shirt-3.jpg,/caslon-blue-buttoned-shirt-3.jpg,Caslon Blue Buttoned Shirt 3,/caslon-blue-buttoned-shirt-3.jpg,Caslon Blue Buttoned Shirt 3,Caslon Blue Buttoned Shirt 3
C-B-FN-07,/forever-new-blue-denim-shorts-3.jpg,/forever-new-blue-denim-shorts-3.jpg,Forever New Blue Denim Shorts 3,/forever-new-blue-denim-shorts-3.jpg,Forever New Blue Denim Shorts 3,Forever New Blue Denim Shorts 3
C-T-FF-08,/109°f-blue-&-red-striped-kaftan-top-3.jpg,/109°f-blue-&-red-striped-kaftan-top-3.jpg,109°F Blue & Red Striped Kaftan Top 3,/109°f-blue-&-red-striped-kaftan-top-3.jpg,109°F Blue & Red Striped Kaftan Top 3,109°F Blue & Red Striped Kaftan Top 3
C-T-FF-09,/109°f-black-top-with-studs-3.jpg,/109°f-black-top-with-studs-3.jpg,109°F Black Top With Studs 3,/109°f-black-top-with-studs-3.jpg,109°F Black Top With Studs 3,109°F Black Top With Studs 3
S-H-FN-01,/forever-new-black-boots-with-silver-detailing-3.jpg,/forever-new-black-boots-with-silver-detailing-3.jpg,Forever New Black Boots with Silver Detailing 3,/forever-new-black-boots-with-silver-detailing-3.jpg,Forever New Black Boots with Silver Detailing 3,Forever New Black Boots with Silver Detailing 3
