C-B-UO-04,/uniqlo-pink-jeggings-2.jpg,/uniqlo-pink-jeggings-2.jpg,Uniqlo Pink Jeggings 2,/uniqlo-pink-jeggings-2.jpg,Uniqlo Pink Jeggings 2,Uniqlo Pink Jeggings 2
C-B-UO-05,/uniqlo-black-&-white-animal-print-jeans-2.jpg,/uniqlo-black-&-white-animal-print-jeans-2.jpg,Uniqlo Black & White Animal Print Jeans 2,/uniqlo-black-&-white-animal-print-jeans-2.jpg,Uniqlo Black & White Animal Print Jeans 2,Uniqlo Black & White Animal Print Jeans 2
C-T-NLK-07,"/new-look-red,white-&-grey-striped-hoodie-2.jpg","/new-look-red,white-&-grey-striped-hoodie-2.jpg","New Look Red,White & Grey Striped Hoodie 2","/new-look-red,white-&-grey-striped-hoodie-2.jpg","New Look Red,White & Grey Striped Hoodie 2","New Look Red,White & Grey Striped Hoodie 2"
C-O-MS-02,/miss-selfridge-black-ribbed-jacket-2.jpg,/miss-selfridge-black-ribbed-jacket-2.jpg,Miss Selfridge Black Ribbed Jacket 2,/miss-selfridge-black-ribbed-jacket-2.jpg,Miss Selfridge Black Ribbed Jacket 2,Miss Selfridge Black Ribbed Jacket 2
C-T-MNG-92,/mango-grey-basic-sweater-2.jpg,/mango-grey-basic-sweater-2.jpg,Mango Grey Basic Sweater 2,/mango-grey-basic-sweater-2.jpg,Mango Grey Basic Sweater 2,Mango Grey Basic Sweater 2
C-O-JN-02,/jane-norman-brown-cardigan-2.jpg,/jane-norman-brown-cardigan-2.jpg,Jane Norman Brown Cardigan 2,/jane-norman-brown-cardigan-2.jpg,Jane Norman Brown Cardigan 2,Jane Norman Brown Cardigan 2
C-T-RY-04,/roxy-blue-&-beige-checked-shirt-2.jpg,/roxy-blue-&-beige-checked-shirt-2.jpg,Roxy Blue & Beige Checked Shirt 2,/roxy-blue-&-beige-checked-shirt-2.jpg,Roxy Blue & Beige Checked Shirt 2,Roxy Blue & Beige Checked Shirt 2
C-T-HO-05,/hollister-blue-&-white-checked-shirt-2.jpg,/hollister-blue-&-white-checked-shirt-2.jpg,Hollister Blue & White Checked Shirt 2,/hollister-blue-&-white-checked-shirt-2.jpg,Hollister Blue & White Checked Shirt 2,Hollister Blue & White Checked Shirt 2
C-T-CSN-01,/caslon-blue-buttoned-shirt-2.jpg,/caslon-blue-buttoned-shirt-2.jpg,Caslon Blue Buttoned Shirt 2,/caslon-blue-buttoned-shirt-2.jpg,Caslon Blue Buttoned Shirt 2,Caslon Blue Buttoned Shirt 2
C-B-FN-07,/forever-new-blue-denim-shorts-2.jpg,/forever-new-blue-denim-shorts-2.jpg,Forever New Blue Denim Shorts 2,/forever-new-blue-denim-shorts-2.jpg,Forever New Blue Denim Shorts 2,Forever New Blue Denim Shorts 2
C-T-FF-08,/109°f-blue-&-red-striped-kaftan-top-2.jpg,/109°f-blue-&-red-striped-kaftan-top-2.jpg,109°F Blue & Red Striped Kaftan Top 2,/109°f-blue-&-red-striped-kaftan-top-2.jpg,109°F Blue & Red Striped Kaftan Top 2,109°F Blue & Red Striped Kaftan Top 2
C-T-FF-09,/109°f-black-top-with-studs-2.jpg,/109°f-black-top-with-studs-2.jpg,109°F Black Top With Studs 2,/109°f-black-top-with-studs-2.jpg,109°F Black Top With Studs 2,109°F Black Top With Studs 2
S-H-FN-01,/forever-new-black-boots-with-silver-detailing-2.jpg,/forever-new-black-boots-with-silver-detailing-2.jpg,Forever New Black Boots with Silver Detailing 2,/forever-new-black-boots-with-silver-detailing-2.jpg,Forever New Black Boots with Silver Detailing 2,Forever New Black Boots with Silver Detailing 2
C-D-BE-08,/bebe-purple-pleated-tube-dress-2.jpg,/bebe-purple-pleated-tube-dress-2.jpg,Bebe Purple Pleated Tube Dress 2,/bebe-purple-pleated-tube-dress-2.jpg,Bebe Purple Pleated Tube Dress 2,Bebe Purple Pleated Tube Dress 2
C-B-ZA-77,/zara-black-&-gold-zipped-trousers-2.jpg,/zara-black-&-gold-zipped-trousers-2.jpg,Zara Black & Gold Zipped Trousers 2,/zara-black-&-gold-zipped-trousers-2.jpg,Zara Black & Gold Zipped Trousers 2,Zara Black & Gold Zipped Trousers 2
C-T-VM-69,/vero-moda-blue-shirt-with-lace-collar-2.jpg,/vero-moda-blue-shirt-with-lace-collar-2.jpg,Vero Moda Blue Shirt With Lace Collar 2,/vero-moda-blue-shirt-with-lace-collar-2.jpg,Vero Moda Blue Shirt With Lace Collar 2,Vero Moda Blue Shirt With Lace Collar 2
C-D-`CHR-01,/charlotte-russe-peach-maxi-dress-with-butterfly-print-2.jpg,/charlotte-russe-peach-maxi-dress-with-butterfly-print-2.jpg,Charlotte Russe Peach Maxi Dress With Butterfly Print 2,/charlotte-russe-peach-maxi-dress-with-butterfly-print-2.jpg,Charlotte Russe Peach Maxi Dress With Butterfly Print 2,Charlotte Russe Peach Maxi Dress With Butterfly Print 2
C-B-PD-17,/promod-white-sequins-skirt-2.jpg,/promod-white-sequins-skirt-2.jpg,Promod White Sequins Skirt 2,/promod-white-sequins-skirt-2.jpg,Promod White Sequins Skirt 2,Promod White Sequins Skirt 2
C-B-TH-04,/tommy-hilfiger-blue-denim-skirt-with-red-detailing-2.jpg,/tommy-hilfiger-blue-denim-skirt-with-red-detailing-2.jpg,Tommy Hilfiger Blue Denim Skirt With Red Detailing 2,/tommy-hilfiger-blue-denim-skirt-with-red-detailing-2.jpg,Tommy Hilfiger Blue Denim Skirt With Red Detailing 2,Tommy Hilfiger Blue Denim Skirt With Red Detailing 2
C-T-FN-10,/forever-new-blue-&-pink-striped-tie-front-top-2.jpg,/forever-new-blue-&-pink-striped-tie-front-top-2.jpg,Forever New Blue & Pink Striped Tie Front Top 2,/forever-new-blue-&-pink-striped-tie-front-top-2.jpg,Forever New Blue & Pink Striped Tie Front Top 2,Forever New Blue & Pink Striped Tie Front Top 2
C-T-MNG-93,/mango-red-top-with-black-detailing-2.jpg,/mango-red-top-with-black-detailing-2.jpg,Mango Red Top With Black Detailing 2,/mango-red-top-with-black-detailing-2.jpg,Mango Red Top With Black Detailing 2,Mango Red Top With Black Detailing 2
C-T-FN-11,/forever-new-pink-floral-ruffled-spaghetti-strap-top-2.jpg,/forever-new-pink-floral-ruffled-spaghetti-strap-top-2.jpg,Forever New Pink Floral Ruffled Spaghetti Strap Top 2,/forever-new-pink-floral-ruffled-spaghetti-strap-top-2.jpg,Forever New Pink Floral Ruffled Spaghetti Strap Top 2,Forever New Pink Floral Ruffled Spaghetti Strap Top 2
C-T-ZA-163,/zara-white-sleeveless-top-2.jpg,/zara-white-sleeveless-top-2.jpg,Zara White Sleeveless Top 2,/zara-white-sleeveless-top-2.jpg,Zara White Sleeveless Top 2,Zara White Sleeveless Top 2
C-T-PD-48,/promod-green-&-silver-sparkly-top-2.jpg,/promod-green-&-silver-sparkly-top-2.jpg,Promod Green & Silver Sparkly Top 2,/promod-green-&-silver-sparkly-top-2.jpg,Promod Green & Silver Sparkly Top 2,Promod Green & Silver Sparkly Top 2
,,,,,,
,,,,,,
B-H-LN-01,/lanvin-brown-basket-purse-1.jpg,/lanvin-brown-basket-purse-1.jpg,Lanvin Brown Basket Purse 1,/lanvin-brown-basket-purse-1.jpg,Lanvin Brown Basket Purse 1,Lanvin Brown Basket Purse 1
A-SC-GP-01,/gap-blue-bandhej-scraf-1.jpg,/gap-blue-bandhej-scraf-1.jpg,Gap Blue Bandhej Scraf 1,/gap-blue-bandhej-scraf-1.jpg,Gap Blue Bandhej Scraf 1,Gap Blue Bandhej Scraf 1
C-O-UCB-04,/united-colors-of-benetton-blue-&-white-star-print-sweater-1.jpg,/united-colors-of-benetton-blue-&-white-star-print-sweater-1.jpg,United Colors of Benetton Blue & White Star Print Sweater 1,/united-colors-of-benetton-blue-&-white-star-print-sweater-1.jpg,United Colors of Benetton Blue & White Star Print Sweater 1,United Colors of Benetton Blue & White Star Print Sweater 1
C-B-BIZ-01,/bizarre-dark-blue-whisker-washed-jeans-1.jpg,/bizarre-dark-blue-whisker-washed-jeans-1.jpg,Bizarre Dark Blue Whisker Washed Jeans 1,/bizarre-dark-blue-whisker-washed-jeans-1.jpg,Bizarre Dark Blue Whisker Washed Jeans 1,Bizarre Dark Blue Whisker Washed Jeans 1
C-T-BIZ-07,/bizarre-black-beaded-full-sleeves-top-1.jpg,/bizarre-black-beaded-full-sleeves-top-1.jpg,Bizarre Black Beaded Full Sleeves Top 1,/bizarre-black-beaded-full-sleeves-top-1.jpg,Bizarre Black Beaded Full Sleeves Top 1,Bizarre Black Beaded Full Sleeves Top 1
C-O-UCB-05,/united-colors-of-benetton-purple-round-neck-sweater-1.jpg,/united-colors-of-benetton-purple-round-neck-sweater-1.jpg,United Colors of Benetton Purple Round Neck Sweater 1,/united-colors-of-benetton-purple-round-neck-sweater-1.jpg,United Colors of Benetton Purple Round Neck Sweater 1,United Colors of Benetton Purple Round Neck Sweater 1
C-O-MNS-05,/marks-and-spencer-red-high-neck-sweater-1.jpg,/marks-and-spencer-red-high-neck-sweater-1.jpg,Marks and Spencer Red High Neck Sweater 1,/marks-and-spencer-red-high-neck-sweater-1.jpg,Marks and Spencer Red High Neck Sweater 1,Marks and Spencer Red High Neck Sweater 1
C-B-GP-20,/gap-grey-check-boot-cut-pants-1.jpg,/gap-grey-check-boot-cut-pants-1.jpg,Gap Grey Check Boot Cut Pants 1,/gap-grey-check-boot-cut-pants-1.jpg,Gap Grey Check Boot Cut Pants 1,Gap Grey Check Boot Cut Pants 1
C-B-IN-01,/inc-international-concept-black-pants-with-zip-detailing-1.jpg,/inc-international-concept-black-pants-with-zip-detailing-1.jpg,INC International Concept Black Pants With Zip Detailing 1,/inc-international-concept-black-pants-with-zip-detailing-1.jpg,INC International Concept Black Pants With Zip Detailing 1,INC International Concept Black Pants With Zip Detailing 1
C-B-MNS-45,/marks-and-spencer-dark-blue-5-pocket-denim-jeans-1.jpg,/marks-and-spencer-dark-blue-5-pocket-denim-jeans-1.jpg,Marks and Spencer Dark Blue 5 Pocket Denim Jeans 1,/marks-and-spencer-dark-blue-5-pocket-denim-jeans-1.jpg,Marks and Spencer Dark Blue 5 Pocket Denim Jeans 1,Marks and Spencer Dark Blue 5 Pocket Denim Jeans 1
C-T-GS-23,/guess-blue-knit-collar-shirt-1.jpg,/guess-blue-knit-collar-shirt-1.jpg,Guess Blue Knit Collar Shirt 1,/guess-blue-knit-collar-shirt-1.jpg,Guess Blue Knit Collar Shirt 1,Guess Blue Knit Collar Shirt 1
C-B-VM-14,/vero-moda-black-zip-leggings-1.jpg,/vero-moda-black-zip-leggings-1.jpg,Vero Moda Black Zip Leggings 1,/vero-moda-black-zip-leggings-1.jpg,Vero Moda Black Zip Leggings 1,Vero Moda Black Zip Leggings 1
C-B-VM-15,/vero-moda-navy-blue-pleated-pants-1.jpg,/vero-moda-navy-blue-pleated-pants-1.jpg,Vero Moda Navy Blue Pleated Pants 1,/vero-moda-navy-blue-pleated-pants-1.jpg,Vero Moda Navy Blue Pleated Pants 1,Vero Moda Navy Blue Pleated Pants 1
C-T-MNG-85,/mango-maroon-full-sleeves-top-1.jpg,/mango-maroon-full-sleeves-top-1.jpg,Mango Maroon Full Sleeves Top 1,/mango-maroon-full-sleeves-top-1.jpg,Mango Maroon Full Sleeves Top 1,Mango Maroon Full Sleeves Top 1
C-D-DP-08,/dorothy-perkins-black-&-white-dress-1.jpg,/dorothy-perkins-black-&-white-dress-1.jpg,Dorothy Perkins Black & White Dress 1,/dorothy-perkins-black-&-white-dress-1.jpg,Dorothy Perkins Black & White Dress 1,Dorothy Perkins Black & White Dress 1
C-B-VM-16,/vero-moda-black-chino-shorts-1.jpg,/vero-moda-black-chino-shorts-1.jpg,Vero Moda Black Chino Shorts 1,/vero-moda-black-chino-shorts-1.jpg,Vero Moda Black Chino Shorts 1,Vero Moda Black Chino Shorts 1
C-T-DP-12,/dorothy-perkins-navy-blue-top-with-lace-detailing-1.jpg,/dorothy-perkins-navy-blue-top-with-lace-detailing-1.jpg,Dorothy Perkins Navy Blue Top With Lace Detailing 1,/dorothy-perkins-navy-blue-top-with-lace-detailing-1.jpg,Dorothy Perkins Navy Blue Top With Lace Detailing 1,Dorothy Perkins Navy Blue Top With Lace Detailing 1
C-D-DP-09,/dorothy-perkins-plum-&-black-dress-1.jpg,/dorothy-perkins-plum-&-black-dress-1.jpg,Dorothy Perkins Plum & Black Dress 1,/dorothy-perkins-plum-&-black-dress-1.jpg,Dorothy Perkins Plum & Black Dress 1,Dorothy Perkins Plum & Black Dress 1
C-B-ZA-71,/zara-white-&-blue-heart-print-skirt-1.jpg,/zara-white-&-blue-heart-print-skirt-1.jpg,Zara White & Blue Heart Print Skirt 1,/zara-white-&-blue-heart-print-skirt-1.jpg,Zara White & Blue Heart Print Skirt 1,Zara White & Blue Heart Print Skirt 1
C-O-OY-03,/only-beige-puffer-jacket-1.jpg,/only-beige-puffer-jacket-1.jpg,ONLY Beige Puffer Jacket 1,/only-beige-puffer-jacket-1.jpg,ONLY Beige Puffer Jacket 1,ONLY Beige Puffer Jacket 1
C-B-FN-05,/forever-new-pink-&-blue-pleated-skirt-1.jpg,/forever-new-pink-&-blue-pleated-skirt-1.jpg,Forever New Pink & Blue Pleated Skirt 1,/forever-new-pink-&-blue-pleated-skirt-1.jpg,Forever New Pink & Blue Pleated Skirt 1,Forever New Pink & Blue Pleated Skirt 1
C-J-ZA-06,/zara-black-crossover-jumpsuit-1.jpg,/zara-black-crossover-jumpsuit-1.jpg,Zara Black Crossover Jumpsuit 1,/zara-black-crossover-jumpsuit-1.jpg,Zara Black Crossover Jumpsuit 1,Zara Black Crossover Jumpsuit 1
C-D-FN-13,/forever-new-blue-tube-dress-1.jpg,/forever-new-blue-tube-dress-1.jpg,Forever New Blue Tube Dress 1,/forever-new-blue-tube-dress-1.jpg,Forever New Blue Tube Dress 1,Forever New Blue Tube Dress 1
C-B-ZA-72,/zara-purple-&-white-printed-skirt-1.jpg,/zara-purple-&-white-printed-skirt-1.jpg,Zara Purple & White Printed Skirt 1,/zara-purple-&-white-printed-skirt-1.jpg,Zara Purple & White Printed Skirt 1,Zara Purple & White Printed Skirt 1
C-D-OXYG-02,/oxygene-black-&-white-printed-one-shoulder-dress-1.jpg,/oxygene-black-&-white-printed-one-shoulder-dress-1.jpg,Oxygene Black & White Printed One Shoulder Dress 1,/oxygene-black-&-white-printed-one-shoulder-dress-1.jpg,Oxygene Black & White Printed One Shoulder Dress 1,Oxygene Black & White Printed One Shoulder Dress 1
C-B-FN-06,/forever-new-white-straight-skirt-1.jpg,/forever-new-white-straight-skirt-1.jpg,Forever New White Straight Skirt 1,/forever-new-white-straight-skirt-1.jpg,Forever New White Straight Skirt 1,Forever New White Straight Skirt 1
C-D-ZA-60,/zara-black-spaghetti-strap-dress-1.jpg,/zara-black-spaghetti-strap-dress-1.jpg,Zara Black Spaghetti Strap Dress 1,/zara-black-spaghetti-strap-dress-1.jpg,Zara Black Spaghetti Strap Dress 1,Zara Black Spaghetti Strap Dress 1
C-D-H&M-18,/h&m-black-&-white-spaghetti-strap-maxi-dress-1.jpg,/h&m-black-&-white-spaghetti-strap-maxi-dress-1.jpg,H&M Black & White Spaghetti Strap Maxi Dress 1,/h&m-black-&-white-spaghetti-strap-maxi-dress-1.jpg,H&M Black & White Spaghetti Strap Maxi Dress 1,H&M Black & White Spaghetti Strap Maxi Dress 1
C-T-MNG-86,/mango-grey-sequins-tank-top-1.jpg,/mango-grey-sequins-tank-top-1.jpg,Mango Grey Sequins Tank Top 1,/mango-grey-sequins-tank-top-1.jpg,Mango Grey Sequins Tank Top 1,Mango Grey Sequins Tank Top 1
C-T-GP-16,/gap-blue-striped-spaghetti-strap-top-1.jpg,/gap-blue-striped-spaghetti-strap-top-1.jpg,Gap Blue Striped Spaghetti Strap Top 1,/gap-blue-striped-spaghetti-strap-top-1.jpg,Gap Blue Striped Spaghetti Strap Top 1,Gap Blue Striped Spaghetti Strap Top 1
C-T-FN-09,/forever-new-golden-&-brown-spaghetti-strap-top-1.jpg,/forever-new-golden-&-brown-spaghetti-strap-top-1.jpg,Forever New Golden & Brown Spaghetti Strap Top 1,/forever-new-golden-&-brown-spaghetti-strap-top-1.jpg,Forever New Golden & Brown Spaghetti Strap Top 1,Forever New Golden & Brown Spaghetti Strap Top 1
C-T-CK-16,/calvin-klein-black-sleeveless-drape-top-1.jpg,/calvin-klein-black-sleeveless-drape-top-1.jpg,Calvin Klein Black Sleeveless Drape Top 1,/calvin-klein-black-sleeveless-drape-top-1.jpg,Calvin Klein Black Sleeveless Drape Top 1,Calvin Klein Black Sleeveless Drape Top 1
C-D-FN-14,/forever-new-black-one-shoulder-dress-with-bow-1.jpg,/forever-new-black-one-shoulder-dress-with-bow-1.jpg,Forever New Black One Shoulder Dress With Bow 1,/forever-new-black-one-shoulder-dress-with-bow-1.jpg,Forever New Black One Shoulder Dress With Bow 1,Forever New Black One Shoulder Dress With Bow 1
C-T-VM-67,/vero-moda-white-blouson-top-1.jpg,/vero-moda-white-blouson-top-1.jpg,Vero Moda White Blouson Top 1,/vero-moda-white-blouson-top-1.jpg,Vero Moda White Blouson Top 1,Vero Moda White Blouson Top 1
C-T-BSK-13,/bershka-white-black-print-tank-top-1.jpg,/bershka-white-black-print-tank-top-1.jpg,Bershka White Black Print Tank Top 1,/bershka-white-black-print-tank-top-1.jpg,Bershka White Black Print Tank Top 1,Bershka White Black Print Tank Top 1
C-T-EHY-12,/ed-hardy-purple-printed-spaghetti-strap-top-1.jpg,/ed-hardy-purple-printed-spaghetti-strap-top-1.jpg,Ed Hardy Purple Printed Spaghetti Strap Top 1,/ed-hardy-purple-printed-spaghetti-strap-top-1.jpg,Ed Hardy Purple Printed Spaghetti Strap Top 1,Ed Hardy Purple Printed Spaghetti Strap Top 1
C-T-ADS-17,/adidas-black-polo-t-shirt-with-white-detailing-1.jpg,/adidas-black-polo-t-shirt-with-white-detailing-1.jpg,Adidas Black Polo T-Shirt With White Detailing 1,/adidas-black-polo-t-shirt-with-white-detailing-1.jpg,Adidas Black Polo T-Shirt With White Detailing 1,Adidas Black Polo T-Shirt With White Detailing 1
C-SU-WISH-01,/wishful-by-w-turquoise-kurti-with-black-embroidery-1.jpg,/wishful-by-w-turquoise-kurti-with-black-embroidery-1.jpg,Wishful by W Turquoise Kurti With Black Embroidery 1,/wishful-by-w-turquoise-kurti-with-black-embroidery-1.jpg,Wishful by W Turquoise Kurti With Black Embroidery 1,Wishful by W Turquoise Kurti With Black Embroidery 1
C-D-DP-10,/dorothy-perkins-peach-&-black-spaghetti-strap-dress-1.jpg,/dorothy-perkins-peach-&-black-spaghetti-strap-dress-1.jpg,Dorothy Perkins Peach & Black Spaghetti Strap Dress 1,/dorothy-perkins-peach-&-black-spaghetti-strap-dress-1.jpg,Dorothy Perkins Peach & Black Spaghetti Strap Dress 1,Dorothy Perkins Peach & Black Spaghetti Strap Dress 1
C-T-PD-45,/promod-black-waistcoat-1.jpg,/promod-black-waistcoat-1.jpg,Promod Black Waistcoat 1,/promod-black-waistcoat-1.jpg,Promod Black Waistcoat 1,Promod Black Waistcoat 1
C-T-S-11,/sisley-green-cutwork-shirt-1.jpg,/sisley-green-cutwork-shirt-1.jpg,Sisley Green Cutwork Shirt 1,/sisley-green-cutwork-shirt-1.jpg,Sisley Green Cutwork Shirt 1,Sisley Green Cutwork Shirt 1
C-T-VM-68,/vero-moda-maroon-full-sleeves-top-1.jpg,/vero-moda-maroon-full-sleeves-top-1.jpg,Vero Moda Maroon Full Sleeves Top 1,/vero-moda-maroon-full-sleeves-top-1.jpg,Vero Moda Maroon Full Sleeves Top 1,Vero Moda Maroon Full Sleeves Top 1
C-T-ZA-158,/zara-grey-&-pink-floral-top-1.jpg,/zara-grey-&-pink-floral-top-1.jpg,Zara Grey & Pink Floral Top 1,/zara-grey-&-pink-floral-top-1.jpg,Zara Grey & Pink Floral Top 1,Zara Grey & Pink Floral Top 1
C-T-ZA-159,/zara-black-&-white-striped-top-1.jpg,/zara-black-&-white-striped-top-1.jpg,Zara Black & White Striped Top 1,/zara-black-&-white-striped-top-1.jpg,Zara Black & White Striped Top 1,Zara Black & White Striped Top 1
C-T-OY-42,/only-pink-&-green-floral-top-1.jpg,/only-pink-&-green-floral-top-1.jpg,ONLY Pink & Green Floral Top 1,/only-pink-&-green-floral-top-1.jpg,ONLY Pink & Green Floral Top 1,ONLY Pink & Green Floral Top 1
C-D-CYJ-06,/chemistry-jeans-blue-dress-with-studs-1.jpg,/chemistry-jeans-blue-dress-with-studs-1.jpg,Chemistry Jeans Blue Dress With Studs 1,/chemistry-jeans-blue-dress-with-studs-1.jpg,Chemistry Jeans Blue Dress With Studs 1,Chemistry Jeans Blue Dress With Studs 1
C-T-AND1-14,/and-blue-&-white-printed-full-sleeves-top-1.jpg,/and-blue-&-white-printed-full-sleeves-top-1.jpg,AND Blue & White Printed Full Sleeves Top 1,/and-blue-&-white-printed-full-sleeves-top-1.jpg,AND Blue & White Printed Full Sleeves Top 1,AND Blue & White Printed Full Sleeves Top 1
C-T-MNG-87,/mango-grey-crossover-top-1.jpg,/mango-grey-crossover-top-1.jpg,Mango Grey Crossover Top 1,/mango-grey-crossover-top-1.jpg,Mango Grey Crossover Top 1,Mango Grey Crossover Top 1
C-T-KZ-14,/kazo-black-houndstooth-top-1.jpg,/kazo-black-houndstooth-top-1.jpg,Kazo Black Houndstooth Top 1,/kazo-black-houndstooth-top-1.jpg,Kazo Black Houndstooth Top 1,Kazo Black Houndstooth Top 1
C-D-UCB-11,/united-colors-of-benetton-black-pleated-dress-1.jpg,/united-colors-of-benetton-black-pleated-dress-1.jpg,United Colors of Benetton Black Pleated Dress 1,/united-colors-of-benetton-black-pleated-dress-1.jpg,United Colors of Benetton Black Pleated Dress 1,United Colors of Benetton Black Pleated Dress 1
C-B-H&M-15,/h&m-light-blue-jeggings-1.jpg,/h&m-light-blue-jeggings-1.jpg,H&M Light Blue Jeggings 1,/h&m-light-blue-jeggings-1.jpg,H&M Light Blue Jeggings 1,H&M Light Blue Jeggings 1
C-T-CYJ-15,/chemistry-jeans-maroon-top-with-silver-buttons-1.jpg,/chemistry-jeans-maroon-top-with-silver-buttons-1.jpg,Chemistry Jeans Maroon Top With Silver Buttons 1,/chemistry-jeans-maroon-top-with-silver-buttons-1.jpg,Chemistry Jeans Maroon Top With Silver Buttons 1,Chemistry Jeans Maroon Top With Silver Buttons 1
S-H-INC-04,/inc.5-black-boots-1.jpg,/inc.5-black-boots-1.jpg,Inc.5 Black Boots 1,/inc.5-black-boots-1.jpg,Inc.5 Black Boots 1,Inc.5 Black Boots 1
B-H-GS-10,/guess-pink-monogram-bag-1.jpg,/guess-pink-monogram-bag-1.jpg,Guess Pink Monogram Bag 1,/guess-pink-monogram-bag-1.jpg,Guess Pink Monogram Bag 1,Guess Pink Monogram Bag 1
C-T-MDE-09,/madame-purple-top-with-pink-detailing-1.jpg,/madame-purple-top-with-pink-detailing-1.jpg,Madame Purple Top With Pink Detailing 1,/madame-purple-top-with-pink-detailing-1.jpg,Madame Purple Top With Pink Detailing 1,Madame Purple Top With Pink Detailing 1
C-B-MDE-01,/madame-purple-&-black-checked-skirt-1.jpg,/madame-purple-&-black-checked-skirt-1.jpg,Madame Purple & Black Checked Skirt 1,/madame-purple-&-black-checked-skirt-1.jpg,Madame Purple & Black Checked Skirt 1,Madame Purple & Black Checked Skirt 1
C-T-ESP-31,/esprit-grey-sleeveless-top-with-pink-embroidery-1.jpg,/esprit-grey-sleeveless-top-with-pink-embroidery-1.jpg,Esprit Grey Sleeveless Top With Pink Embroidery 1,/esprit-grey-sleeveless-top-with-pink-embroidery-1.jpg,Esprit Grey Sleeveless Top With Pink Embroidery 1,Esprit Grey Sleeveless Top With Pink Embroidery 1
C-T-NE-19,/next-beige-wrap-top-1.jpg,/next-beige-wrap-top-1.jpg,Next Beige Wrap Top 1,/next-beige-wrap-top-1.jpg,Next Beige Wrap Top 1,Next Beige Wrap Top 1
C-B-NE-09,/next-blue-trousers-1.jpg,/next-blue-trousers-1.jpg,Next Blue Trousers 1,/next-blue-trousers-1.jpg,Next Blue Trousers 1,Next Blue Trousers 1
C-D-TS-01,/top-shop-brown-animal-print-dress-1.jpg,/top-shop-brown-animal-print-dress-1.jpg,Top Shop Brown Animal Print Dress 1,/top-shop-brown-animal-print-dress-1.jpg,Top Shop Brown Animal Print Dress 1,Top Shop Brown Animal Print Dress 1
C-O-OY-04,/only-light-blue-denim-jacket-1.jpg,/only-light-blue-denim-jacket-1.jpg,ONLY Light Blue Denim Jacket 1,/only-light-blue-denim-jacket-1.jpg,ONLY Light Blue Denim Jacket 1,ONLY Light Blue Denim Jacket 1
C-T-JN-10,/jane-norman-white-floral-top-1.jpg,/jane-norman-white-floral-top-1.jpg,Jane Norman White Floral Top 1,/jane-norman-white-floral-top-1.jpg,Jane Norman White Floral Top 1,Jane Norman White Floral Top 1
C-D-DSL-01,/desigual-blue-&-green-printed-dress-1.jpg,/desigual-blue-&-green-printed-dress-1.jpg,Desigual Blue & Green Printed Dress 1,/desigual-blue-&-green-printed-dress-1.jpg,Desigual Blue & Green Printed Dress 1,Desigual Blue & Green Printed Dress 1
C-T-AX-19,/armani-exchange-white-top-with-ruffle-sleeves-1.jpg,/armani-exchange-white-top-with-ruffle-sleeves-1.jpg,Armani Exchange White Top With Ruffle Sleeves 1,/armani-exchange-white-top-with-ruffle-sleeves-1.jpg,Armani Exchange White Top With Ruffle Sleeves 1,Armani Exchange White Top With Ruffle Sleeves 1
C-T-JCC-07,/juicy-couture-purple-&-black-printed-top-1.jpg,/juicy-couture-purple-&-black-printed-top-1.jpg,Juicy Couture Purple & Black Printed Top 1,/juicy-couture-purple-&-black-printed-top-1.jpg,Juicy Couture Purple & Black Printed Top 1,Juicy Couture Purple & Black Printed Top 1
C-D-NW-01,/nine-west-red-gathered-dress-1.jpg,/nine-west-red-gathered-dress-1.jpg,Nine West Red Gathered Dress 1,/nine-west-red-gathered-dress-1.jpg,Nine West Red Gathered Dress 1,Nine West Red Gathered Dress 1
C-T-FF-07,/109°f-black-&-pink-printed-top-1.jpg,/109°f-black-&-pink-printed-top-1.jpg,109°F Black & Pink Printed Top 1,/109°f-black-&-pink-printed-top-1.jpg,109°F Black & Pink Printed Top 1,109°F Black & Pink Printed Top 1
C-T-SEM-01,/self-esteem-blue-&-brown-printed-top-1.jpg,/self-esteem-blue-&-brown-printed-top-1.jpg,Self Esteem Blue & Brown Printed Top 1,/self-esteem-blue-&-brown-printed-top-1.jpg,Self Esteem Blue & Brown Printed Top 1,Self Esteem Blue & Brown Printed Top 1
C-T-SEM-02,/self-esteem-blue-floral-print-top-1.jpg,/self-esteem-blue-floral-print-top-1.jpg,Self Esteem Blue Floral Print Top 1,/self-esteem-blue-floral-print-top-1.jpg,Self Esteem Blue Floral Print Top 1,Self Esteem Blue Floral Print Top 1
C-T-XO-01,/xoxo-brown-&-black-printed-top-1.jpg,/xoxo-brown-&-black-printed-top-1.jpg,XOXO Brown & Black Printed Top 1,/xoxo-brown-&-black-printed-top-1.jpg,XOXO Brown & Black Printed Top 1,XOXO Brown & Black Printed Top 1
C-D-MJ-02,/monisha-jaising-blue-net-sequins-dress-1.jpg,/monisha-jaising-blue-net-sequins-dress-1.jpg,Monisha Jaising Blue Net Sequins Dress 1,/monisha-jaising-blue-net-sequins-dress-1.jpg,Monisha Jaising Blue Net Sequins Dress 1,Monisha Jaising Blue Net Sequins Dress 1
S-H-CARL-01,/carlton-golden-peep-toes-heels-1.jpg,/carlton-golden-peep-toes-heels-1.jpg,CARLTON Golden Peep Toes Heels 1,/carlton-golden-peep-toes-heels-1.jpg,CARLTON Golden Peep Toes Heels 1,CARLTON Golden Peep Toes Heels 1
C-B-MNG-32,/mango-black-denim-jeans-1.jpg,/mango-black-denim-jeans-1.jpg,Mango Black Denim Jeans 1,/mango-black-denim-jeans-1.jpg,Mango Black Denim Jeans 1,Mango Black Denim Jeans 1
C-B-MNS-48,/marks-and-spencer-dark-blue-jeggings-1.jpg,/marks-and-spencer-dark-blue-jeggings-1.jpg,Marks and Spencer Dark Blue Jeggings 1,/marks-and-spencer-dark-blue-jeggings-1.jpg,Marks and Spencer Dark Blue Jeggings 1,Marks and Spencer Dark Blue Jeggings 1
C-B-LS-22,/levis-green-shorts-1.jpg,/levis-green-shorts-1.jpg,Levis Green Shorts 1,/levis-green-shorts-1.jpg,Levis Green Shorts 1,Levis Green Shorts 1
C-T-MNG-89,/mango-pink-top-with-pleated-sleeves-1.jpg,/mango-pink-top-with-pleated-sleeves-1.jpg,Mango Pink Top With Pleated Sleeves 1,/mango-pink-top-with-pleated-sleeves-1.jpg,Mango Pink Top With Pleated Sleeves 1,Mango Pink Top With Pleated Sleeves 1
S-H-SM-13,/steve-madden-brown-boots-1.jpg,/steve-madden-brown-boots-1.jpg,Steve Madden Brown Boots 1,/steve-madden-brown-boots-1.jpg,Steve Madden Brown Boots 1,Steve Madden Brown Boots 1
C-D-JN-12,/jane-norman-grey-dress-with-buckles-1.jpg,/jane-norman-grey-dress-with-buckles-1.jpg,Jane Norman Grey Dress With Buckles 1,/jane-norman-grey-dress-with-buckles-1.jpg,Jane Norman Grey Dress With Buckles 1,Jane Norman Grey Dress With Buckles 1
C-T-NLK-06,/new-look-black-bolero-jacket-1.jpg,/new-look-black-bolero-jacket-1.jpg,New Look Black Bolero Jacket 1,/new-look-black-bolero-jacket-1.jpg,New Look Black Bolero Jacket 1,New Look Black Bolero Jacket 1
C-T-ESP-32,/esprit-red-&-white-striped-shirt-1.jpg,/esprit-red-&-white-striped-shirt-1.jpg,Esprit Red & White Striped Shirt 1,/esprit-red-&-white-striped-shirt-1.jpg,Esprit Red & White Striped Shirt 1,Esprit Red & White Striped Shirt 1
