C-T-ATY-01,/armand-thiery-white-embroidered-top-2.jpg,/armand-thiery-white-embroidered-top-2.jpg,ARMAND THIERY White Embroidered Top 2,/armand-thiery-white-embroidered-top-2.jpg,ARMAND THIERY White Embroidered Top 2,ARMAND THIERY White Embroidered Top 2
C-T-MNS-91,/marks-and-spencer-orange-sleeveless-top-2.jpg,/marks-and-spencer-orange-sleeveless-top-2.jpg,Marks and Spencer Orange Sleeveless Top 2,/marks-and-spencer-orange-sleeveless-top-2.jpg,Marks and Spencer Orange Sleeveless Top 2,Marks and Spencer Orange Sleeveless Top 2
C-T-FF-10,/109°f-mint-green-&-white-top-2.jpg,/109°f-mint-green-&-white-top-2.jpg,109°F Mint Green & White Top 2,/109°f-mint-green-&-white-top-2.jpg,109°F Mint Green & White Top 2,109°F Mint Green & White Top 2
C-D-BDA-01,/bb-dakota-orange-halter-dress-2.jpg,/bb-dakota-orange-halter-dress-2.jpg,BB DAKOTA Orange Halter Dress 2,/bb-dakota-orange-halter-dress-2.jpg,BB DAKOTA Orange Halter Dress 2,BB DAKOTA Orange Halter Dress 2
S-F-CS-04,/clarks-brown-beaded-sandals-2.jpg,/clarks-brown-beaded-sandals-2.jpg,Clarks Brown Beaded Sandals 2,/clarks-brown-beaded-sandals-2.jpg,Clarks Brown Beaded Sandals 2,Clarks Brown Beaded Sandals 2
C-D-PD-17,/promod-black-checked-sleeveless-dress-2.jpg,/promod-black-checked-sleeveless-dress-2.jpg,Promod Black Checked Sleeveless Dress 2,/promod-black-checked-sleeveless-dress-2.jpg,Promod Black Checked Sleeveless Dress 2,Promod Black Checked Sleeveless Dress 2
S-H-TE-07,/tresmode-black-peep-toe-pumps-2.jpg,/tresmode-black-peep-toe-pumps-2.jpg,TresMode Black Peep Toe Pumps 2,/tresmode-black-peep-toe-pumps-2.jpg,TresMode Black Peep Toe Pumps 2,TresMode Black Peep Toe Pumps 2
B-H-KC-02,/kenneth-cole-white-hobo-handbag-2.jpg,/kenneth-cole-white-hobo-handbag-2.jpg,Kenneth Cole White Hobo Handbag 2,/kenneth-cole-white-hobo-handbag-2.jpg,Kenneth Cole White Hobo Handbag 2,Kenneth Cole White Hobo Handbag 2
,,,,,,
S-F-C&K-07,/charles-and-keith-blue-ballerina-flats-1.jpg,/charles-and-keith-blue-ballerina-flats-1.jpg,Charles and Keith Blue Ballerina Flats 1,/charles-and-keith-blue-ballerina-flats-1.jpg,Charles and Keith Blue Ballerina Flats 1,Charles and Keith Blue Ballerina Flats 1
S-F-C&K-08,/charles-and-keith-black-flat-strappy-sandals-1.jpg,/charles-and-keith-black-flat-strappy-sandals-1.jpg,Charles and Keith Black Flat Strappy Sandals 1,/charles-and-keith-black-flat-strappy-sandals-1.jpg,Charles and Keith Black Flat Strappy Sandals 1,Charles and Keith Black Flat Strappy Sandals 1
C-B-GS-09,/guess-dark-blue-skinny-jeans-1.jpg,/guess-dark-blue-skinny-jeans-1.jpg,Guess Dark Blue Skinny Jeans 1,/guess-dark-blue-skinny-jeans-1.jpg,Guess Dark Blue Skinny Jeans 1,Guess Dark Blue Skinny Jeans 1
C-B-P&B-02,/pull-&-bear-blue-floral-pants-1.jpg,/pull-&-bear-blue-floral-pants-1.jpg,Pull & Bear Blue Floral Pants 1,/pull-&-bear-blue-floral-pants-1.jpg,Pull & Bear Blue Floral Pants 1,Pull & Bear Blue Floral Pants 1
C-T-ESP-34,/esprit-blue-&-grey-printed-top-1.jpg,/esprit-blue-&-grey-printed-top-1.jpg,Esprit Blue & Grey Printed Top 1,/esprit-blue-&-grey-printed-top-1.jpg,Esprit Blue & Grey Printed Top 1,Esprit Blue & Grey Printed Top 1
C-D-TH-03,/tommy-hilfiger-blue-bird-print-dress-1.jpg,/tommy-hilfiger-blue-bird-print-dress-1.jpg,Tommy Hilfiger Blue Bird Print Dress 1,/tommy-hilfiger-blue-bird-print-dress-1.jpg,Tommy Hilfiger Blue Bird Print Dress 1,Tommy Hilfiger Blue Bird Print Dress 1
C-D-GP-06,/gap-green-dress-with-elasticated-waist-1.jpg,/gap-green-dress-with-elasticated-waist-1.jpg,Gap Green Dress With Elasticated Waist 1,/gap-green-dress-with-elasticated-waist-1.jpg,Gap Green Dress With Elasticated Waist 1,Gap Green Dress With Elasticated Waist 1
C-T-AERO-09,/aeropostale-turquoise-applique-top-1.jpg,/aeropostale-turquoise-applique-top-1.jpg,Aeropostale Turquoise Applique Top 1,/aeropostale-turquoise-applique-top-1.jpg,Aeropostale Turquoise Applique Top 1,Aeropostale Turquoise Applique Top 1
C-B-TH-06,/tommy-hilfiger-grey-skinny-jeans-1.jpg,/tommy-hilfiger-grey-skinny-jeans-1.jpg,Tommy Hilfiger Grey Skinny Jeans 1,/tommy-hilfiger-grey-skinny-jeans-1.jpg,Tommy Hilfiger Grey Skinny Jeans 1,Tommy Hilfiger Grey Skinny Jeans 1
C-B-LS-26,/levis-dark-blue-five-pocket-skinny-jeans-1.jpg,/levis-dark-blue-five-pocket-skinny-jeans-1.jpg,Levis Dark Blue Five Pocket Skinny Jeans 1,/levis-dark-blue-five-pocket-skinny-jeans-1.jpg,Levis Dark Blue Five Pocket Skinny Jeans 1,Levis Dark Blue Five Pocket Skinny Jeans 1
C-B-GP-21,/gap-dark-blue-legging-jeans-1.jpg,/gap-dark-blue-legging-jeans-1.jpg,Gap Dark Blue Legging Jeans 1,/gap-dark-blue-legging-jeans-1.jpg,Gap Dark Blue Legging Jeans 1,Gap Dark Blue Legging Jeans 1
C-B-UCB-42,/united-colors-of-benetton-blue-washed-skinny-jeans-1.jpg,/united-colors-of-benetton-blue-washed-skinny-jeans-1.jpg,United Colors of Benetton Blue Washed Skinny Jeans 1,/united-colors-of-benetton-blue-washed-skinny-jeans-1.jpg,United Colors of Benetton Blue Washed Skinny Jeans 1,United Colors of Benetton Blue Washed Skinny Jeans 1
C-B-AERO-05,/aeropostale-pink-denim-jeans-1.jpg,/aeropostale-pink-denim-jeans-1.jpg,Aeropostale Pink Denim Jeans 1,/aeropostale-pink-denim-jeans-1.jpg,Aeropostale Pink Denim Jeans 1,Aeropostale Pink Denim Jeans 1
C-B-P&B-03,/pull-&-bear-dark-blue-jeans-1.jpg,/pull-&-bear-dark-blue-jeans-1.jpg,Pull & Bear Dark Blue Jeans 1,/pull-&-bear-dark-blue-jeans-1.jpg,Pull & Bear Dark Blue Jeans 1,Pull & Bear Dark Blue Jeans 1
B-H-CPR-02,/caprese-black-satchel-bag-1.jpg,/caprese-black-satchel-bag-1.jpg,Caprese Black Satchel Bag 1,/caprese-black-satchel-bag-1.jpg,Caprese Black Satchel Bag 1,Caprese Black Satchel Bag 1
S-F-ENR-01,/enroute-brown-sandals-1.jpg,/enroute-brown-sandals-1.jpg,ENROUTE Brown Sandals 1,/enroute-brown-sandals-1.jpg,ENROUTE Brown Sandals 1,ENROUTE Brown Sandals 1
S-H-ENR-02,/enroute-black-kitten-heels-1.jpg,/enroute-black-kitten-heels-1.jpg,ENROUTE Black Kitten Heels 1,/enroute-black-kitten-heels-1.jpg,ENROUTE Black Kitten Heels 1,ENROUTE Black Kitten Heels 1
C-B-MNS-53,/marks-and-spencer-blue-printed-jeggings-1.jpg,/marks-and-spencer-blue-printed-jeggings-1.jpg,Marks and Spencer Blue Printed Jeggings 1,/marks-and-spencer-blue-printed-jeggings-1.jpg,Marks and Spencer Blue Printed Jeggings 1,Marks and Spencer Blue Printed Jeggings 1
C-T-OY-47,/only-pink-floral-spaghetti-strap-top-1.jpg,/only-pink-floral-spaghetti-strap-top-1.jpg,ONLY Pink Floral Spaghetti Strap Top 1,/only-pink-floral-spaghetti-strap-top-1.jpg,ONLY Pink Floral Spaghetti Strap Top 1,ONLY Pink Floral Spaghetti Strap Top 1
C-T-JGA-02,/jayati-goenka-blue-&-white-printed-shrug-1.jpg,/jayati-goenka-blue-&-white-printed-shrug-1.jpg,Jayati Goenka Blue & White Printed Shrug 1,/jayati-goenka-blue-&-white-printed-shrug-1.jpg,Jayati Goenka Blue & White Printed Shrug 1,Jayati Goenka Blue & White Printed Shrug 1
C-B-LS-27,/levis-blue-low-rise-skinny-jeans-1.jpg,/levis-blue-low-rise-skinny-jeans-1.jpg,Levis Blue Low Rise Skinny Jeans 1,/levis-blue-low-rise-skinny-jeans-1.jpg,Levis Blue Low Rise Skinny Jeans 1,Levis Blue Low Rise Skinny Jeans 1
C-T-ASY-26,/allen-solly-purple-striped-shirt-1.jpg,/allen-solly-purple-striped-shirt-1.jpg,Allen Solly Purple Striped Shirt 1,/allen-solly-purple-striped-shirt-1.jpg,Allen Solly Purple Striped Shirt 1,Allen Solly Purple Striped Shirt 1
C-B-RI-03,/river-island-purple-pleated-skirt-1.jpg,/river-island-purple-pleated-skirt-1.jpg,River Island Purple Pleated Skirt 1,/river-island-purple-pleated-skirt-1.jpg,River Island Purple Pleated Skirt 1,River Island Purple Pleated Skirt 1
C-B-MNG-41,/mango-black-trousers-1.jpg,/mango-black-trousers-1.jpg,Mango Black Trousers 1,/mango-black-trousers-1.jpg,Mango Black Trousers 1,Mango Black Trousers 1
C-B-TH-07,/tommy-hilfiger-blue-oval-pockets-skinny-jeans-1.jpg,/tommy-hilfiger-blue-oval-pockets-skinny-jeans-1.jpg,Tommy Hilfiger Blue Oval Pockets Skinny Jeans 1,/tommy-hilfiger-blue-oval-pockets-skinny-jeans-1.jpg,Tommy Hilfiger Blue Oval Pockets Skinny Jeans 1,Tommy Hilfiger Blue Oval Pockets Skinny Jeans 1
C-B-SO-06,/s.oliver-light-blue-straight-jeans-1.jpg,/s.oliver-light-blue-straight-jeans-1.jpg,S.Oliver Light Blue Straight Jeans 1,/s.oliver-light-blue-straight-jeans-1.jpg,S.Oliver Light Blue Straight Jeans 1,S.Oliver Light Blue Straight Jeans 1
C-B-2XTZ-01,/2-xtremz-white-&-black-striped-skirt-1.jpg,/2-xtremz-white-&-black-striped-skirt-1.jpg,2 XTREMZ White & Black Striped Skirt 1,/2-xtremz-white-&-black-striped-skirt-1.jpg,2 XTREMZ White & Black Striped Skirt 1,2 XTREMZ White & Black Striped Skirt 1
A-OT-ACC-01,/accesorize-blue-crochet-cap-with-sequins-1.jpg,/accesorize-blue-crochet-cap-with-sequins-1.jpg,Accesorize Blue Crochet Cap With Sequins 1,/accesorize-blue-crochet-cap-with-sequins-1.jpg,Accesorize Blue Crochet Cap With Sequins 1,Accesorize Blue Crochet Cap With Sequins 1
A-OT-ACC-02,/accesorize-black-cap-with-bow-1.jpg,/accesorize-black-cap-with-bow-1.jpg,Accesorize Black Cap with Bow 1,/accesorize-black-cap-with-bow-1.jpg,Accesorize Black Cap with Bow 1,Accesorize Black Cap with Bow 1
A-OT-ACC-03,/accesorize-green-&-beige-cap-1.jpg,/accesorize-green-&-beige-cap-1.jpg,Accesorize Green & Beige Cap 1,/accesorize-green-&-beige-cap-1.jpg,Accesorize Green & Beige Cap 1,Accesorize Green & Beige Cap 1
C-O-MNG-18,/mango-black-one-buttoned-jacket-1.jpg,/mango-black-one-buttoned-jacket-1.jpg,Mango Black one Buttoned Jacket 1,/mango-black-one-buttoned-jacket-1.jpg,Mango Black one Buttoned Jacket 1,Mango Black one Buttoned Jacket 1
C-T-ZA-178,/zara-green-solid-tube-top-1.jpg,/zara-green-solid-tube-top-1.jpg,Zara Green Solid Tube Top 1,/zara-green-solid-tube-top-1.jpg,Zara Green Solid Tube Top 1,Zara Green Solid Tube Top 1
C-T-FRI-01,/ferrari-black-top-with-yellow-detailing-1.jpg,/ferrari-black-top-with-yellow-detailing-1.jpg,Ferrari Black Top With Yellow Detailing 1,/ferrari-black-top-with-yellow-detailing-1.jpg,Ferrari Black Top With Yellow Detailing 1,Ferrari Black Top With Yellow Detailing 1
C-T-FRI-02,/ferrari-red-spaghetti-strap-top-1.jpg,/ferrari-red-spaghetti-strap-top-1.jpg,Ferrari Red Spaghetti Strap Top 1,/ferrari-red-spaghetti-strap-top-1.jpg,Ferrari Red Spaghetti Strap Top 1,Ferrari Red Spaghetti Strap Top 1
C-B-ZA-91,/zara-blue-&-black-panel-skirt-1.jpg,/zara-blue-&-black-panel-skirt-1.jpg,Zara Blue & Black Panel Skirt 1,/zara-blue-&-black-panel-skirt-1.jpg,Zara Blue & Black Panel Skirt 1,Zara Blue & Black Panel Skirt 1
C-D-H&M-25,/h&m-brown-printed-pleated-dress-1.jpg,/h&m-brown-printed-pleated-dress-1.jpg,H&M Brown Printed Pleated Dress 1,/h&m-brown-printed-pleated-dress-1.jpg,H&M Brown Printed Pleated Dress 1,H&M Brown Printed Pleated Dress 1
C-D-ZA-67,/zara-black-&-white-striped-dress-1.jpg,/zara-black-&-white-striped-dress-1.jpg,Zara Black & White Striped Dress 1,/zara-black-&-white-striped-dress-1.jpg,Zara Black & White Striped Dress 1,Zara Black & White Striped Dress 1
C-T-MNS-90,/marks-and-spencer-black-top-with-pleated-sleeves-1.jpg,/marks-and-spencer-black-top-with-pleated-sleeves-1.jpg,Marks and Spencer Black Top With Pleated Sleeves 1,/marks-and-spencer-black-top-with-pleated-sleeves-1.jpg,Marks and Spencer Black Top With Pleated Sleeves 1,Marks and Spencer Black Top With Pleated Sleeves 1
C-T-DP-13,/dorothy-perkins-blue-lace-peplum-top-1.jpg,/dorothy-perkins-blue-lace-peplum-top-1.jpg,Dorothy Perkins Blue Lace Peplum Top 1,/dorothy-perkins-blue-lace-peplum-top-1.jpg,Dorothy Perkins Blue Lace Peplum Top 1,Dorothy Perkins Blue Lace Peplum Top 1
C-D-NYC-02,/new-york-and-company-black-belted-dress-1.jpg,/new-york-and-company-black-belted-dress-1.jpg,New York and Company Black Belted Dress 1,/new-york-and-company-black-belted-dress-1.jpg,New York and Company Black Belted Dress 1,New York and Company Black Belted Dress 1
C-O-FN-01,/forever-new-pink-all-over-rosettes-jacket-1.jpg,/forever-new-pink-all-over-rosettes-jacket-1.jpg,Forever New Pink All Over Rosettes Jacket 1,/forever-new-pink-all-over-rosettes-jacket-1.jpg,Forever New Pink All Over Rosettes Jacket 1,Forever New Pink All Over Rosettes Jacket 1
C-T-KC-03,/kenneth-cole-orange-cowl-neck-top-1.jpg,/kenneth-cole-orange-cowl-neck-top-1.jpg,Kenneth Cole Orange Cowl Neck Top 1,/kenneth-cole-orange-cowl-neck-top-1.jpg,Kenneth Cole Orange Cowl Neck Top 1,Kenneth Cole Orange Cowl Neck Top 1
C-D-MDE-04,/madame-red-&-black-checked-dress-1.jpg,/madame-red-&-black-checked-dress-1.jpg,Madame Red & Black Checked Dress 1,/madame-red-&-black-checked-dress-1.jpg,Madame Red & Black Checked Dress 1,Madame Red & Black Checked Dress 1
C-T-TH-37,/tommy-hilfiger-yellow-round-neck-top-1.jpg,/tommy-hilfiger-yellow-round-neck-top-1.jpg,Tommy Hilfiger Yellow Round Neck Top 1,/tommy-hilfiger-yellow-round-neck-top-1.jpg,Tommy Hilfiger Yellow Round Neck Top 1,Tommy Hilfiger Yellow Round Neck Top 1
C-T-GP-18,/gap-pink-&-white-striped-sleeveless-top-1.jpg,/gap-pink-&-white-striped-sleeveless-top-1.jpg,Gap Pink & White Striped Sleeveless Top 1,/gap-pink-&-white-striped-sleeveless-top-1.jpg,Gap Pink & White Striped Sleeveless Top 1,Gap Pink & White Striped Sleeveless Top 1
C-D-RE-03,/remanika-brown-buttoned-dress-1.jpg,/remanika-brown-buttoned-dress-1.jpg,Remanika Brown Buttoned Dress 1,/remanika-brown-buttoned-dress-1.jpg,Remanika Brown Buttoned Dress 1,Remanika Brown Buttoned Dress 1
C-B-BHS-01,/british-home-store-grey-formal-skirt-1.jpg,/british-home-store-grey-formal-skirt-1.jpg,British Home Store Grey Formal Skirt 1,/british-home-store-grey-formal-skirt-1.jpg,British Home Store Grey Formal Skirt 1,British Home Store Grey Formal Skirt 1
C-T-MNG-103,/mango-black-top-with-detailing-on-sleeves-1.jpg,/mango-black-top-with-detailing-on-sleeves-1.jpg,Mango Black Top With Detailing On Sleeves 1,/mango-black-top-with-detailing-on-sleeves-1.jpg,Mango Black Top With Detailing On Sleeves 1,Mango Black Top With Detailing On Sleeves 1
C-T-VM-83,/vero-moda-fuchsia-shirt-with-golden-buttons-1.jpg,/vero-moda-fuchsia-shirt-with-golden-buttons-1.jpg,Vero Moda Fuchsia Shirt With Golden Buttons 1,/vero-moda-fuchsia-shirt-with-golden-buttons-1.jpg,Vero Moda Fuchsia Shirt With Golden Buttons 1,Vero Moda Fuchsia Shirt With Golden Buttons 1
C-T-VM-84,/vero-moda-blue-halter-neck-top-1.jpg,/vero-moda-blue-halter-neck-top-1.jpg,Vero Moda Blue Halter Neck Top 1,/vero-moda-blue-halter-neck-top-1.jpg,Vero Moda Blue Halter Neck Top 1,Vero Moda Blue Halter Neck Top 1
C-D-VM-32,/vero-moda-magenta-halter-dress-1.jpg,/vero-moda-magenta-halter-dress-1.jpg,Vero Moda Magenta Halter Dress 1,/vero-moda-magenta-halter-dress-1.jpg,Vero Moda Magenta Halter Dress 1,Vero Moda Magenta Halter Dress 1
C-D-GD-03,/global-desi-green-printed-maxi-dress-1.jpg,/global-desi-green-printed-maxi-dress-1.jpg,Global Desi Green Printed Maxi Dress 1,/global-desi-green-printed-maxi-dress-1.jpg,Global Desi Green Printed Maxi Dress 1,Global Desi Green Printed Maxi Dress 1
C-B-7F-02,/7-for-all-mankind-blue-bootcut-jeans-1.jpg,/7-for-all-mankind-blue-bootcut-jeans-1.jpg,7 for all Mankind Blue Bootcut Jeans 1,/7-for-all-mankind-blue-bootcut-jeans-1.jpg,7 for all Mankind Blue Bootcut Jeans 1,7 for all Mankind Blue Bootcut Jeans 1
C-B-7F-03,/7-for-all-mankind-blue-bootcut-jeans-with-studs-1.jpg,/7-for-all-mankind-blue-bootcut-jeans-with-studs-1.jpg,7 for all Mankind Blue Bootcut Jeans with Studs 1,/7-for-all-mankind-blue-bootcut-jeans-with-studs-1.jpg,7 for all Mankind Blue Bootcut Jeans with Studs 1,7 for all Mankind Blue Bootcut Jeans with Studs 1
C-B-7F-04,/7-for-all-mankind-blue-flared-denim-jeans-with-embellishment-1.jpg,/7-for-all-mankind-blue-flared-denim-jeans-with-embellishment-1.jpg,7 for all Mankind Blue Flared Denim Jeans With Embellishment 1,/7-for-all-mankind-blue-flared-denim-jeans-with-embellishment-1.jpg,7 for all Mankind Blue Flared Denim Jeans With Embellishment 1,7 for all Mankind Blue Flared Denim Jeans With Embellishment 1
C-B-7F-05,/7-for-all-mankind-blue-denim-jeans-with-stud-1.jpg,/7-for-all-mankind-blue-denim-jeans-with-stud-1.jpg,7 for all Mankind Blue Denim Jeans with Stud 1,/7-for-all-mankind-blue-denim-jeans-with-stud-1.jpg,7 for all Mankind Blue Denim Jeans with Stud 1,7 for all Mankind Blue Denim Jeans with Stud 1
C-T-AX-21,/armani-exchange-blue-v-neck-top-with-silver-detailing-1.jpg,/armani-exchange-blue-v-neck-top-with-silver-detailing-1.jpg,Armani Exchange Blue V-Neck Top with Silver Detailing 1,/armani-exchange-blue-v-neck-top-with-silver-detailing-1.jpg,Armani Exchange Blue V-Neck Top with Silver Detailing 1,Armani Exchange Blue V-Neck Top with Silver Detailing 1
C-T-ZA-179,/zara-orange-&-white-printed-knit-top-1.jpg,/zara-orange-&-white-printed-knit-top-1.jpg,Zara Orange & White Printed Knit Top 1,/zara-orange-&-white-printed-knit-top-1.jpg,Zara Orange & White Printed Knit Top 1,Zara Orange & White Printed Knit Top 1
C-SU-RK-64,/ritu-kumar-black-printed-&-embroidered-kurta-1.jpg,/ritu-kumar-black-printed-&-embroidered-kurta-1.jpg,Ritu Kumar Black Printed & Embroidered Kurta 1,/ritu-kumar-black-printed-&-embroidered-kurta-1.jpg,Ritu Kumar Black Printed & Embroidered Kurta 1,Ritu Kumar Black Printed & Embroidered Kurta 1
C-T-A&F-07,/abercrombie-&-fitch-pink-&-blue-striped-top-1.jpg,/abercrombie-&-fitch-pink-&-blue-striped-top-1.jpg,Abercrombie & Fitch Pink & Blue Striped Top 1,/abercrombie-&-fitch-pink-&-blue-striped-top-1.jpg,Abercrombie & Fitch Pink & Blue Striped Top 1,Abercrombie & Fitch Pink & Blue Striped Top 1
C-T-ZA-180,/zara-white-floral-blouse-1.jpg,/zara-white-floral-blouse-1.jpg,Zara White Floral Blouse 1,/zara-white-floral-blouse-1.jpg,Zara White Floral Blouse 1,Zara White Floral Blouse 1
C-T-AX-22,/armani-exchange-beige-&-black-printed-full-sleeves-top-1.jpg,/armani-exchange-beige-&-black-printed-full-sleeves-top-1.jpg,Armani Exchange Beige & Black Printed Full Sleeves Top 1,/armani-exchange-beige-&-black-printed-full-sleeves-top-1.jpg,Armani Exchange Beige & Black Printed Full Sleeves Top 1,Armani Exchange Beige & Black Printed Full Sleeves Top 1
C-T-AX-23,/armani-exchange-black-&-grey-printed-full-sleeves-top-1.jpg,/armani-exchange-black-&-grey-printed-full-sleeves-top-1.jpg,Armani Exchange Black & Grey Printed Full Sleeves Top 1,/armani-exchange-black-&-grey-printed-full-sleeves-top-1.jpg,Armani Exchange Black & Grey Printed Full Sleeves Top 1,Armani Exchange Black & Grey Printed Full Sleeves Top 1
C-T-AX-24,/armani-exchange-white-&-blue-striped-top-with-sequins-1.jpg,/armani-exchange-white-&-blue-striped-top-with-sequins-1.jpg,Armani Exchange White & Blue Striped Top With Sequins 1,/armani-exchange-white-&-blue-striped-top-with-sequins-1.jpg,Armani Exchange White & Blue Striped Top With Sequins 1,Armani Exchange White & Blue Striped Top With Sequins 1
C-T-AX-25,/armani-exchange-coral-sequined-top-1.jpg,/armani-exchange-coral-sequined-top-1.jpg,Armani Exchange Coral Sequined Top 1,/armani-exchange-coral-sequined-top-1.jpg,Armani Exchange Coral Sequined Top 1,Armani Exchange Coral Sequined Top 1
C-T-AX-26,/armani-exchange-white-round-neck-top-with-silver-detailing-1.jpg,/armani-exchange-white-round-neck-top-with-silver-detailing-1.jpg,Armani Exchange White Round Neck Top With Silver Detailing 1,/armani-exchange-white-round-neck-top-with-silver-detailing-1.jpg,Armani Exchange White Round Neck Top With Silver Detailing 1,Armani Exchange White Round Neck Top With Silver Detailing 1
C-T-A&F-08,/abercrombie-&-fitch-pink-&-white-striped-top-1.jpg,/abercrombie-&-fitch-pink-&-white-striped-top-1.jpg,Abercrombie & Fitch Pink & White Striped Top 1,/abercrombie-&-fitch-pink-&-white-striped-top-1.jpg,Abercrombie & Fitch Pink & White Striped Top 1,Abercrombie & Fitch Pink & White Striped Top 1
C-T-MK-05,/michael-kors-blue-&-white-striped-zip-shoulder-top-1.jpg,/michael-kors-blue-&-white-striped-zip-shoulder-top-1.jpg,Michael Kors Blue & White Striped Zip Shoulder Top 1,/michael-kors-blue-&-white-striped-zip-shoulder-top-1.jpg,Michael Kors Blue & White Striped Zip Shoulder Top 1,Michael Kors Blue & White Striped Zip Shoulder Top 1
C-T-AX-27,/armani-exchange-pink-cutout-shoulder-top-1.jpg,/armani-exchange-pink-cutout-shoulder-top-1.jpg,Armani Exchange Pink Cutout Shoulder Top 1,/armani-exchange-pink-cutout-shoulder-top-1.jpg,Armani Exchange Pink Cutout Shoulder Top 1,Armani Exchange Pink Cutout Shoulder Top 1
C-T-MK-06,/michael-kors-pink-chain-neckline-top-1.jpg,/michael-kors-pink-chain-neckline-top-1.jpg,Michael Kors Pink Chain Neckline Top 1,/michael-kors-pink-chain-neckline-top-1.jpg,Michael Kors Pink Chain Neckline Top 1,Michael Kors Pink Chain Neckline Top 1
C-B-ESP-10,/esprit-purple-denim-jeans-1.jpg,/esprit-purple-denim-jeans-1.jpg,Esprit Purple Denim Jeans 1,/esprit-purple-denim-jeans-1.jpg,Esprit Purple Denim Jeans 1,Esprit Purple Denim Jeans 1
C-SU-RK-65,"/ritu-kumar-black,yellow-&-pink-embroidered-kurta-1.jpg","/ritu-kumar-black,yellow-&-pink-embroidered-kurta-1.jpg","Ritu Kumar Black,Yellow & Pink Embroidered Kurta 1","/ritu-kumar-black,yellow-&-pink-embroidered-kurta-1.jpg","Ritu Kumar Black,Yellow & Pink Embroidered Kurta 1","Ritu Kumar Black,Yellow & Pink Embroidered Kurta 1"
C-T-TH-39,/tommy-hilfiger-blue-&-peach-striped-shirt-1.jpg,/tommy-hilfiger-blue-&-peach-striped-shirt-1.jpg,Tommy Hilfiger Blue & Peach Striped Shirt 1,/tommy-hilfiger-blue-&-peach-striped-shirt-1.jpg,Tommy Hilfiger Blue & Peach Striped Shirt 1,Tommy Hilfiger Blue & Peach Striped Shirt 1
B-H-DAMO-03,/da-milano-black-handbag-with-silver-handles-1.jpg,/da-milano-black-handbag-with-silver-handles-1.jpg,DA MILANO Black Handbag With Silver Handles 1,/da-milano-black-handbag-with-silver-handles-1.jpg,DA MILANO Black Handbag With Silver Handles 1,DA MILANO Black Handbag With Silver Handles 1
B-H-GS-13,/guess-brown-leather-mini-handbag-1.jpg,/guess-brown-leather-mini-handbag-1.jpg,Guess Brown Leather Mini Handbag 1,/guess-brown-leather-mini-handbag-1.jpg,Guess Brown Leather Mini Handbag 1,Guess Brown Leather Mini Handbag 1
B-H-GS-14,/guess-beige-&-grey-monogram-bag-1.jpg,/guess-beige-&-grey-monogram-bag-1.jpg,Guess Beige & Grey Monogram Bag 1,/guess-beige-&-grey-monogram-bag-1.jpg,Guess Beige & Grey Monogram Bag 1,Guess Beige & Grey Monogram Bag 1
C-T-RY-05,/roxy-multi-color-tube-top-1.jpg,/roxy-multi-color-tube-top-1.jpg,Roxy Multi Color Tube Top 1,/roxy-multi-color-tube-top-1.jpg,Roxy Multi Color Tube Top 1,Roxy Multi Color Tube Top 1
C-T-RY-06,/roxy-black-&-white-printed-tube-top-1.jpg,/roxy-black-&-white-printed-tube-top-1.jpg,Roxy Black & White Printed Tube Top 1,/roxy-black-&-white-printed-tube-top-1.jpg,Roxy Black & White Printed Tube Top 1,Roxy Black & White Printed Tube Top 1
C-B-LBD-01,/lucky-brand-blue-&-white-striped-shorts-1.jpg,/lucky-brand-blue-&-white-striped-shorts-1.jpg,Lucky Brand Blue & White Striped Shorts 1,/lucky-brand-blue-&-white-striped-shorts-1.jpg,Lucky Brand Blue & White Striped Shorts 1,Lucky Brand Blue & White Striped Shorts 1
C-O-VM-10,/vero-moda-black-mini-waistcoat-1.jpg,/vero-moda-black-mini-waistcoat-1.jpg,Vero Moda Black Mini Waistcoat 1,/vero-moda-black-mini-waistcoat-1.jpg,Vero Moda Black Mini Waistcoat 1,Vero Moda Black Mini Waistcoat 1
C-D-TH-04,/tommy-hilfiger-blue-printed-sleeveless-dress-1.jpg,/tommy-hilfiger-blue-printed-sleeveless-dress-1.jpg,Tommy Hilfiger Blue Printed Sleeveless Dress 1,/tommy-hilfiger-blue-printed-sleeveless-dress-1.jpg,Tommy Hilfiger Blue Printed Sleeveless Dress 1,Tommy Hilfiger Blue Printed Sleeveless Dress 1
C-O-MNG-19,/mango-mustard-shrug-1.jpg,/mango-mustard-shrug-1.jpg,Mango Mustard Shrug 1,/mango-mustard-shrug-1.jpg,Mango Mustard Shrug 1,Mango Mustard Shrug 1
C-T-H&M-77,/h&m-grey-crossover-top-1.jpg,/h&m-grey-crossover-top-1.jpg,H&M Grey Crossover Top 1,/h&m-grey-crossover-top-1.jpg,H&M Grey Crossover Top 1,H&M Grey Crossover Top 1
C-D-VM-33,/vero-moda-blue-dress-with-lace-detailing-at-back-1.jpg,/vero-moda-blue-dress-with-lace-detailing-at-back-1.jpg,Vero Moda Blue Dress With Lace Detailing At Back 1,/vero-moda-blue-dress-with-lace-detailing-at-back-1.jpg,Vero Moda Blue Dress With Lace Detailing At Back 1,Vero Moda Blue Dress With Lace Detailing At Back 1
C-B-EX-01,/express-dark-blue-legging-jeans-1.jpg,/express-dark-blue-legging-jeans-1.jpg,Express Dark Blue Legging Jeans 1,/express-dark-blue-legging-jeans-1.jpg,Express Dark Blue Legging Jeans 1,Express Dark Blue Legging Jeans 1
C-D-BS-07,/b-slim-black-crossover-dress-1.jpg,/b-slim-black-crossover-dress-1.jpg,B-SLIM Black Crossover Dress 1,/b-slim-black-crossover-dress-1.jpg,B-SLIM Black Crossover Dress 1,B-SLIM Black Crossover Dress 1
S-F-H&M-01,/h&m-blue-&-white-striped-loafers-1.jpg,/h&m-blue-&-white-striped-loafers-1.jpg,H&M Blue & White Striped Loafers 1,/h&m-blue-&-white-striped-loafers-1.jpg,H&M Blue & White Striped Loafers 1,H&M Blue & White Striped Loafers 1
C-T-EX-03,/express-purple-knit-top-1.jpg,/express-purple-knit-top-1.jpg,Express Purple Knit Top 1,/express-purple-knit-top-1.jpg,Express Purple Knit Top 1,Express Purple Knit Top 1
C-D-ZA-68,/zara-black-&-grey-printed-dress-1.jpg,/zara-black-&-grey-printed-dress-1.jpg,Zara Black & Grey Printed Dress 1,/zara-black-&-grey-printed-dress-1.jpg,Zara Black & Grey Printed Dress 1,Zara Black & Grey Printed Dress 1
C-D-EX-02,/express-black-&-white-striped-dress-with-red-piping-1.jpg,/express-black-&-white-striped-dress-with-red-piping-1.jpg,Express Black & White Striped Dress With Red Piping 1,/express-black-&-white-striped-dress-with-red-piping-1.jpg,Express Black & White Striped Dress With Red Piping 1,Express Black & White Striped Dress With Red Piping 1
C-D-GP-07,/gap-black-gathered-dress-1.jpg,/gap-black-gathered-dress-1.jpg,Gap Black Gathered Dress 1,/gap-black-gathered-dress-1.jpg,Gap Black Gathered Dress 1,Gap Black Gathered Dress 1
C-D-ASY-03,/allen-solly-blue-floral-sleeveless-dress-1.jpg,/allen-solly-blue-floral-sleeveless-dress-1.jpg,Allen Solly Blue Floral Sleeveless Dress 1,/allen-solly-blue-floral-sleeveless-dress-1.jpg,Allen Solly Blue Floral Sleeveless Dress 1,Allen Solly Blue Floral Sleeveless Dress 1
