C-T-MNG-90,/mango-orange-full-sleeves-top-1.jpg,/mango-orange-full-sleeves-top-1.jpg,Mango Orange Full Sleeves Top 1,/mango-orange-full-sleeves-top-1.jpg,Mango Orange Full Sleeves Top 1,Mango Orange Full Sleeves Top 1
C-T-MNG-91,/mango-blue-top-with-ruffle-sleeves-1.jpg,/mango-blue-top-with-ruffle-sleeves-1.jpg,Mango Blue Top With Ruffle Sleeves 1,/mango-blue-top-with-ruffle-sleeves-1.jpg,Mango Blue Top With Ruffle Sleeves 1,Mango Blue Top With Ruffle Sleeves 1
C-B-M60-03,/miss-sixty-black-5-pocket-denim-jeans-1.jpg,/miss-sixty-black-5-pocket-denim-jeans-1.jpg,Miss Sixty Black 5 Pocket Denim Jeans 1,/miss-sixty-black-5-pocket-denim-jeans-1.jpg,Miss Sixty Black 5 Pocket Denim Jeans 1,Miss Sixty Black 5 Pocket Denim Jeans 1
C-O-MNG-16,/mango-black-peplum-jacket-1.jpg,/mango-black-peplum-jacket-1.jpg,Mango Black Peplum Jacket 1,/mango-black-peplum-jacket-1.jpg,Mango Black Peplum Jacket 1,Mango Black Peplum Jacket 1
C-T-TS-09,/top-shop-black-&-white-high-neck-top-1.jpg,/top-shop-black-&-white-high-neck-top-1.jpg,Top Shop Black & White High Neck Top 1,/top-shop-black-&-white-high-neck-top-1.jpg,Top Shop Black & White High Neck Top 1,Top Shop Black & White High Neck Top 1
C-B-LS-23,/levis-blue-denim-jeans-with-silver-detailing-1.jpg,/levis-blue-denim-jeans-with-silver-detailing-1.jpg,Levis Blue Denim Jeans With Silver Detailing 1,/levis-blue-denim-jeans-with-silver-detailing-1.jpg,Levis Blue Denim Jeans With Silver Detailing 1,Levis Blue Denim Jeans With Silver Detailing 1
C-B-NE-10,/next-light-blue-boot-cut-denim-jeans-1.jpg,/next-light-blue-boot-cut-denim-jeans-1.jpg,Next Light Blue Boot Cut Denim Jeans 1,/next-light-blue-boot-cut-denim-jeans-1.jpg,Next Light Blue Boot Cut Denim Jeans 1,Next Light Blue Boot Cut Denim Jeans 1
C-D-MNG-50,/mango-red-bodycon-dress-1.jpg,/mango-red-bodycon-dress-1.jpg,Mango Red Bodycon Dress 1,/mango-red-bodycon-dress-1.jpg,Mango Red Bodycon Dress 1,Mango Red Bodycon Dress 1
A-SC-MNS-01,/marks-and-spencer-pink-scarf-1.jpg,/marks-and-spencer-pink-scarf-1.jpg,Marks and Spencer Pink Scarf 1,/marks-and-spencer-pink-scarf-1.jpg,Marks and Spencer Pink Scarf 1,Marks and Spencer Pink Scarf 1
A-SC-NE-01,/next-purple-&-pink-scarf-with-sequins-1.jpg,/next-purple-&-pink-scarf-with-sequins-1.jpg,Next Purple & Pink Scarf With Sequins 1,/next-purple-&-pink-scarf-with-sequins-1.jpg,Next Purple & Pink Scarf With Sequins 1,Next Purple & Pink Scarf With Sequins 1
C-D-LAQU-06,"/latin-quarters-white,-black-&-blue-printed-dress-1.jpg","/latin-quarters-white,-black-&-blue-printed-dress-1.jpg","Latin Quarters White, Black & Blue Printed Dress 1","/latin-quarters-white,-black-&-blue-printed-dress-1.jpg","Latin Quarters White, Black & Blue Printed Dress 1","Latin Quarters White, Black & Blue Printed Dress 1"
C-B-UO-02,/uniqlo-mustard-jeggings-1.jpg,/uniqlo-mustard-jeggings-1.jpg,Uniqlo Mustard Jeggings 1,/uniqlo-mustard-jeggings-1.jpg,Uniqlo Mustard Jeggings 1,Uniqlo Mustard Jeggings 1
C-B-UO-03,/uniqlo-green-cropped-pants-1.jpg,/uniqlo-green-cropped-pants-1.jpg,Uniqlo Green Cropped Pants 1,/uniqlo-green-cropped-pants-1.jpg,Uniqlo Green Cropped Pants 1,Uniqlo Green Cropped Pants 1
C-B-UO-04,/uniqlo-pink-jeggings-1.jpg,/uniqlo-pink-jeggings-1.jpg,Uniqlo Pink Jeggings 1,/uniqlo-pink-jeggings-1.jpg,Uniqlo Pink Jeggings 1,Uniqlo Pink Jeggings 1
C-B-UO-05,/uniqlo-black-&-white-animal-print-jeans-1.jpg,/uniqlo-black-&-white-animal-print-jeans-1.jpg,Uniqlo Black & White Animal Print Jeans 1,/uniqlo-black-&-white-animal-print-jeans-1.jpg,Uniqlo Black & White Animal Print Jeans 1,Uniqlo Black & White Animal Print Jeans 1
C-T-NLK-07,"/new-look-red,white-&-grey-striped-hoodie-1.jpg","/new-look-red,white-&-grey-striped-hoodie-1.jpg","New Look Red,White & Grey Striped Hoodie 1","/new-look-red,white-&-grey-striped-hoodie-1.jpg","New Look Red,White & Grey Striped Hoodie 1","New Look Red,White & Grey Striped Hoodie 1"
C-O-MS-02,/miss-selfridge-black-ribbed-jacket-1.jpg,/miss-selfridge-black-ribbed-jacket-1.jpg,Miss Selfridge Black Ribbed Jacket 1,/miss-selfridge-black-ribbed-jacket-1.jpg,Miss Selfridge Black Ribbed Jacket 1,Miss Selfridge Black Ribbed Jacket 1
C-T-MNG-92,/mango-grey-basic-sweater-1.jpg,/mango-grey-basic-sweater-1.jpg,Mango Grey Basic Sweater 1,/mango-grey-basic-sweater-1.jpg,Mango Grey Basic Sweater 1,Mango Grey Basic Sweater 1
C-O-JN-02,/jane-norman-brown-cardigan-1.jpg,/jane-norman-brown-cardigan-1.jpg,Jane Norman Brown Cardigan 1,/jane-norman-brown-cardigan-1.jpg,Jane Norman Brown Cardigan 1,Jane Norman Brown Cardigan 1
C-T-RY-04,/roxy-blue-&-beige-checked-shirt-1.jpg,/roxy-blue-&-beige-checked-shirt-1.jpg,Roxy Blue & Beige Checked Shirt 1,/roxy-blue-&-beige-checked-shirt-1.jpg,Roxy Blue & Beige Checked Shirt 1,Roxy Blue & Beige Checked Shirt 1
C-T-HO-05,/hollister-blue-&-white-checked-shirt-1.jpg,/hollister-blue-&-white-checked-shirt-1.jpg,Hollister Blue & White Checked Shirt 1,/hollister-blue-&-white-checked-shirt-1.jpg,Hollister Blue & White Checked Shirt 1,Hollister Blue & White Checked Shirt 1
C-T-CSN-01,/caslon-blue-buttoned-shirt-1.jpg,/caslon-blue-buttoned-shirt-1.jpg,Caslon Blue Buttoned Shirt 1,/caslon-blue-buttoned-shirt-1.jpg,Caslon Blue Buttoned Shirt 1,Caslon Blue Buttoned Shirt 1
C-B-FN-07,/forever-new-blue-denim-shorts-1.jpg,/forever-new-blue-denim-shorts-1.jpg,Forever New Blue Denim Shorts 1,/forever-new-blue-denim-shorts-1.jpg,Forever New Blue Denim Shorts 1,Forever New Blue Denim Shorts 1
C-T-FF-08,/109°f-blue-&-red-striped-kaftan-top-1.jpg,/109°f-blue-&-red-striped-kaftan-top-1.jpg,109°F Blue & Red Striped Kaftan Top 1,/109°f-blue-&-red-striped-kaftan-top-1.jpg,109°F Blue & Red Striped Kaftan Top 1,109°F Blue & Red Striped Kaftan Top 1
C-T-FF-09,/109°f-black-top-with-studs-1.jpg,/109°f-black-top-with-studs-1.jpg,109°F Black Top With Studs 1,/109°f-black-top-with-studs-1.jpg,109°F Black Top With Studs 1,109°F Black Top With Studs 1
S-H-FN-01,/forever-new-black-boots-with-silver-detailing-1.jpg,/forever-new-black-boots-with-silver-detailing-1.jpg,Forever New Black Boots with Silver Detailing 1,/forever-new-black-boots-with-silver-detailing-1.jpg,Forever New Black Boots with Silver Detailing 1,Forever New Black Boots with Silver Detailing 1
C-D-BE-08,/bebe-purple-pleated-tube-dress-1.jpg,/bebe-purple-pleated-tube-dress-1.jpg,Bebe Purple Pleated Tube Dress 1,/bebe-purple-pleated-tube-dress-1.jpg,Bebe Purple Pleated Tube Dress 1,Bebe Purple Pleated Tube Dress 1
C-B-ZA-77,/zara-black-&-gold-zipped-trousers-1.jpg,/zara-black-&-gold-zipped-trousers-1.jpg,Zara Black & Gold Zipped Trousers 1,/zara-black-&-gold-zipped-trousers-1.jpg,Zara Black & Gold Zipped Trousers 1,Zara Black & Gold Zipped Trousers 1
C-T-VM-69,/vero-moda-blue-shirt-with-lace-collar-1.jpg,/vero-moda-blue-shirt-with-lace-collar-1.jpg,Vero Moda Blue Shirt With Lace Collar 1,/vero-moda-blue-shirt-with-lace-collar-1.jpg,Vero Moda Blue Shirt With Lace Collar 1,Vero Moda Blue Shirt With Lace Collar 1
C-D-`CHR-01,/charlotte-russe-peach-maxi-dress-with-butterfly-print-1.jpg,/charlotte-russe-peach-maxi-dress-with-butterfly-print-1.jpg,Charlotte Russe Peach Maxi Dress With Butterfly Print 1,/charlotte-russe-peach-maxi-dress-with-butterfly-print-1.jpg,Charlotte Russe Peach Maxi Dress With Butterfly Print 1,Charlotte Russe Peach Maxi Dress With Butterfly Print 1
C-B-PD-17,/promod-white-sequins-skirt-1.jpg,/promod-white-sequins-skirt-1.jpg,Promod White Sequins Skirt 1,/promod-white-sequins-skirt-1.jpg,Promod White Sequins Skirt 1,Promod White Sequins Skirt 1
C-B-TH-04,/tommy-hilfiger-blue-denim-skirt-with-red-detailing-1.jpg,/tommy-hilfiger-blue-denim-skirt-with-red-detailing-1.jpg,Tommy Hilfiger Blue Denim Skirt With Red Detailing 1,/tommy-hilfiger-blue-denim-skirt-with-red-detailing-1.jpg,Tommy Hilfiger Blue Denim Skirt With Red Detailing 1,Tommy Hilfiger Blue Denim Skirt With Red Detailing 1
C-T-FN-10,/forever-new-blue-&-pink-striped-tie-front-top-1.jpg,/forever-new-blue-&-pink-striped-tie-front-top-1.jpg,Forever New Blue & Pink Striped Tie Front Top 1,/forever-new-blue-&-pink-striped-tie-front-top-1.jpg,Forever New Blue & Pink Striped Tie Front Top 1,Forever New Blue & Pink Striped Tie Front Top 1
C-T-MNG-93,/mango-red-top-with-black-detailing-1.jpg,/mango-red-top-with-black-detailing-1.jpg,Mango Red Top With Black Detailing 1,/mango-red-top-with-black-detailing-1.jpg,Mango Red Top With Black Detailing 1,Mango Red Top With Black Detailing 1
C-T-FN-11,/forever-new-pink-floral-ruffled-spaghetti-strap-top-1.jpg,/forever-new-pink-floral-ruffled-spaghetti-strap-top-1.jpg,Forever New Pink Floral Ruffled Spaghetti Strap Top 1,/forever-new-pink-floral-ruffled-spaghetti-strap-top-1.jpg,Forever New Pink Floral Ruffled Spaghetti Strap Top 1,Forever New Pink Floral Ruffled Spaghetti Strap Top 1
C-T-ZA-163,/zara-white-sleeveless-top-1.jpg,/zara-white-sleeveless-top-1.jpg,Zara White Sleeveless Top 1,/zara-white-sleeveless-top-1.jpg,Zara White Sleeveless Top 1,Zara White Sleeveless Top 1
C-T-PD-48,/promod-green-&-silver-sparkly-top-1.jpg,/promod-green-&-silver-sparkly-top-1.jpg,Promod Green & Silver Sparkly Top 1,/promod-green-&-silver-sparkly-top-1.jpg,Promod Green & Silver Sparkly Top 1,Promod Green & Silver Sparkly Top 1