C-D-BE-08,/bebe-purple-pleated-tube-dress-3.jpg,/bebe-purple-pleated-tube-dress-3.jpg,Bebe Purple Pleated Tube Dress 3,/bebe-purple-pleated-tube-dress-3.jpg,Bebe Purple Pleated Tube Dress 3,Bebe Purple Pleated Tube Dress 3
C-B-ZA-77,/zara-black-&-gold-zipped-trousers-3.jpg,/zara-black-&-gold-zipped-trousers-3.jpg,Zara Black & Gold Zipped Trousers 3,/zara-black-&-gold-zipped-trousers-3.jpg,Zara Black & Gold Zipped Trousers 3,Zara Black & Gold Zipped Trousers 3
C-T-VM-69,/vero-moda-blue-shirt-with-lace-collar-3.jpg,/vero-moda-blue-shirt-with-lace-collar-3.jpg,Vero Moda Blue Shirt With Lace Collar 3,/vero-moda-blue-shirt-with-lace-collar-3.jpg,Vero Moda Blue Shirt With Lace Collar 3,Vero Moda Blue Shirt With Lace Collar 3
C-D-`CHR-01,/charlotte-russe-peach-maxi-dress-with-butterfly-print-3.jpg,/charlotte-russe-peach-maxi-dress-with-butterfly-print-3.jpg,Charlotte Russe Peach Maxi Dress With Butterfly Print 3,/charlotte-russe-peach-maxi-dress-with-butterfly-print-3.jpg,Charlotte Russe Peach Maxi Dress With Butterfly Print 3,Charlotte Russe Peach Maxi Dress With Butterfly Print 3
C-B-PD-17,/promod-white-sequins-skirt-3.jpg,/promod-white-sequins-skirt-3.jpg,Promod White Sequins Skirt 3,/promod-white-sequins-skirt-3.jpg,Promod White Sequins Skirt 3,Promod White Sequins Skirt 3
C-B-TH-04,/tommy-hilfiger-blue-denim-skirt-with-red-detailing-3.jpg,/tommy-hilfiger-blue-denim-skirt-with-red-detailing-3.jpg,Tommy Hilfiger Blue Denim Skirt With Red Detailing 3,/tommy-hilfiger-blue-denim-skirt-with-red-detailing-3.jpg,Tommy Hilfiger Blue Denim Skirt With Red Detailing 3,Tommy Hilfiger Blue Denim Skirt With Red Detailing 3
C-T-FN-10,/forever-new-blue-&-pink-striped-tie-front-top-3.jpg,/forever-new-blue-&-pink-striped-tie-front-top-3.jpg,Forever New Blue & Pink Striped Tie Front Top 3,/forever-new-blue-&-pink-striped-tie-front-top-3.jpg,Forever New Blue & Pink Striped Tie Front Top 3,Forever New Blue & Pink Striped Tie Front Top 3
C-T-MNG-93,/mango-red-top-with-black-detailing-3.jpg,/mango-red-top-with-black-detailing-3.jpg,Mango Red Top With Black Detailing 3,/mango-red-top-with-black-detailing-3.jpg,Mango Red Top With Black Detailing 3,Mango Red Top With Black Detailing 3
C-T-FN-11,/forever-new-pink-floral-ruffled-spaghetti-strap-top-3.jpg,/forever-new-pink-floral-ruffled-spaghetti-strap-top-3.jpg,Forever New Pink Floral Ruffled Spaghetti Strap Top 3,/forever-new-pink-floral-ruffled-spaghetti-strap-top-3.jpg,Forever New Pink Floral Ruffled Spaghetti Strap Top 3,Forever New Pink Floral Ruffled Spaghetti Strap Top 3
C-T-ZA-163,/zara-white-sleeveless-top-3.jpg,/zara-white-sleeveless-top-3.jpg,Zara White Sleeveless Top 3,/zara-white-sleeveless-top-3.jpg,Zara White Sleeveless Top 3,Zara White Sleeveless Top 3
C-T-PD-48,/promod-green-&-silver-sparkly-top-3.jpg,/promod-green-&-silver-sparkly-top-3.jpg,Promod Green & Silver Sparkly Top 3,/promod-green-&-silver-sparkly-top-3.jpg,Promod Green & Silver Sparkly Top 3,Promod Green & Silver Sparkly Top 3
,,,,,,
,,,,,,
,,,,,,
B-H-LN-01,/lanvin-brown-basket-purse-2.jpg,/lanvin-brown-basket-purse-2.jpg,Lanvin Brown Basket Purse 2,/lanvin-brown-basket-purse-2.jpg,Lanvin Brown Basket Purse 2,Lanvin Brown Basket Purse 2
A-SC-GP-01,/gap-blue-bandhej-scraf-2.jpg,/gap-blue-bandhej-scraf-2.jpg,Gap Blue Bandhej Scraf 2,/gap-blue-bandhej-scraf-2.jpg,Gap Blue Bandhej Scraf 2,Gap Blue Bandhej Scraf 2
C-O-UCB-04,/united-colors-of-benetton-blue-&-white-star-print-sweater-2.jpg,/united-colors-of-benetton-blue-&-white-star-print-sweater-2.jpg,United Colors of Benetton Blue & White Star Print Sweater 2,/united-colors-of-benetton-blue-&-white-star-print-sweater-2.jpg,United Colors of Benetton Blue & White Star Print Sweater 2,United Colors of Benetton Blue & White Star Print Sweater 2
C-B-BIZ-01,/bizarre-dark-blue-whisker-washed-jeans-2.jpg,/bizarre-dark-blue-whisker-washed-jeans-2.jpg,Bizarre Dark Blue Whisker Washed Jeans 2,/bizarre-dark-blue-whisker-washed-jeans-2.jpg,Bizarre Dark Blue Whisker Washed Jeans 2,Bizarre Dark Blue Whisker Washed Jeans 2
C-T-BIZ-07,/bizarre-black-beaded-full-sleeves-top-2.jpg,/bizarre-black-beaded-full-sleeves-top-2.jpg,Bizarre Black Beaded Full Sleeves Top 2,/bizarre-black-beaded-full-sleeves-top-2.jpg,Bizarre Black Beaded Full Sleeves Top 2,Bizarre Black Beaded Full Sleeves Top 2
C-O-UCB-05,/united-colors-of-benetton-purple-round-neck-sweater-2.jpg,/united-colors-of-benetton-purple-round-neck-sweater-2.jpg,United Colors of Benetton Purple Round Neck Sweater 2,/united-colors-of-benetton-purple-round-neck-sweater-2.jpg,United Colors of Benetton Purple Round Neck Sweater 2,United Colors of Benetton Purple Round Neck Sweater 2
C-O-MNS-05,/marks-and-spencer-red-high-neck-sweater-2.jpg,/marks-and-spencer-red-high-neck-sweater-2.jpg,Marks and Spencer Red High Neck Sweater 2,/marks-and-spencer-red-high-neck-sweater-2.jpg,Marks and Spencer Red High Neck Sweater 2,Marks and Spencer Red High Neck Sweater 2
C-B-GP-20,/gap-grey-check-boot-cut-pants-2.jpg,/gap-grey-check-boot-cut-pants-2.jpg,Gap Grey Check Boot Cut Pants 2,/gap-grey-check-boot-cut-pants-2.jpg,Gap Grey Check Boot Cut Pants 2,Gap Grey Check Boot Cut Pants 2
C-B-IN-01,/inc-international-concept-black-pants-with-zip-detailing-2.jpg,/inc-international-concept-black-pants-with-zip-detailing-2.jpg,INC International Concept Black Pants With Zip Detailing 2,/inc-international-concept-black-pants-with-zip-detailing-2.jpg,INC International Concept Black Pants With Zip Detailing 2,INC International Concept Black Pants With Zip Detailing 2
C-B-MNS-45,/marks-and-spencer-dark-blue-5-pocket-denim-jeans-2.jpg,/marks-and-spencer-dark-blue-5-pocket-denim-jeans-2.jpg,Marks and Spencer Dark Blue 5 Pocket Denim Jeans 2,/marks-and-spencer-dark-blue-5-pocket-denim-jeans-2.jpg,Marks and Spencer Dark Blue 5 Pocket Denim Jeans 2,Marks and Spencer Dark Blue 5 Pocket Denim Jeans 2
C-T-GS-23,/guess-blue-knit-collar-shirt-2.jpg,/guess-blue-knit-collar-shirt-2.jpg,Guess Blue Knit Collar Shirt 2,/guess-blue-knit-collar-shirt-2.jpg,Guess Blue Knit Collar Shirt 2,Guess Blue Knit Collar Shirt 2
C-B-VM-14,/vero-moda-black-zip-leggings-2.jpg,/vero-moda-black-zip-leggings-2.jpg,Vero Moda Black Zip Leggings 2,/vero-moda-black-zip-leggings-2.jpg,Vero Moda Black Zip Leggings 2,Vero Moda Black Zip Leggings 2
C-B-VM-15,/vero-moda-navy-blue-pleated-pants-2.jpg,/vero-moda-navy-blue-pleated-pants-2.jpg,Vero Moda Navy Blue Pleated Pants 2,/vero-moda-navy-blue-pleated-pants-2.jpg,Vero Moda Navy Blue Pleated Pants 2,Vero Moda Navy Blue Pleated Pants 2
C-T-MNG-85,/mango-maroon-full-sleeves-top-2.jpg,/mango-maroon-full-sleeves-top-2.jpg,Mango Maroon Full Sleeves Top 2,/mango-maroon-full-sleeves-top-2.jpg,Mango Maroon Full Sleeves Top 2,Mango Maroon Full Sleeves Top 2
C-D-DP-08,/dorothy-perkins-black-&-white-dress-2.jpg,/dorothy-perkins-black-&-white-dress-2.jpg,Dorothy Perkins Black & White Dress 2,/dorothy-perkins-black-&-white-dress-2.jpg,Dorothy Perkins Black & White Dress 2,Dorothy Perkins Black & White Dress 2
C-B-VM-16,/vero-moda-black-chino-shorts-2.jpg,/vero-moda-black-chino-shorts-2.jpg,Vero Moda Black Chino Shorts 2,/vero-moda-black-chino-shorts-2.jpg,Vero Moda Black Chino Shorts 2,Vero Moda Black Chino Shorts 2
C-T-DP-12,/dorothy-perkins-navy-blue-top-with-lace-detailing-2.jpg,/dorothy-perkins-navy-blue-top-with-lace-detailing-2.jpg,Dorothy Perkins Navy Blue Top With Lace Detailing 2,/dorothy-perkins-navy-blue-top-with-lace-detailing-2.jpg,Dorothy Perkins Navy Blue Top With Lace Detailing 2,Dorothy Perkins Navy Blue Top With Lace Detailing 2
C-D-DP-09,/dorothy-perkins-plum-&-black-dress-2.jpg,/dorothy-perkins-plum-&-black-dress-2.jpg,Dorothy Perkins Plum & Black Dress 2,/dorothy-perkins-plum-&-black-dress-2.jpg,Dorothy Perkins Plum & Black Dress 2,Dorothy Perkins Plum & Black Dress 2
C-B-ZA-71,/zara-white-&-blue-heart-print-skirt-2.jpg,/zara-white-&-blue-heart-print-skirt-2.jpg,Zara White & Blue Heart Print Skirt 2,/zara-white-&-blue-heart-print-skirt-2.jpg,Zara White & Blue Heart Print Skirt 2,Zara White & Blue Heart Print Skirt 2
C-O-OY-03,/only-beige-puffer-jacket-2.jpg,/only-beige-puffer-jacket-2.jpg,ONLY Beige Puffer Jacket 2,/only-beige-puffer-jacket-2.jpg,ONLY Beige Puffer Jacket 2,ONLY Beige Puffer Jacket 2
C-B-FN-05,/forever-new-pink-&-blue-pleated-skirt-2.jpg,/forever-new-pink-&-blue-pleated-skirt-2.jpg,Forever New Pink & Blue Pleated Skirt 2,/forever-new-pink-&-blue-pleated-skirt-2.jpg,Forever New Pink & Blue Pleated Skirt 2,Forever New Pink & Blue Pleated Skirt 2
C-J-ZA-06,/zara-black-crossover-jumpsuit-2.jpg,/zara-black-crossover-jumpsuit-2.jpg,Zara Black Crossover Jumpsuit 2,/zara-black-crossover-jumpsuit-2.jpg,Zara Black Crossover Jumpsuit 2,Zara Black Crossover Jumpsuit 2
C-D-FN-13,/forever-new-blue-tube-dress-2.jpg,/forever-new-blue-tube-dress-2.jpg,Forever New Blue Tube Dress 2,/forever-new-blue-tube-dress-2.jpg,Forever New Blue Tube Dress 2,Forever New Blue Tube Dress 2
C-B-ZA-72,/zara-purple-&-white-printed-skirt-2.jpg,/zara-purple-&-white-printed-skirt-2.jpg,Zara Purple & White Printed Skirt 2,/zara-purple-&-white-printed-skirt-2.jpg,Zara Purple & White Printed Skirt 2,Zara Purple & White Printed Skirt 2
C-D-OXYG-02,/oxygene-black-&-white-printed-one-shoulder-dress-2.jpg,/oxygene-black-&-white-printed-one-shoulder-dress-2.jpg,Oxygene Black & White Printed One Shoulder Dress 2,/oxygene-black-&-white-printed-one-shoulder-dress-2.jpg,Oxygene Black & White Printed One Shoulder Dress 2,Oxygene Black & White Printed One Shoulder Dress 2
C-B-FN-06,/forever-new-white-straight-skirt-2.jpg,/forever-new-white-straight-skirt-2.jpg,Forever New White Straight Skirt 2,/forever-new-white-straight-skirt-2.jpg,Forever New White Straight Skirt 2,Forever New White Straight Skirt 2
C-D-ZA-60,/zara-black-spaghetti-strap-dress-2.jpg,/zara-black-spaghetti-strap-dress-2.jpg,Zara Black Spaghetti Strap Dress 2,/zara-black-spaghetti-strap-dress-2.jpg,Zara Black Spaghetti Strap Dress 2,Zara Black Spaghetti Strap Dress 2
C-D-H&M-18,/h&m-black-&-white-spaghetti-strap-maxi-dress-2.jpg,/h&m-black-&-white-spaghetti-strap-maxi-dress-2.jpg,H&M Black & White Spaghetti Strap Maxi Dress 2,/h&m-black-&-white-spaghetti-strap-maxi-dress-2.jpg,H&M Black & White Spaghetti Strap Maxi Dress 2,H&M Black & White Spaghetti Strap Maxi Dress 2
C-T-MNG-86,/mango-grey-sequins-tank-top-2.jpg,/mango-grey-sequins-tank-top-2.jpg,Mango Grey Sequins Tank Top 2,/mango-grey-sequins-tank-top-2.jpg,Mango Grey Sequins Tank Top 2,Mango Grey Sequins Tank Top 2
C-T-GP-16,/gap-blue-striped-spaghetti-strap-top-2.jpg,/gap-blue-striped-spaghetti-strap-top-2.jpg,Gap Blue Striped Spaghetti Strap Top 2,/gap-blue-striped-spaghetti-strap-top-2.jpg,Gap Blue Striped Spaghetti Strap Top 2,Gap Blue Striped Spaghetti Strap Top 2
C-T-FN-09,/forever-new-golden-&-brown-spaghetti-strap-top-2.jpg,/forever-new-golden-&-brown-spaghetti-strap-top-2.jpg,Forever New Golden & Brown Spaghetti Strap Top 2,/forever-new-golden-&-brown-spaghetti-strap-top-2.jpg,Forever New Golden & Brown Spaghetti Strap Top 2,Forever New Golden & Brown Spaghetti Strap Top 2
C-T-CK-16,/calvin-klein-black-sleeveless-drape-top-2.jpg,/calvin-klein-black-sleeveless-drape-top-2.jpg,Calvin Klein Black Sleeveless Drape Top 2,/calvin-klein-black-sleeveless-drape-top-2.jpg,Calvin Klein Black Sleeveless Drape Top 2,Calvin Klein Black Sleeveless Drape Top 2
C-D-FN-14,/forever-new-black-one-shoulder-dress-with-bow-2.jpg,/forever-new-black-one-shoulder-dress-with-bow-2.jpg,Forever New Black One Shoulder Dress With Bow 2,/forever-new-black-one-shoulder-dress-with-bow-2.jpg,Forever New Black One Shoulder Dress With Bow 2,Forever New Black One Shoulder Dress With Bow 2
C-T-VM-67,/vero-moda-white-blouson-top-2.jpg,/vero-moda-white-blouson-top-2.jpg,Vero Moda White Blouson Top 2,/vero-moda-white-blouson-top-2.jpg,Vero Moda White Blouson Top 2,Vero Moda White Blouson Top 2
C-T-BSK-13,/bershka-white-black-print-tank-top-2.jpg,/bershka-white-black-print-tank-top-2.jpg,Bershka White Black Print Tank Top 2,/bershka-white-black-print-tank-top-2.jpg,Bershka White Black Print Tank Top 2,Bershka White Black Print Tank Top 2
C-T-EHY-12,/ed-hardy-purple-printed-spaghetti-strap-top-2.jpg,/ed-hardy-purple-printed-spaghetti-strap-top-2.jpg,Ed Hardy Purple Printed Spaghetti Strap Top 2,/ed-hardy-purple-printed-spaghetti-strap-top-2.jpg,Ed Hardy Purple Printed Spaghetti Strap Top 2,Ed Hardy Purple Printed Spaghetti Strap Top 2
C-T-ADS-17,/adidas-black-polo-t-shirt-with-white-detailing-2.jpg,/adidas-black-polo-t-shirt-with-white-detailing-2.jpg,Adidas Black Polo T-Shirt With White Detailing 2,/adidas-black-polo-t-shirt-with-white-detailing-2.jpg,Adidas Black Polo T-Shirt With White Detailing 2,Adidas Black Polo T-Shirt With White Detailing 2
C-SU-WISH-01,/wishful-by-w-turquoise-kurti-with-black-embroidery-2.jpg,/wishful-by-w-turquoise-kurti-with-black-embroidery-2.jpg,Wishful by W Turquoise Kurti With Black Embroidery 2,/wishful-by-w-turquoise-kurti-with-black-embroidery-2.jpg,Wishful by W Turquoise Kurti With Black Embroidery 2,Wishful by W Turquoise Kurti With Black Embroidery 2
C-D-DP-10,/dorothy-perkins-peach-&-black-spaghetti-strap-dress-2.jpg,/dorothy-perkins-peach-&-black-spaghetti-strap-dress-2.jpg,Dorothy Perkins Peach & Black Spaghetti Strap Dress 2,/dorothy-perkins-peach-&-black-spaghetti-strap-dress-2.jpg,Dorothy Perkins Peach & Black Spaghetti Strap Dress 2,Dorothy Perkins Peach & Black Spaghetti Strap Dress 2
C-T-PD-45,/promod-black-waistcoat-2.jpg,/promod-black-waistcoat-2.jpg,Promod Black Waistcoat 2,/promod-black-waistcoat-2.jpg,Promod Black Waistcoat 2,Promod Black Waistcoat 2
C-T-S-11,/sisley-green-cutwork-shirt-2.jpg,/sisley-green-cutwork-shirt-2.jpg,Sisley Green Cutwork Shirt 2,/sisley-green-cutwork-shirt-2.jpg,Sisley Green Cutwork Shirt 2,Sisley Green Cutwork Shirt 2
C-T-VM-68,/vero-moda-maroon-full-sleeves-top-2.jpg,/vero-moda-maroon-full-sleeves-top-2.jpg,Vero Moda Maroon Full Sleeves Top 2,/vero-moda-maroon-full-sleeves-top-2.jpg,Vero Moda Maroon Full Sleeves Top 2,Vero Moda Maroon Full Sleeves Top 2
C-T-ZA-158,/zara-grey-&-pink-floral-top-2.jpg,/zara-grey-&-pink-floral-top-2.jpg,Zara Grey & Pink Floral Top 2,/zara-grey-&-pink-floral-top-2.jpg,Zara Grey & Pink Floral Top 2,Zara Grey & Pink Floral Top 2
C-T-ZA-159,/zara-black-&-white-striped-top-2.jpg,/zara-black-&-white-striped-top-2.jpg,Zara Black & White Striped Top 2,/zara-black-&-white-striped-top-2.jpg,Zara Black & White Striped Top 2,Zara Black & White Striped Top 2
C-T-OY-42,/only-pink-&-green-floral-top-2.jpg,/only-pink-&-green-floral-top-2.jpg,ONLY Pink & Green Floral Top 2,/only-pink-&-green-floral-top-2.jpg,ONLY Pink & Green Floral Top 2,ONLY Pink & Green Floral Top 2
C-D-CYJ-06,/chemistry-jeans-blue-dress-with-studs-2.jpg,/chemistry-jeans-blue-dress-with-studs-2.jpg,Chemistry Jeans Blue Dress With Studs 2,/chemistry-jeans-blue-dress-with-studs-2.jpg,Chemistry Jeans Blue Dress With Studs 2,Chemistry Jeans Blue Dress With Studs 2
C-T-AND1-14,/and-blue-&-white-printed-full-sleeves-top-2.jpg,/and-blue-&-white-printed-full-sleeves-top-2.jpg,AND Blue & White Printed Full Sleeves Top 2,/and-blue-&-white-printed-full-sleeves-top-2.jpg,AND Blue & White Printed Full Sleeves Top 2,AND Blue & White Printed Full Sleeves Top 2
C-T-MNG-87,/mango-grey-crossover-top-2.jpg,/mango-grey-crossover-top-2.jpg,Mango Grey Crossover Top 2,/mango-grey-crossover-top-2.jpg,Mango Grey Crossover Top 2,Mango Grey Crossover Top 2
C-T-KZ-14,/kazo-black-houndstooth-top-2.jpg,/kazo-black-houndstooth-top-2.jpg,Kazo Black Houndstooth Top 2,/kazo-black-houndstooth-top-2.jpg,Kazo Black Houndstooth Top 2,Kazo Black Houndstooth Top 2
C-D-UCB-11,/united-colors-of-benetton-black-pleated-dress-2.jpg,/united-colors-of-benetton-black-pleated-dress-2.jpg,United Colors of Benetton Black Pleated Dress 2,/united-colors-of-benetton-black-pleated-dress-2.jpg,United Colors of Benetton Black Pleated Dress 2,United Colors of Benetton Black Pleated Dress 2
C-B-H&M-15,/h&m-light-blue-jeggings-2.jpg,/h&m-light-blue-jeggings-2.jpg,H&M Light Blue Jeggings 2,/h&m-light-blue-jeggings-2.jpg,H&M Light Blue Jeggings 2,H&M Light Blue Jeggings 2
C-T-CYJ-15,/chemistry-jeans-maroon-top-with-silver-buttons-2.jpg,/chemistry-jeans-maroon-top-with-silver-buttons-2.jpg,Chemistry Jeans Maroon Top With Silver Buttons 2,/chemistry-jeans-maroon-top-with-silver-buttons-2.jpg,Chemistry Jeans Maroon Top With Silver Buttons 2,Chemistry Jeans Maroon Top With Silver Buttons 2
S-H-INC-04,/inc.5-black-boots-2.jpg,/inc.5-black-boots-2.jpg,Inc.5 Black Boots 2,/inc.5-black-boots-2.jpg,Inc.5 Black Boots 2,Inc.5 Black Boots 2
B-H-GS-10,/guess-pink-monogram-bag-2.jpg,/guess-pink-monogram-bag-2.jpg,Guess Pink Monogram Bag 2,/guess-pink-monogram-bag-2.jpg,Guess Pink Monogram Bag 2,Guess Pink Monogram Bag 2
C-T-MDE-09,/madame-purple-top-with-pink-detailing-2.jpg,/madame-purple-top-with-pink-detailing-2.jpg,Madame Purple Top With Pink Detailing 2,/madame-purple-top-with-pink-detailing-2.jpg,Madame Purple Top With Pink Detailing 2,Madame Purple Top With Pink Detailing 2
C-B-MDE-01,/madame-purple-&-black-checked-skirt-2.jpg,/madame-purple-&-black-checked-skirt-2.jpg,Madame Purple & Black Checked Skirt 2,/madame-purple-&-black-checked-skirt-2.jpg,Madame Purple & Black Checked Skirt 2,Madame Purple & Black Checked Skirt 2
C-T-ESP-31,/esprit-grey-sleeveless-top-with-pink-embroidery-2.jpg,/esprit-grey-sleeveless-top-with-pink-embroidery-2.jpg,Esprit Grey Sleeveless Top With Pink Embroidery 2,/esprit-grey-sleeveless-top-with-pink-embroidery-2.jpg,Esprit Grey Sleeveless Top With Pink Embroidery 2,Esprit Grey Sleeveless Top With Pink Embroidery 2
C-T-NE-19,/next-beige-wrap-top-2.jpg,/next-beige-wrap-top-2.jpg,Next Beige Wrap Top 2,/next-beige-wrap-top-2.jpg,Next Beige Wrap Top 2,Next Beige Wrap Top 2
C-B-NE-09,/next-blue-trousers-2.jpg,/next-blue-trousers-2.jpg,Next Blue Trousers 2,/next-blue-trousers-2.jpg,Next Blue Trousers 2,Next Blue Trousers 2
C-D-TS-01,/top-shop-brown-animal-print-dress-2.jpg,/top-shop-brown-animal-print-dress-2.jpg,Top Shop Brown Animal Print Dress 2,/top-shop-brown-animal-print-dress-2.jpg,Top Shop Brown Animal Print Dress 2,Top Shop Brown Animal Print Dress 2
C-O-OY-04,/only-light-blue-denim-jacket-2.jpg,/only-light-blue-denim-jacket-2.jpg,ONLY Light Blue Denim Jacket 2,/only-light-blue-denim-jacket-2.jpg,ONLY Light Blue Denim Jacket 2,ONLY Light Blue Denim Jacket 2
C-T-JN-10,/jane-norman-white-floral-top-2.jpg,/jane-norman-white-floral-top-2.jpg,Jane Norman White Floral Top 2,/jane-norman-white-floral-top-2.jpg,Jane Norman White Floral Top 2,Jane Norman White Floral Top 2
C-D-DSL-01,/desigual-blue-&-green-printed-dress-2.jpg,/desigual-blue-&-green-printed-dress-2.jpg,Desigual Blue & Green Printed Dress 2,/desigual-blue-&-green-printed-dress-2.jpg,Desigual Blue & Green Printed Dress 2,Desigual Blue & Green Printed Dress 2
C-T-AX-19,/armani-exchange-white-top-with-ruffle-sleeves-2.jpg,/armani-exchange-white-top-with-ruffle-sleeves-2.jpg,Armani Exchange White Top With Ruffle Sleeves 2,/armani-exchange-white-top-with-ruffle-sleeves-2.jpg,Armani Exchange White Top With Ruffle Sleeves 2,Armani Exchange White Top With Ruffle Sleeves 2
C-T-JCC-07,/juicy-couture-purple-&-black-printed-top-2.jpg,/juicy-couture-purple-&-black-printed-top-2.jpg,Juicy Couture Purple & Black Printed Top 2,/juicy-couture-purple-&-black-printed-top-2.jpg,Juicy Couture Purple & Black Printed Top 2,Juicy Couture Purple & Black Printed Top 2
C-D-NW-01,/nine-west-red-gathered-dress-2.jpg,/nine-west-red-gathered-dress-2.jpg,Nine West Red Gathered Dress 2,/nine-west-red-gathered-dress-2.jpg,Nine West Red Gathered Dress 2,Nine West Red Gathered Dress 2
C-T-FF-07,/109°f-black-&-pink-printed-top-2.jpg,/109°f-black-&-pink-printed-top-2.jpg,109°F Black & Pink Printed Top 2,/109°f-black-&-pink-printed-top-2.jpg,109°F Black & Pink Printed Top 2,109°F Black & Pink Printed Top 2
C-T-SEM-01,/self-esteem-blue-&-brown-printed-top-2.jpg,/self-esteem-blue-&-brown-printed-top-2.jpg,Self Esteem Blue & Brown Printed Top 2,/self-esteem-blue-&-brown-printed-top-2.jpg,Self Esteem Blue & Brown Printed Top 2,Self Esteem Blue & Brown Printed Top 2
C-T-SEM-02,/self-esteem-blue-floral-print-top-2.jpg,/self-esteem-blue-floral-print-top-2.jpg,Self Esteem Blue Floral Print Top 2,/self-esteem-blue-floral-print-top-2.jpg,Self Esteem Blue Floral Print Top 2,Self Esteem Blue Floral Print Top 2
C-T-XO-01,/xoxo-brown-&-black-printed-top-2.jpg,/xoxo-brown-&-black-printed-top-2.jpg,XOXO Brown & Black Printed Top 2,/xoxo-brown-&-black-printed-top-2.jpg,XOXO Brown & Black Printed Top 2,XOXO Brown & Black Printed Top 2
C-D-MJ-02,/monisha-jaising-blue-net-sequins-dress-2.jpg,/monisha-jaising-blue-net-sequins-dress-2.jpg,Monisha Jaising Blue Net Sequins Dress 2,/monisha-jaising-blue-net-sequins-dress-2.jpg,Monisha Jaising Blue Net Sequins Dress 2,Monisha Jaising Blue Net Sequins Dress 2
S-H-CARL-01,/carlton-golden-peep-toes-heels-2.jpg,/carlton-golden-peep-toes-heels-2.jpg,CARLTON Golden Peep Toes Heels 2,/carlton-golden-peep-toes-heels-2.jpg,CARLTON Golden Peep Toes Heels 2,CARLTON Golden Peep Toes Heels 2
C-B-MNG-32,/mango-black-denim-jeans-2.jpg,/mango-black-denim-jeans-2.jpg,Mango Black Denim Jeans 2,/mango-black-denim-jeans-2.jpg,Mango Black Denim Jeans 2,Mango Black Denim Jeans 2
C-B-MNS-48,/marks-and-spencer-dark-blue-jeggings-2.jpg,/marks-and-spencer-dark-blue-jeggings-2.jpg,Marks and Spencer Dark Blue Jeggings 2,/marks-and-spencer-dark-blue-jeggings-2.jpg,Marks and Spencer Dark Blue Jeggings 2,Marks and Spencer Dark Blue Jeggings 2
C-B-LS-22,/levis-green-shorts-2.jpg,/levis-green-shorts-2.jpg,Levis Green Shorts 2,/levis-green-shorts-2.jpg,Levis Green Shorts 2,Levis Green Shorts 2
C-T-MNG-89,/mango-pink-top-with-pleated-sleeves-2.jpg,/mango-pink-top-with-pleated-sleeves-2.jpg,Mango Pink Top With Pleated Sleeves 2,/mango-pink-top-with-pleated-sleeves-2.jpg,Mango Pink Top With Pleated Sleeves 2,Mango Pink Top With Pleated Sleeves 2
S-H-SM-13,/steve-madden-brown-boots-2.jpg,/steve-madden-brown-boots-2.jpg,Steve Madden Brown Boots 2,/steve-madden-brown-boots-2.jpg,Steve Madden Brown Boots 2,Steve Madden Brown Boots 2
C-D-JN-12,/jane-norman-grey-dress-with-buckles-2.jpg,/jane-norman-grey-dress-with-buckles-2.jpg,Jane Norman Grey Dress With Buckles 2,/jane-norman-grey-dress-with-buckles-2.jpg,Jane Norman Grey Dress With Buckles 2,Jane Norman Grey Dress With Buckles 2
C-T-NLK-06,/new-look-black-bolero-jacket-2.jpg,/new-look-black-bolero-jacket-2.jpg,New Look Black Bolero Jacket 2,/new-look-black-bolero-jacket-2.jpg,New Look Black Bolero Jacket 2,New Look Black Bolero Jacket 2
C-T-ESP-32,/esprit-red-&-white-striped-shirt-2.jpg,/esprit-red-&-white-striped-shirt-2.jpg,Esprit Red & White Striped Shirt 2,/esprit-red-&-white-striped-shirt-2.jpg,Esprit Red & White Striped Shirt 2,Esprit Red & White Striped Shirt 2
C-T-MNG-90,/mango-orange-full-sleeves-top-2.jpg,/mango-orange-full-sleeves-top-2.jpg,Mango Orange Full Sleeves Top 2,/mango-orange-full-sleeves-top-2.jpg,Mango Orange Full Sleeves Top 2,Mango Orange Full Sleeves Top 2
C-T-MNG-91,/mango-blue-top-with-ruffle-sleeves-2.jpg,/mango-blue-top-with-ruffle-sleeves-2.jpg,Mango Blue Top With Ruffle Sleeves 2,/mango-blue-top-with-ruffle-sleeves-2.jpg,Mango Blue Top With Ruffle Sleeves 2,Mango Blue Top With Ruffle Sleeves 2
C-B-M60-03,/miss-sixty-black-5-pocket-denim-jeans-2.jpg,/miss-sixty-black-5-pocket-denim-jeans-2.jpg,Miss Sixty Black 5 Pocket Denim Jeans 2,/miss-sixty-black-5-pocket-denim-jeans-2.jpg,Miss Sixty Black 5 Pocket Denim Jeans 2,Miss Sixty Black 5 Pocket Denim Jeans 2
C-O-MNG-16,/mango-black-peplum-jacket-2.jpg,/mango-black-peplum-jacket-2.jpg,Mango Black Peplum Jacket 2,/mango-black-peplum-jacket-2.jpg,Mango Black Peplum Jacket 2,Mango Black Peplum Jacket 2
C-T-TS-09,/top-shop-black-&-white-high-neck-top-2.jpg,/top-shop-black-&-white-high-neck-top-2.jpg,Top Shop Black & White High Neck Top 2,/top-shop-black-&-white-high-neck-top-2.jpg,Top Shop Black & White High Neck Top 2,Top Shop Black & White High Neck Top 2
C-B-LS-23,/levis-blue-denim-jeans-with-silver-detailing-2.jpg,/levis-blue-denim-jeans-with-silver-detailing-2.jpg,Levis Blue Denim Jeans With Silver Detailing 2,/levis-blue-denim-jeans-with-silver-detailing-2.jpg,Levis Blue Denim Jeans With Silver Detailing 2,Levis Blue Denim Jeans With Silver Detailing 2
C-B-NE-10,/next-light-blue-boot-cut-denim-jeans-2.jpg,/next-light-blue-boot-cut-denim-jeans-2.jpg,Next Light Blue Boot Cut Denim Jeans 2,/next-light-blue-boot-cut-denim-jeans-2.jpg,Next Light Blue Boot Cut Denim Jeans 2,Next Light Blue Boot Cut Denim Jeans 2
C-D-MNG-50,/mango-red-bodycon-dress-2.jpg,/mango-red-bodycon-dress-2.jpg,Mango Red Bodycon Dress 2,/mango-red-bodycon-dress-2.jpg,Mango Red Bodycon Dress 2,Mango Red Bodycon Dress 2
A-SC-MNS-01,/marks-and-spencer-pink-scarf-2.jpg,/marks-and-spencer-pink-scarf-2.jpg,Marks and Spencer Pink Scarf 2,/marks-and-spencer-pink-scarf-2.jpg,Marks and Spencer Pink Scarf 2,Marks and Spencer Pink Scarf 2
A-SC-NE-01,/next-purple-&-pink-scarf-with-sequins-2.jpg,/next-purple-&-pink-scarf-with-sequins-2.jpg,Next Purple & Pink Scarf With Sequins 2,/next-purple-&-pink-scarf-with-sequins-2.jpg,Next Purple & Pink Scarf With Sequins 2,Next Purple & Pink Scarf With Sequins 2
C-D-LAQU-06,"/latin-quarters-white,-black-&-blue-printed-dress-2.jpg","/latin-quarters-white,-black-&-blue-printed-dress-2.jpg","Latin Quarters White, Black & Blue Printed Dress 2","/latin-quarters-white,-black-&-blue-printed-dress-2.jpg","Latin Quarters White, Black & Blue Printed Dress 2","Latin Quarters White, Black & Blue Printed Dress 2"
C-B-UO-02,/uniqlo-mustard-jeggings-2.jpg,/uniqlo-mustard-jeggings-2.jpg,Uniqlo Mustard Jeggings 2,/uniqlo-mustard-jeggings-2.jpg,Uniqlo Mustard Jeggings 2,Uniqlo Mustard Jeggings 2
C-B-UO-03,/uniqlo-green-cropped-pants-2.jpg,/uniqlo-green-cropped-pants-2.jpg,Uniqlo Green Cropped Pants 2,/uniqlo-green-cropped-pants-2.jpg,Uniqlo Green Cropped Pants 2,Uniqlo Green Cropped Pants 2
